,0
1367,Tatiana: Ack! F-forgive me! It’s just that you’re so young and… young.
1368,Alm: Don’t worry about it. Tell us more about this “Zeke” person.
1369,"Tatiana: Ah yes! Zeke! Ezekiel! You’re on your way to Rigel Castle, right? Then you’re certain to meet Zeke on the Rigel Plains along the way. When that happens, don’t kill him! Don’t you DARE! His superior officer, Jerome, is a no-good, rotten lout. He and Nuibaba have brought immense suffering upon the locals. Zeke tried to stand up to Jerome and his wicked ways, but once I was taken captive, my love had no choice but to obey. If you tell Zeke I’m free, however, I know he’ll fight for what’s right."
1370,"Alm: All right, but this Zeke—er, Ezekiel— is a Rigelian solider, isn’t he? If he attacks us, we’ll have no choice but to answer in kind."
1371,"Tatiana: Aw, he won’t attack you. He’s a sweetie pie! Heck, he’s going to be over the moon about how you all saved me! In fact, I’m sure he’ll even come to your aid. He’s just that kind of man. *sigh*"
1372,Alm: You’re oddly…convincing. I actually believe you.
1373,"Tatiana: Of course you do! Just remember, no killing my sweet Zeke. Got it? I know you’ll get him out of his predicament. I just know it. Hey, wait a second… Why don’t I go WITH you? I just miss my love so much!"
1374,Tatiana: All right. Perhaps it’s for the best. I’ll just wait here for my love to return. It wouldn’t do him any good for me to wander off and get captured again.
1375,Tatiana: Hmm? Yes? So you want my company? Is that it?
1376,Cleric: Nuibaba gathered young and comely girls from all across Rigel. She made sacrifices of them—fed them to monsters to preserve her own youth.
1377,"Young Woman: Ooo! You’ve met Lord Berkut? You’re so lucky. He’s amaaaaazing. Every woman in Rigel wishes they could be his. *sigh* Alas, it’s an impossible dream, now that he’s to wed Rinea…"
1378,"Merchant: Oh, thank you for saving me! I’m but a humble merchant from a small village in the forest. On the way back from selling my wares, Tatarrah captured me and sent me here. I never thought I’d live to see the outside world again. But because of you, I’ll be able to see my family once more. My wife must be so worried! I had best be off. If you ever make it to our village in the forest, please stop by and say hello!"
1379,"Soldier: Jerome, sir? My report. The Deliverance forces will reach these plains momentarily."
1380,Jerome: Hmph. So the peasants made it here after all. Bring me Ezekiel!
1381,"Zeke: I’m here, sir. You have need of me?"
1382,"Jerome: The Zofian rabble will be upon us in due time. Prepare to intercept them. …And mind your allegiances wisely. If I smell even a whiff of betrayal, you know what will happen."
1383,Zeke: ……
1384,"Tatiana: Ah, Zeke! It’s you!"
1385,Zeke: Tatiana? But how?!
1386,Tatiana: It means you don’t have to heed another word Jerome says!
1387,"Zeke: Thank you, Tatiana. Now you have saved me as well. [to his soldiers] Men, set your sights on the target! We march on Jerome’s army! Prepare to attack!"
1388,Alm: You must be General Ezekiel.
1389,Zeke: How do you know my name?
1390,Alm: Tatiana told me about you.
1391,Zeke: You know Tatiana as well?
1392,Alm: We rescued her from Nuibaba. You should have no further cause to follow Jerome’s orders.
1393,"Zeke: I am reluctant to trust in these times. Yet, how else would you know all this? You have my thanks for saving her. Allow me to show my appreciation in deed as well as word. [to his soldiers] Men, set your sights on the target! We march on Jerome’s army! Prepare to attack!"
1394,"Jerome: You dare?! I didn’t think you fool enough to betray me, Ezekiel. You know what fate awaits the girl now that—"
1395,Zeke: She’s free. And now so am I. You’ve ground the people here under heel and threatened my love. Prepare to answer for your crimes!
1396,Zeke: Forgive me—it is not my wish to fight with you. I pray you’ll bear me no grudge in turn.
1397,"Zeke: Forgive me, Tatiana… Ah… Then you’re… Good. That’s…"
1398,Jerome: You upstarts have brought death upon yourselves!
1399,Jerome: H-how is this… I am a blue blood… A general! I’ll not lose to…such—
1400,Zeke: You must be Alm. Let me thank you again for helping Tatiana.
1401,"Alm: We’re happy to help, General. I heard you were opposed to this war. Will you lend us your strength? Not a man among us wishes this conflict to last any longer than it must."
1402,Zeke: …… I’m afraid I cannot offer you an answer here and now. There’s a village a ways ahead. I’ll await you there. Until then.
1403,Alm: Ah…
1404,"Man: Keep walking, you dastards! You’ll find no welcome here! You killed General Ezekiel, you…you monsters! He only sided with those scum because they took his woman hostage! In truth, he fought this whole time to shield us from Jerome and his tyranny."
1405,Young Man: …Hmph. What are you lot doin’ here? Emperor Rudolf’s a good man. A hero. Not that you lazy pigs over in Zofia’d know anything about it.
1406,Old-Timer: Hrmph… So you beat Jerome. A petty tyrant. Who cares for such deeds?! You’ll still never cross Mount Dragonsblight! Your proud little band will march right down a necrodragon’s gullet.
1407,"Young Woman: I always loved Ezekiel, I did, though I never had the courage to tell him… Fie on you all! I hope you rot in the belly of a necrodragon!"
1408,"Man: Oh, look who's here! Welcome! You don't have to feel uncomfortable. I don’t care what land you hail from! You got rid of that rotten Jerome, and that makes you a hero around here. He and Nuibaba from up Fear Mountain have caused us nothing but suffering. And who came to our aid? Not the emperor, nor the Duma Faithful! The only one who fought for us was General Ezekiel. Doesn’t matter who he was or where he’s from—he’s a good and noble man."
1409,"Young Man: I got no love for Zofia, but I s'pose I owe you a word'a thanks anyway. …Eh? Why do I hate Zofia? 'Cause I pour m'blood and sweat into workin' this here barren land, is why! You Zofians have Mila’s blessin' or bounty or whatever blasted thing it is. You eat yer fill without workin' a day! Life's just one big party for you lot… Makes me sick, it does. Pah!"
1410,"Old-Timer: Are you all headed to Rigel Castle? I see, I see… Perhaps that’s best for His Excellency as well. But the mountain ahead is cursed with a blight of fell beasts. Necrodragons spawn there without end, or so the travelers say. Even if you’ve the luck to elude them, eruptions often bury the path in stone."
1411,"Young Woman: Ezekiel says he has no memory of his past. Tatiana found him washed up ashore one day, badly wounded. She was nursing him back to health, when… Well, you’ve seen his face. Wasn’t a fortnight before she was in love. Don’t suppose I can blame her."
1412,"Zeke: We meet again, Alm."
1413,Alm: General Ezekiel. Have you given any more consideration to what we spoke of before?
1414,"Zeke: …… Now that I have turned my lance on Jerome, Rigel will not have me. But neither can I offer that lance to you. I still have no recolection of who I am or from whence I came."
1415,Alm: You've lost your memory?
1416,"Zeke: I have. All I know is that I washed up on the shores of Rigel grievously wounded. I was thrown in prison and accused of being a spy or worse. But Emperor Rudolf saved me. He gave me a name and took me in. He raised me as a father would his own son. And yes, I may have betrayed him… But never would I help you do him harm."
1417,Alm: I didn't know. I’m sorry. Forgive me for asking so much of you.
1418,Zeke: You are not in the wrong. *gasp* Alm! By the gods!
1419,Alm: Wh-what’s wrong?
1420,Zeke: Where did you get that mark on your left hand?
1421,"Alm: What, this? I don’t know, actually. I've just always had it."
1422,"Zeke: Is that so? Some time ago, Emperor Rudolf gave me what I thought was odd advice. He said that if I met a man with a mark on his left hand, I was to follow him. ""For that man is chosen,"" he said. ""He shall save all of Rigel."" ""And with it, all of Valentia."""
1423,Alm: That's…very strange.
1424,"Zeke: I agree. But now that I have met you, I must heed my emperor’s words. I am yours to command, my lord."
1425,"Zeke: I see. I would do as my emperor commanded, but if you are not of the same mind…"
1426,Zeke: Allow me to join my strength with yours. The emperor wished for this.
1427,Alm: ……
1428,"Gray: What's wrong, Alm? You get some bad pottage in the mess tent again?"
1429,Alm: Hmm? Oh… I was just wondering what this mark on my left hand really means.
1430,"Gray: No surprise, what with Zeke's speech about saving Valentia and all. ""He shall save all of Rigel. And with it, all of Valentia."" Heh. No pressure there!"
1431,Alm: No kidding…
1432,"Gray: Wait, you don’t actually BELIEVE what he said, do you?"
1433,"Alm: What? No. No, I don’t harbor any delusions of grandeur. But it's true that we're fighting to save Zofia, at the very least. So I got to wondering if that wasn’t part of helping all Valentia."
1434,"Gray: Huh. Yeah, I guess that makes sense… in a messed-up kind of way. Celica has one of those too, right? That mark?"
1435,Alm: She… Yes. She does.
1436,"Gray: So maybe you guys are destined to save the world together or…whatever. I mean, It has to be fate or something that the you two of you met, right?"
1437,"Alm: Fate? I don't know about that, Gray. It's a coincidence for sure, but…"
1438,"Gray: Kidding! I was kidding! …Sheesh, man. You're really starting to worry me here. If you don't laugh it off, it makes me sound like a lunatic for saying it."
1439,"Alm: Heh. Sorry. You’re right. I’m not sure about the rest of it, but me and Celica meeting really could be fate. …I'd like to believe it is, at any rate."
1440,"Clair: Heavens, what is that infernal noise?"
1441,"Alm: It sounds like… Earthquake! Everyone, take cover!"
1442,Celica: The tower is massive… Oppressive. Like Duma's power given form. What lies beyond the quest for ever-greater power? Perhaps that answer lies at the tower's peak.
1443,Jedah: Impressive. I did not expect all of you to make it here.
1444,Celica: Enough talk. I will see Mila now. Where is she?
1445,"Jedah: Keh heh heh… Such impatience is unseemly, Your Highness. And at any rate, I’m afraid Mila isn’t here. She’s underground—on Lord Duma's altar."
1446,Celica: I don’t understand.
1447,"Jedah: I can grant you sight, if you so desire. Gaze now upon your precious Earth Mother!"
1448,Celica: Oh no! What have you done?!
1449,Mae: Sh-she's been turned to stone!
1450,Conrad: Look there! Piercing her brow! Is that…Falchion?
1451,"Jedah: You have a keen eye, boy. It is indeed the divine blade. You will likely doubt me when I say this, but that was Mila's doing. The moment Emperor Rudolf sealed her power, Mila sealed away Falchion. Do not ask me her motive in this, for I understand it not. But no force in this world now remains which can harm Lord Duma. She's left her children to their fates! Kyaaaaaa ha ha ha ha!"
1452,Celica: No… This isn't possible!
1453,"Celica: Mila, I don’t understand. Why would you do this? Have you truly forsaken us?!"
1454,"Jedah: Heh heh heh, Your lamentations are wasted, child. If you truly wish for her release, you know what must be done. You must offer up your soul to Lord Duma."
1455,Boey: Did he just say what I think he said?
1456,"Mae: Offer her…soul? Oh gods! Celica, no! He wants to turn you into a witch! That is a REALLY bad idea!"
1457,"Celica: *sigh* There's no other choice. Without the divine dragons' power, all of Valentia's people are lost, and the only thing that can save the dragons is the soul of a Brand-bearer."
1458,Saber: So… that's what you couldn't tell us.
1459,Celica: [sadly] *sigh*
1460,"Conrad: Anthiese, you made me a promise, remember? You promised not to throw your life away again."
1461,"Celica: I'm sorry, Conrad. I'm sorry, everyone. Please forgive me… I can't tell you how much it means to me that we’ve come so far together."
1462,Conrad: Anthiese!
1463,Jedah: You lot are no longer necessary. Begone to wherever you will.
1464,Boey: Huh?!
1465,Mae: *screams*
1466,Celica: NO!
1467,"Jedah: Calm yourself, Your Highness. I've merely sent them below. As for your preparations, I fear they will take some time yet. You can while away the hours here watching the boy suffer."
1468,Celica: Alm? No!
1469,Alm: I don't believe it… That last quake cleared out some of the rocks—the road’s passable again.
1470,"Clair: Goodness! What a stroke of serendipity. Come now, Alm. Let’s hurry across before the next tremor hits."
1471,Alm: Right…
1472,Clair: Hmm? Is something the matter?
1473,"Alm: It feels strange, is all. A little TOO convenient. It's almost like I can feel someone's intent behind it."
1474,"Clair: An intentional rockslide? Really, Alm, you worry too much. Now chop chop! One mustn't dawdle. I'll await you on the far side."
1475,"Alm: …… I don't like this at all. I hope you’re all right, Celica…"
1476,Hestia: Why do you refuse Duma's truth? It is incomprehensible…
1477,Hestia: Why…? I've done…nothing wrong…
1478,Magnus: Honor demands I allow you to pass no further!
1479,Magnus: I am bested. You fight…well…
1480,"Alm: What a strange place this is: a secret shrine, closed off and hidden away from the eyes of man. What a strange place this is: a secret shrine, closed off and hidden away from the eyes of man. Why was it made? And to what end?"
1481,"Clive: This fortress is the last thing standing between us and Rigel Castle. Good news for us, but to them, it’s their last line of defense. And men always fight hardest when their backs are to the wall. Let’s take every precaution we can."
1482,Alm: Right. We only get one chance. We’ll make it count.
1483,"Slayde: Bwa ha ha ha ha! Marvelous! Welcome, ladies and gentlemen of the Deliverance!"
1484,Alm: Slayde?!
1485,"Slayde: Indeed! And I am dearly glad to see you again, boy. You really are full of surprises. To think a mere farmboy like you would become leader of the Deliverance. Or that you would now stand poised to claim the Rigelian Empire as well! It’s the stuff of legends, this is. Simply astonishing!"
1486,"Alm: Why are you here? Last I checked, you served Desaix."
1487,"Slayde: True…but that was in a former life, when I was still a knight of Zofia."
1488,Alm: What?
1489,"Slayde: You lot ran me out of the castle thanks to that clod Desaix’s incompetence. So…I defected to Rigel! Turncoat or no, they paid good coin for a noble’s intelligence on the enemy. They were SO grateful, in fact, they appointed me to captain this fortress!"
1490,"Clive: You lack even a modicum of shame, Slayde! How dare you call yourself a noble after trading away your pride!"
1491,"Slayde: Pride? Ha! Pride has never filled a man’s belly or warmed him in the snow. And while we’re speaking, Clive, let me tell you this: I’ve always despised you. You and your pathetic platitudes! Pride this… Honor that… Only a naif believes that righteousness will keep a man drawing breath!"
1492,"Clive: Which of us is truly naive, Slayde? You’re focused on naught but survival, yet…survival to what end? With no core belief to steel your spine, you turn tail at every shadow. Men broken by life’s unfairness who cast all principle aside will never triumph. You, Slayde, will never know victory. We will NOT lose to the likes of you."
1493,Alm: Clive…
1494,"Slayde: Nrgh… Silence… SILENCE! This is merely the desperate barking of a cur faced down by a lion! Well? Don’t stand there! Attack! Paint the halls red with Zofian blood! Silence their lies, even if it means cutting the tongues from their mouths!"
1495,Slayde: Impudent whelps… You’ll regret this!
1496,Slayde: Nrgh! Damn you… DAMN YOUUU!
1497,Mueller: I cannot allow you any closer to His Excellency the emperor. Prepare yourself!
1498,Mueller: Your Excellency… Forgive me…
1499,Rudolf: …Then the fortress has fallen.
1500,"Massena: It has, Your Excellency. I fear it’s a matter of minutes until the Deliverance reaches the castle doors."
1501,"Rudolf: Very well. We shall greet them with a sea of blades. I leave the rest to you, Massena."
1502,"Massena: As your will commands, Your Excellency."
1503,Rudolf: Now go.
1504,"Berkut: Your Excellency, wait!"
1505,Rudolf: Berkut.
1506,"Berkut: Sire, why have you not given me leave to join the front lines? I know I failed you at the border, but all the more reason I beg for this chance!"
1507,Rudolf: A merciful leader may grant a second chance. Only a fool allows a third.
1508,Berkut: Your Excellency!
1509,Rudolf: My army has no place for the weak. You’ll remain here and watch in quiet.
1510,"Berkut: No… Please, have mercy, sire! YOUR EXCELLENCY! UNCLE!!!"
1511,"Rudolf: Brave warriors of Rigel. You have fought with courage and skill at my side these long years. But the hour of reckoning is upon us. Our empire’s light is guttering. Now heed my words well! If I should fall, my final order is that you lay down your arms and surrender. I hear the young Zofian general is a man of mercy. If you have any love and loyalty for me, you’ll not waste your lives this day."
1512,Rudolf: ……
1513,"Alm: That’s Emperor Rudolf… This is strange… I’m not sure what I’m feeling at the moment. He’s caused so much suffering, and I know I should hate him, but…I can’t. Instead he just feels… I don’t know. Familiar, somehow?"
1514,"Gray: Alm! Snap out of it, will ya? This is no time for daydreaming. We’re at Rigel Castle’s doorstep, buddy. We need you focused. Now pull yourself together already! We didn’t come this far to lose here!"
1515,"Alm: A-ah, right. Sorry, Gray. All right, everyone. Let’s do this!"
1516,"Alm: What’s going on? Why won’t you attack? What are you planning, Rudolf?!"
1517,Rudolf: ……
1518,Rudolf: Come… Strike me!
1519,Rudolf: You’ve…done well… I’m proud of you…my son.
1520,Alm: …What?
1521,Rudolf: I knew I was right to entrust you to my dearest friend.
1522,Alm: Your friend… You mean…Mycen? What’s going on here? What are you saying?!
1523,Rudolf: I’d thought you’d have realized by now. Your true name… Your true name is Albein Alm Rudolf. You are…my one and only son.
1524,Alm: I… What? That can’t be true… You’re lying! Why should I believe a word you say?
1525,"Rudolf: Nnngh… Be still, Alm. I haven’t time left… to explain. But I beg you to grant me one… final favor."
1526,Alm: You want a favor from ME?
1527,"Rudolf: Take the Divine Falchion that… sealed Mila's strength… Duma has become a thing of mindless evil. Use the blade… Destroy him… Please, my son… You must— [dies]"
1528,"Alm: No, wait! Emperor Rudolf! Were you truly my father? Then I’ve just--- Oh, gods! What have I done?! [starts to cry then follows it with him screaming in agony, which is displayed as ""Aah... AAAAAAAUGH!""]"
1529,"Celica: Stop! Please, no more! Alm! How has it come to this?!"
1530,"Jedah: The boy will come to slay Lord Duma erelong. A fool's erand, I fear, without Falchion."
1531,"Celica: Alm is coming here? Please, you mustn't hurt him! My soul alone is all you need, yes?"
1532,Jedah: Oh? Then you will offer up your soul to Lord Duma willingly?
1533,"Celica: I will. If it saves Alm, I will surrender my soul gladly."
1534,"Jedah: (laughs) As you wish, Your Highness. Now, come with me."
1535,Soldier: L-long live His Excellency Rudolf II!
1536,"Archer: …Welcome home, Prince Albein!"
1537,Cavalier: I was present when Emperor Rudolf marched on the Temple of Mila. I know the blade he used to seal her power away—the Divine Falchion— had long been housed in the treasure vaults beneath Duma Tower. Though I fear I do not know what became of it after…
1538,"Massena: Welcome home, Prince Albein. I am Massena, captain of Emperor Rudolf’s imperial guard. His Excellency told me everything before facing you in battle. Afterward, I gathered the remnants of his forces and awaited your arrival."
1539,Alm: He told you…everything? Are you telling me he knew he was going to lose? That he expected to die by his own son’s hand?
1540,Massena: …I am afraid I cannot speak to His Excellency’s intentions. I humbly ask that you visit the throne and listen to what Sir Mycen has to say.
1541,Alm: Mycen is here?!
1542,"Massena: Please, my prince. Visit the throne and hear what Sir Mycen has to say."
1543,"Mycen: So you’ve come, Alm."
1544,"Alm: Grandfather... What the hell is going on?! What are you doing here?! Rudolf said I was his son, and now all these people are calling me a prince!"
1545,"Mycen: It’s only natural that you’re feeling confused. But there is no denying fact—you are the only son of Emperor Rudolf. Scion of the Rigelian imperial bloodline, and true heir to Rigel’s throne."
1546,"Alm: …How could you? You knew all this time, and yet you kept it from me…! You KNEW, and you still sent me off to kill my own FATHER!"
1547,"Mycen: Please remain calm, Alm. *sigh* Let me explain. …Best I start at the very beginning. As you well know, Valentia has always been divided north from south— split between the two gods, Mila and Duma. But their involvement with mankind eventually grew too deep. When madness takes a god, man is lost. And where gods meet ruin, men die too. That is the plight Valentia now faces."
1548,Alm: You’re saying the gods are…dying?
1549,"Mycen: I fear so. Rudolf was among the first to understand the signs. He saw Duma’s growing madness and knew it for a harbinger of ruin. But then you were born, Alm."
1550,Alm: What does that have to do with any of this?
1551,"Mycen: You bore the Brand—sign of the hero who would rise to save Valentia. Hearing that prophecy, Rudolf knew you must be kept hidden from the Faithful. He concealed the news of your birth, and entrusted you to me in Zofia. I will never forget the pain on his face when he placed you in my arms…"
1552,Alm: ……
1553,"Mycen: That day marked a change in him. He donned the mantle of one who would destroy the old world order— one who’d free men to live by their own power, even if they hated him for it. He knew such heresy would bring forth those who wished for his death. So for that death to come at the hand of his beloved son was…a mercy. He told me himself that he could imagine no more peaceful end."
1554,Alm: And what of my peace?
1555,"Mycen: This is not the time for mourning or self-pity, boy. Rudolf’s purpose now falls to you. The true foe you must defeat is Duma. As well as the zealots tainted by his madness who seek control of Valentia: Jedah, and his Duma Faithful. If you do not hurry, Celica’s life will also be in peril."
1556,"Alm: Oh, gods! Celica! She set out in search of Duma in order to save Mila."
1557,"Mycen: A passage beneath this castle leads to the Temple of Duma. Go, Alm. Go and finish this. Return the mad god Duma to the darkness... from whence he came."
1558,"Narrator: His whole story was a lie. Alm’s youth… His days of training with Mycen… All were but calculations in a far-reaching plot by his lord father, Emperor Rudolf. Alm had taken his father’s life, and that sadness would stay with him always. But destiny would not permit this son of the Brand to simply walk away. Valentia lay yet in the grip of Duma— the wicked god, the War Father—as well as Alm’s dear Celica, who would become Duma’s willing servant…"
1559,"*This is from the international version of Fire Emblem Echoes: Shadows of Valentia.
"
1560,"Avistym 402 V.C.
"
1561,"Berkut: It’s not possible… Alm is the emperor’s true son? Which makes him the rightful successor to the imperial throne. All this time… All the effort! What has it all been for?! …No. It isn’t true. It can’t be. I refuse to believe it. Nothing but lies... Lies, lies, lies, lies, LIES! [notices an erupting flame] Is that…an altar? How did I get here? What’s happening?"
1562,Duma's voice: Heed me…
1563,Berkut: Who are y—
1564,"Duma's voice: Heed me, you who thirst for power... Call to me. Accept me unto your soul."
1565,Berkut: That voice… Duma? Is it really you?
1566,"Duma's voice: (sighs which displayed as ""……"")"
1567,Berkut: What?
1568,Rinea: [offscreen] Lord Berkut!
1569,Berkut: Rinea…
1570,"Rinea: I’ve been looking all over for you. This is the last place I would have expected to find you. You always hated the Faithful, after all."
1571,"Berkut: This is true… But then I had the throne snatched from under me by some magical heir. Plying the gods’ mercies is what men do in hopeless situations, is it not?"
1572,Rinea: I didn’t mean-- Forgive me. I shouldn’t have said anything.
1573,"Berkut: (panting desperately which displayed as ""......"")"
1574,Rinea: Please don’t despair so. Alm seems a kind and generous man. I’m certain he’ll treat you fair.
1575,Berkut: And I’m to be content with that?!
1576,Rinea: Ah!
1577,"Berkut: I wanted to BEAT him, Rinea! To dispatch him and claim the throne! I wanted to make you my empress, and hold all Valentia in our palms together! But what of those dreams now?! Even Rigel alone is now forever beyond my grasp. So I’m to live in this Alm’s shadow? Throw myself upon his mercy?! I would sooner an honorable death at the executioner’s blade!"
1578,"Rinea: Berkut, you mustn’t say such things! I never-- The truth is, I never wanted to be empress."
1579,Berkut: *gasp* ...What?
1580,Rinea: To stand at your side is all I’ve ever desired. I don’t care if you’re the emperor or a swineherd so long as we-- Berkut?
1581,"Berkut: (in shock and sadness which displayed as ""..."") You too, Rinea?"
1582,Rinea: What?
