,0
868,"Celica: Is it really so naive? Zofians and Rigelians are both people of Valentia, are we not? I know we can reach some kind of accord if we just try. Besides that, I... I just can’t imagine Emperor Rudolf is the monster some claim him to be."
869,Alm: It doesn’t matter what sort of man he is. The Rigelian Empire chose to cross Zofia’s border—that’s a fact. We aim to drive back the invaders. Nothing more.
870,"Celica: But why do YOU have to lead this rebellion? Mycen’s grandson or no, you’re neither knight nor noble. So why make yourself a target like this?"
871,"Alm: Nrgh... If I didn’t know any better, I’d swear I was speaking to a blue blood. My station doesn’t matter, Celica. I’m here because I was called. I have a duty to perform, and I’ll perform it. No more, and no less."
872,"Celica: Oh, Alm…"
873,"Alm: Do you think I WANTED this fight? This all started because Lima IV went and angered the empire. If you wish to point fingers, point them at the ruler who failed his people. It’s his fault we’re in this mess."
874,"Celica: That’s not... Well, so what if it is? Maybe you should go become king if it’s such a damnably easy job!"
875,"Alm: What? Celica, that’s not—"
876,"Celica: You’re awfully free with accusations for a boy with no idea what royalty entails! And now that you’re a “hero,” I imagine the throne is next on the list, is that it?!"
877,"Alm: No, it’s not like that at all, Celica! I just want to keep Zofia SAFE! Besides, there’s an heir; a princess of the royal family may have survived. If she turned up and fixed all this, I’d happily return to Ram. You could…come with me, you know? It’d be like old times."
878,Celica: Come on! There’s no secret princess! The Zofian royal family is dead!
879,Alm: But how can you be—
880,"Celica: Enough! Just…enough. Go fight your war if it makes you happy! I’m going to the Temple of Mila. …Good-bye, Alm. You... you stubborn JERK!"
881,"Alm: Celica… You’re one to talk about stubbornness, geez... Ah, damn it all. I didn’t even get the chance to ask her about the village... About why she had to leave. Oh, Celica... I had so much I wanted to say to you. How did it end up like this?"
882,"Narrator: Alm and Celica’s heartfelt reunion was dashed by heated words, and once again, the two were parted. One chose the battlefield… the other, the Mother’s succor. And while they both sought to attain peace in their own way, their chances of finding it together seemed to grow increasingly slim."
883,Alm: Good. You’re all here. Let’s be on our way.
884,"Tobin: Uhm… Are you sure about this, Alm?"
885,Alm: Am I sure about what?
886,"Tobin: Oh, please. About Celica! You finally see her after gods-know how long, and you end up in a spat? Hey, don’t give me that look—we all know she took off in a right huff. You two used to be inseparable. What happened?"
887,"Alm: …That was a long time ago, Tobin. A lot’s happened—to both of us."
888,"Tobin: Hmm… Well, I’m no expert, but I think a normal person would just apologize. I’m sure she hasn’t gotten too far yet, what with those skinny legs and all…"
889,"Gray: Seriously, Tobin? Y-you’re passing out relationship advice now? Give it a rest—it’s not like every fight has a right side and a wrong side."
890,"Tobin: Get over it, Gray. I’m well aware of that! It’s just… Well, this could be the last time Alm and Celica see each other. You’d think they’d wanna part on a…less-sour note."
891,"Alm: It’s all right, Tobin. I appreciate what you’re saying. But this is something for me and Celica to work out on our own. Besides, I’m the leader of the Deliverance now. It wouldn’t be right to keep everyone waiting on my own private business."
892,Tobin: Alm…
893,Celica: *sigh*
894,"Mae: Celica! Hey, Celica!"
895,"Celica: …Hmm? I’m sorry, Mae. I was lost in thought. Did you need something?"
896,"Mae: Me? Naw, I’m fine like always. But what about YOU?! That guy leading the Deliverance is a friend of yours, right? I know we’re in a rush, but surely we had time for you to say good-bye!"
897,Celica: It’s fine. That isn’t necessary.
898,Mae: But Celi—
899,"Celica: Mae, I need to reach the Temple of Mila as soon as possible. I know the Mother will reveal a path to save Zofia that doesn’t involve violence."
900,"Mae: I dunno about this, Boey… Celica’s acting all weird. I wonder what happened?"
901,"Boey: Well, can you blame her? I’m sure she’s more than a little conflicted. If the Deliverance defeats Desaix and drives the empire back, what next? Zofia will need a ruler, and who better than a boy who cast off tyranny’s yoke?"
902,Mae: What?! But Celica’s the rightful heir!
903,"Boey: Yeah, but she can’t exactly just go and announce that to everyone. If she did, she’d be made to lead the Deliverance effort herself. Believe me, that’s the last thing Celica wants right now."
904,Mae: I hate it when you make sense. Boey. But that just means we have to haul tail to the Temple of Mila! The Earth Mother will know what to do. She’ll take care of everything!
905,Boey: I pray it’s truly so simple.
906,"Celica: Once we cross this mountain, we’ll finally reach the coast. It’s a hard climb, but I know we’ll make it."
907,Masked Knight: Hold. 
908,Celica: Hmm? Who’s there? 
909,Masked Knight: …… 
910,Celica: You’re the one from before! I’m glad our paths have crossed again. I’d hoped for a chance to properly thank you for helping us. 
911,Masked Knight: I’ve no use for thanks. I come bearing a warning: proceed no further here. 
912,Celica: What? I must know a reason for this warning. 
913,"Masked Knight: The terrain ahead is loose and prone to failure. Additionally, there are still forces in play who would see you harmed. If you must attain the Temple of Mila, strike west through the mountains."
914,Celica: West? But that’s where Alm… 
915,Masked Knight: You have been warned. 
916,"Celica: Wait, please! "
917,Mae: And he’s gone... AGAIN. I seriously wanna know who this creepy mask guy is and why he’s following us! 
918,"Celica: As do I, Mae. But regardless, this makes twice he’s aided us. "
919,"Boey: And with that dire warning ringing in our ears, what is your plan, milady? Do we follow Mr. Mask’s advice and take the western route? That would be quite a detour… "
920,"Saber: Do we have any cause to trust this masked fellow in the first place? Sure, he helped us out before, but that’s no guarantee of pure motive. "
921,"Mae: And what was that bit about, [imitating the Masked Knight] “forces in play who would see you harmed""? [normal voice] Is he saying MORE people are going to turn up and try to kidnap Celica?! "
922,"Celica: Hmm… No. We continue on as planned. I'm not dismissing what he said, but our purpose cannot brook delay. If we are attacked, I have faith we can prevail. Besides, even the cleverest trap will betray some sign to a watchful eye, so as long as we continue to be vigilant, we’ll be all right. "
923,"Arcanist: Hmph. And here she is at last. Do not mistake me for the base fools who came before. My power was bestowed upon me by Jedah himself. Now go, crush the girl and the pitiful insects accompanying her!"
924,Saber: Waugh! Earthquake?!
925,Mae: Gah! I c-can’t even stand!
926,Saber: Look out! The cliff is crumbling!
927,"Boey: Oh, you have to be joking! As if anything else could have gone wrong on this blasted adventure!"
928,"Celica: Everyone, be careful!"
929,Boey: Celica?! No! Don’t come any closer!
930,Boey: MILADY!!!
931,"Mae: Celica, are you all right?!"
932,Celica: (hurt grunt) …Huh?
933,Masked Knight: ……
934,Celica: Why did I suspect I’d see you again?
935,Masked Knight: Are you unhurt?
936,"Celica: It appears I am…thanks to you. I owe you an apology. You warned me this would happen, and yet I—"
937,"Masked Knight: Do not apologize, but stop allowing petty emotion to cloud your judgment. Your choices steer the fates of more than just yourself."
938,Celica: …You’re right. I can offer no rebuttal.
939,"Masked Knight: Still, there’s little sense in turning back when you’re almost through. The Zofian coast is just ahead. The road beyond should offer safe passage."
940,Celica: How can you be certain?
941,Masked Knight: My prey were kind enough to use magic potent enough to reveal their location.
942,"Celica: Gone again, as sudden as ever. I wish he would at least offer his name."
943,"Mae: Yeah, talk about your shady characters! Still, I s’pose he seems like a decent- enough guy."
944,"Saber: Yeah, well, Mr. Mask seems to enjoy our company. I wager we’ll see him again. And you’re sure you’ve got no guess as to who he might be?"
945,"Celica: None. I’ve no allies left in this world, save the ones I travel with now."
946,Saber: Oof… Didn’t mean to sour the mood. Forget I asked.
947,"Celica: It’s all right… But back to the matter at hand, the road is well and truly blocked now. I don’t think we’ll be heading back that way any time soon."
948,Boey: Then it’s a lucky thing we’ve no need to head that direction.
949,Celica: Now we couldn’t go to aid Alm even if we wanted to…
950,Boey: Milady?
951,Celica: It’s nothing. We’ve spent enough time here. Let’s press on.
952,"Alm: Whoa, what’s that sound?"
953,"Clive: The ground is unstable around here. There must have been another rock slide. Some distance off, from the sound of it. We’ve no worry of harm to our men."
954,"Alm: That’s good, but---"
955,"Mercenary: A report, sir. A cliff has given way along the eastern ridge. The route to the Zofian coast is blocked."
956,"Alm: The eastern ridge? That’s the direction Celica was heading. Oh, Celica, please be all right."
957,"Peddler: S’cuse me, sir! You’re Alm, yes? I’m a traveling peddler of sorts. Bit’o this and a scrap’a that. Occasionally, I even do deliveries! …Here. This is from a lady of the cloth. “Mila's Turnwheel,” she called it. Looks mighty fancy, so it does! That’s all I know, so you’ll have to figure out the rest on your lonesome. And with that…another job well done! Safe travels now, eh?"
958,Fernand: Mathilda…
959,Mathilda: Fernand? What are you doing here? Have you come to rescue me?!
960,"Fernand: No, milady. I fear I no longer serve the Deliverance."
961,Mathilda: What? What do you mean?
962,"Fernand: Exactly as I said. Sadly, Clive and I no longer share the same ideals. I have sworn my lance instead to Lord Berkut of the Rigelian Empire."
963,Mathilda: The general who leads our enemies? Has madness taken you?! A lance sworn to him is a lance through my heart. Don’t you care about Zofia?
964,Fernand: Zofia? You mean the proud kingdom whose riches fell to wild and ignorant savages? Zofia is dead to me. I have buried her and will not look back.
965,"Mathilda: How can you say such a thing, Fernand? You and Clive were like brothers. It’s not too late to fix this. Return to the Deliverance! I know Clive would welcome you back with open arms."
966,"Fernand: …With you by my side, I might have chosen differently."
967,Mathilda: Fernand?
968,Fernand: What is done is done. …Desaix intends to put you to death. It won’t be long now.
969,Mathilda: *gasp*
970,"Fernand: On the morrow, I depart for Rigel at Lord Berkut’s side. Farewell, Mathilda."
971,"Mathilda: Fernand, wait!"
972,Soldier: Chancellor! The rebels have reached the fortress!
973,"Desaix: And damn them for it. Why can’t that Clive see reason? He would sooner have me kill his woman than lay down arms? The obstinate fool! Ah, well. It seems she is of no further use to me. …Archers! Kill that wench in the cage, but do it slowly. I want her suffering to last."
974,Desaix: It seems I vastly misestimated you. I’ll grant you that. But today you vermin will die at my hands!
975,"Desaix: Damn you, Mycen… You think to…hand Zofia over to Rudolf’s pup…? T-traitorous dastard…!"
976,"Tobin: We did it, Alm! Desaix is finished!"
977,Alm: Yeah…
978,Tobin: Huh? What’s wrong? I thought you’d be thrilled.
979,"Alm: I AM thrilled, but… Desaix’s dying words have been troubling me. Something about my grandfather and Emperor Rudolf."
980,Tobin: Huh? You sure you’re not imagining things? What would Sir Mycen and the Rigelian emperor have to do with each other?
981,Alm: That’s what concerns me. Something’s been bothering me lately. Something I can’t shake. It feels like every victory I secure takes me one step further from Zofia.
982,"Tobin: Ha! Am I allowed to point out that that’s literally what’s happening? We’re a long way from Ram Village, kid. Look, I’m worried too. About my family, about everyone else we left behind… I miss them all terribly, so I get that you’re homesick. But that’s okay, Alm."
983,"Alm: Thanks, but…I’m afraid that’s not what this is, Tobin. This is…different. *sigh*"
984,"Tatarrah: Desaix has fallen… It is but a matter of time until the Deliverance reaches the sluice gate. Your moment to shine has come, my dear Delthea."
985,Delthea: (possesed moan)
986,Tatarrah: That traitor is certainly proving himself useful… Heh heh heh…
987,"Tobin: Whoa, look at this. Hey, Alm"
988,"Alm: You find something, Tobin?"
989,Tobin: I sure did. Feast your eyes on this baby! You think this is the treasure Desaix stole from Zofia Castle?
990,Alm: Well…it certainly looks important. Should we open it?
991,Tobin: Whooooooa! Check the sword! That is one impressive piece of hardware! I’m just gonna—
992,Tobin: Hng…! Whu… Huh? This thing weighs a ton! It won’t…budge…
993,Lukas: This must be the Royal Sword of Zofia.
994,Alm: What’s that?
995,"Lukas: Long ago, Rigel presented this sword to Zofia as a symbol of friendship. It’s a very special treasure—only one of royal blood can lift it."
996,"Alm: Hmm… Interesting. Here, Tobin—let me have a go at it."
997,"Tobin: You?! Pfft, please. If I can’t lift it, there’s no way that— Huh?!"
998,"Alm: Sometimes I don’t get you, Tobin. This thing’s light as a feather. Was this all some kind of jape? Who put you up to this?"
999,Tobin: But…but it wasn’t a jape! Zero japes! I thought my arms would snap just trying to lift it!
1000,Alm: Hmm. But that means…
1001,"Lukas: By the gods… You can wield the Royal Sword! …Hmm, what DOES that mean? Alm, are you…"
1002,"Alm: …… O-oh, come on. It’s just some legend. You don’t actually BELIEVE it, right? I’m sure everyone can use this thing! Well, except Tobin. And…um… Look, I’m sure the Zofian royals made up a story to keep folks from nicking it."
1003,"Lukas: …Well, that didn’t exactly work out now, did it? But perhaps you’re right. Tales do have a habit of getting taller with time. Either way, it seems clear the blade belongs with you."
1004,"Alm: Are you sure? I mean, we could have other people give it a shot."
1005,"Lukas: It wouldn’t work. You alone seem able to tame this legend. And we wouldn’t want to see so fine a treasure wasted, would we? Take it."
1006,Alm: Well…all right…
1007,"Alm: Clive, I’m… I’m so sorry about Mathilda. I couldn’t save her. I didn’t have what it takes."
1008,Clive: …No. You did not.
1009,Alm: Huh?
1010,"Clive: You have ruined everything! First you cost me my best friend, and now the woman I love is dead! Is that what you would have me say?! …It will not close these wounds."
1011,"Alm: Look, I’m…"
1012,"Clive: …… I wish I could stand by my choices, unwavering. I have always done what I thought to be right, even when my heart disagreed. But now I must face cold reality. I may have made a terrible error."
1013,"Alm: What are you talking about, Clive?"
1014,"Gray: Oh no. No, no, no. We’re not going down THAT old road now. Don’t you dare say that making Alm the Deliverance’s leader was a mistake. We’ve been through way too much to start in with second-guessing now!"
1015,"Tobin: Yeah! I mean, I know you lost so much, and that you’re hurting. But don’t take it out on Alm. He’s been doing as good a job as anyone!"
1016,Clair: The two boys will hold their tongues! My brother will not be subjected to your abuses!
1017,Tobin: Ah…
1018,"Clair: You are a loathsome cad, Gray. As are you, Tobin. Clive has just lost someone dear to his heart. If you possessed hearts yourselves, you would leave him in peace to grieve!"
1019,Tobin: B-but…
1020,Alm: Would you all please calm down?
1021,Tobin: But Alm—
1022,"Alm: Clive is clearly privy to some information he can’t share with us. Am I right, Clive?"
1023,"Clive: Alm, please…"
1024,"Alm: You’ve been acting strange for a while now. Whatever secret you’re harboring, I know it weighs heavy on you. I’ve been scared to broach the subject because I could sense it was about me."
1025,Clive: ……
1026,"Alm: But if nothing else, I want you to know this… I will always be grateful for the trust you have placed in me, and I will be honored for each moment I can fight for the Deliverance. She wanted to know why a nobody like me would risk so much to fight. The answer was, I just wanted to make a difference in people’s lives. I HAD to leave Ram Village. It was just a matter of when. When Lukas came to the village, that was my “when.” I want to repay that kindness. Clive, Lukas—let me help you. Let me help Fernand."
1027,Clive: Fernand? But he has insulted you at every step.
1028,"Alm: And I can’t claim to understand his motivations for all of that. But he helped you and Mathilda found the Deliverance, didn’t he? He’s part of the reason we’ve come this far. So he deserves my respect, no matter how he’s treated me in the past. If he returns to the Deliverance, I’ll gladly welcome him back."
1029,"Clive: You would do such? …Pray forgive me, Alm. I withdraw my words from before. But there are yet matters I need time to consider."
1030,Alm: Take all the time you need.
1031,Clive: Mathilda!
1032,"Mathilda: *gasp* Clive! Oh, how I have missed you, my sweet Clive!"
1033,"Clive: Forgive me, Mathilda. I should never have left you to suffer for so long. Speak now your loathing for me, and I will gladly bear it all."
1034,"Mathilda: Oh, stop your nonsense. You did what any commander ought. Your judgment was sound. And I bear the blame for my capture, not you. I was careless. So let us speak no more of blame."
1035,Clive: As you wish.
1036,"Mathilda: Good. Now, I wonder what comes next…"
1037,Clive: What indeed…
1038,Alm: ……
1039,"Gray: What a woman! Yowza! …Um, Alm? You’re blushing."
1040,Alm: Wh-What? No I’m not!
1041,"Mathilda: Ah, you must be Alm."
1042,"Alm: Y-Yes, milady."
1043,"Mathilda: I would not be alive if not for your fine leadership. I thank you from the bottom of my heart, Alm. And with your permission, I wish to take up arms at your side. Will you have me?"
1044,"Mathilda: Very well. I have confidence in my ability to fight, but will respect your judgment. Please come find me if you change your mind."
1045,Mathilda: Yes? What is it? I stand ready to fight for you. You need only speak the words.
1046,Mathilda: I saw Fernand. He visited me in my cell the other day.
1047,Clive: I see. Then you know what has transpired.
1048,"Mathilda: Yes. It feels like a different age when the three of us started the Deliverance. Though we were once brethren, we now must come to blows."
1049,"Clive: (sad sigh) I wish I could stand by my choices, unwavering. I have always done what I thought to be right, even when my heart disagreed. But now I must face cold reality."
1050,Mathilda: What do you mean?
1051,Clive: I may have made a terrible error.
1052,Alm: Huh? What are you talking about?
1053,Clive: (sad sigh)
1054,"Gray: Oh no. No, no, no. We’re not going down THAT old road now. Don’t you dare say that making Alm the Deliverance’s leader was a mistake. We’ve been through way too much to start in with second-guessing now!"
1055,"Tobin: Yeah! I mean, I know you lost a dear friend, and that you’re hurting. But don’t take it out on Alm. He’s been doing as good a job as anyone!"
1056,Alm: Would you all please calm down?
1057,Tobin: But Alm—
1058,"Alm: Clive is clearly privy to some information he can’t share with us. Am I right, Clive?"
1059,"Clive: Alm, please…"
1060,"Alm: You’ve been acting strange for a while now. Whatever secret you’re harboring, I know it weighs heavy on you. I’ve been scared to broach the subject because I could sense it was about me."
1061,Clive: ……
1062,"Alm: But if nothing else, I want you to know this… and I will be honored for each moment I can fight for the Deliverance. …You know, a friend once confronted me about this. She wanted to know why a nobody like me would risk so much to fight. The answer was, I just wanted to make a difference in people’s lives. When Lukas came to the village, that was my “when.” Don’t you see? Every one of you has set my life moving in ways I never imagined. I want to repay that kindness. Clive, Lukas, Mathilda—let me help you. Let me help Fernand."
1063,Clive: But he has insulted you at every step.
1064,"Alm: Oh, I’m well aware. And I can’t claim to understand his motivations for all of that. But he helped you and Mathilda found the Deliverance, didn’t he? So he deserves my respect, no matter how he’s treated me in the past. If he returns to the Deliverance, I’ll gladly welcome him back."
1065,"Clive: You would do such? I cannot speak for Fernand, but… Thank you, Alm."
1066,Alessio: What a mess I’ve gotten myself into…
1067,"Alessio: You see, Chancellor Desaix asked me to procure him a coral ring. But what happened when I acquired the coral shards and crafted the ring? The damned Deliverance came along and killed the buyer! I sunk all I had into this coral ring. If I don’t sell it, I’ll be ruined! Er…say. Do YOU want a coral ring? It’s crafted from the finest coral fragments a merchant can scrounge up! Since you seem woefully poor… Hmm… Well, I’ll cut you a deal and part with the ring for a mere 30 silver marks."
1068,Alessio: Then we have a deal! …And thank the Mother we do! Now I can finally go home.
1069,"Alessio: Hmph. Fine, skinflint!"
1070,"Alessio: Ho there, friend! Are you interested in the sale of the century? This is a coral ring made from only the finest coral fragments. And I am willing to part with it for the low, low price of 30 silver marks."
1071,"Soldier: The Rion Shield? No, I ain’t seen it. But I hear that Desaix sold off some of his plunder to Grieth."
1072,Alm: So this is the Zofian Sluice Gate… It’s massive!
1073,"Lukas: Indeed it is. And were it to collapse, the damage would be more massive still."
1074,Alm: Then we need to get it open before it’s too late.
1075,Tatarrah: Heh heh… So the Deliverance finally DELIVER themselves to me…
1076,Alm: Are you Tatarrah?
1077,"Tatarrah: The one and only. ermit me to introduce my new servant, as well…"
1078,Delthea: ……
1079,Alm: That girl…
1080,"Tatarrah: Go, Delthea! Put the fear of Duma back into these faithless fools. Smite them with your aura!"
1081,Alm: Aaah!
1082,Delthea: ENEMIES OF TATARRAH…MUST…DIE.
1083,"Clive: Alm, what are you doing? Snap out of it! Strike her down before she ends you!"
1084,Alm: No! I promised Luthier I would bring his sister home safe.
1085,"Clive: But Alm, you’re going to—"
1086,"Alm: Everyone, stay clear of Delthea’s magic! And whatever you do, do NOT kill her! That’s an order!"
1087,"Luthier: Alm! If we eliminate Tatarrah, that should release his hold on my sister. I beg of you—please help her!"
1088,Delthea: YOU HAVE DEFIED TATARRAH. I SHALL GIVE YOU DEATH.
1089,"Delthea: Ah… What am I…doing here? Luthier, are you there? It…it hurts…"
1090,Tatarrah: Heh heh heh… You imbeciles think yourselves a match for the mighty Tatarrah? Such a dire misjudgment cannot go uncorrected.
1091,Tatarrah: Wh-what…? Impossible… Father Dumaaa… Aaargh…
1092,"Delthea: …Huh? What am I doing here? LUTHIER! Brother, are you there?!"
1093,"Saber: …There ain't no one here. Where's this Earth Mother of yours hiding, lass?"
1094,Celica: I don't understand… Why isn't she here? She's supposed to be here!
1095,Irma: Princess Anthiese!
1096,Celica: Irma! Tell me what happened.
1097,"Irma: I beg forgiveness, Your Highness. I had no idea the temple fell to the empire while I was prisoner. They took Mila…and Your Highness's circlet as well. It's unthinkable. They're no knights— only blasphemers and thieves!"
1098,Celica: The Rigelians hold Mila captive?! You're certain of this?
1099,"Irma: I am, Your Highness. Emperor Rudolf led the charge himself. Sealed her powers and took her away. To where, I fear I know not."
1100,Celica: Rudolf himself…
1101,Cleric 1: Quickly!
1102,Cleric 2: Mother Mila! Intruders!
1103,"Cleric 2: Mother Mila, you must save us!"
1104,"Cleric 1: Mother, please!"
1105,Mila: This is Zofian soil. The Rigelian Emperor would do well to state his intentions.
1106,Mila: The Kingsfang...
1107,Rudolf: The Mother may deduce my intentions... from this blade; you know what it signifies.
1108,Mila: Indeed! [stands up from her chair] It means... you are in violation of the Accord!
1109,"Mila: Damn you, DUMA!!!!!!"
1110,"Saber: Now, hold on just a tick. We get to the temple and everything's taken care of. That was the deal."
1111,"Boey: Unfortunately, none of us expected the Mother to have stepped out. Nothing like this has ever happened before."
1112,"Mae: Well, I guess now we know why the soil’s gone barren. It’s been cut off from Mila’s bounty."
1113,"Boey: …… What do we do now, milady?"
1114,Celica: The only thing we can. We find the Mother and bring her back.
