,0
0,"*This is from the international version of Fire Emblem Echoes: Shadows of Valentia.
"
1,"Flostym 402 V.C.
"
2,"Alm: ""Once upon a time, there was a god named Duma and a goddess named Mila who fought each other bitterly for an age."""
3,"Celica: Hey, why did Mila and Duma have to fight so much? Couldn't they just say they were sorry?"
4,"Alm: Let’s promise we'll never end up like that, okay?"
5,"Celica: Yeah, nothing will ever come between us."
6,"Alm: Gods, no…"
7,"Alm: Don't leave me, Celica... You can’t!"
8,"Alm: Celica? Celica! Say something, please!"
9,Alm: CELICAAA!
10,Faye: …Alm? …Alm! *sigh* Where did he go this time?
11,"Gray: What's the matter, Faye? Don't tell me you’re after him again?"
12,"Faye: Oh! Hey, Gray. Say, have you seen Alm? I can't find him anywhere."
13,Kliff: Alm? Don’t waste your time looking for that guy.
14,"Faye: Kliff! …Wait, why not?"
15,Kliff: He and Celica went off for a stroll in the woods. I saw them leave.
16,Faye: He's with Celica? …Again?
17,"Gray: Exactly. Again?! I mean, Celica JUST moved to Ram Village, right? *sigh* Nice to know we're so easily replaced."
18,Faye: H-he's not replacing us. Celica's his cousin. Of course they’re gonna be close.
19,"Kliff: Uh, I hate to break it to you, Faye…"
20,Faye: Huh?
21,Kliff: Sir Mycen only has one grandkid. And that's Alm. Celica is his ward. Mother told me. They’re not related by blood.
22,"Gray: Kliff's ma, spoutin' gossip? *gasp* I don’t believe it! Still, I like where this story is going. Celica and her dark, unspeakable past…"
23,"Faye: Stop that, would you? So does this mean… I mean… Is Alm gonna marry her someday?"
24,Gray: Wha— Marry her?! Are we having the same conversation?
25,"Tobin: Ha ha! Ah, there you are! You guys'll never believe this!"
26,"Gray: Hey, Tobin. Believe what?"
27,"Tobin: Somebody saw a knight in the woods! A real knight! From the castle! Come on, let's go check it out!"
28,"Gray: What? Why would a knight come here? Big fan of manure or something? I'm not missing this! He could be the last knight we see for months…or years! Kliff, Faye! You coming?"
29,Faye: Yeah!
30,"Kliff: Huh? H-hey, wait up!"
31,Celica: Alm! Over here! Come look at this!
32,"Alm: What is it, Celica? You find something?"
33,"Celica: I made a wreath out of these flowers. Here, put it on!"
34,Alm: Wh-what? No!
35,Celica: Why not? I think it'd make you look very handsome.
36,"Alm: I think you mean ""very stupid."" Boys don’t wear wreaths."
37,Celica: Don't call it stupid! It took me a long time to make this. Fine then. Maybe I’ll just give it to Grandpapa instead.
38,"Alm: You're kidding, right?"
39,Celica: Grandpapa knows a manly wreath when he sees one…unlike SOME boys. Ha ha.
40,Alm: Har har. Very funny.
41,Celica: You're picturing him wearing it. Ha ha! Admit it!
42,Alm: …Heh heh.
43,"Celica: There’s the smile I was looking for. …Huh? What, is something wrong?"
44,"Alm: No, I just… I'm glad you’ve cheered up, is all. When you first came to the village, you always wore such a dark expression… Plus, you never spoke a word! Grandpapa told me to be nice, but I wasn't sure how to make things better."
45,"Celica: Well, I think you did just fine. Each story that you told me, each flower you picked for me, each walk you took with me here in the woods— that all made a difference, Alm."
46,"Alm: Come on, I didn’t do anything special."
47,Celica: Or maybe you did. I'm sorry that my first words to you were so unkind.
48,"Alm: Are you talking about when you called me a ""boor,"" or a ""clod""?"
49,"Celica: Hey, I said I’m sorry! I've just never had any friends my age. So I guess I wasn't used to boys like you."
50,"Alm: Well, I'd never met a girl like you, either. Don’t let it get to you."
51,"Celica: Say, Alm? Why are you so nice to me?"
52,"Alm: …Why? Do I need a reason? I mean, I guess it's because I never knew my parents, I have no siblings… and Grandpapa has always forbid me from setting foot outside the village. You're like a window to a world that I’ve never had the chance to know. Is that a good enough reason, or… …Oh, hey!"
53,Celica: What is it?
54,Alm: See this? We have the same mark.
55,"Celica: Um, yes? Except yours is on your left hand and mine is on my right…"
56,"Alm: Well, that makes us close! Er, doesn’t it?"
57,"Celica: Ha ha! I suppose it does, in a strange sort of way. I wonder why the marks are so similar."
58,"Alm: It's because they’re special. They prove that the two of us belong together. Always. That is, if you're not already tired of a clod like me making you laugh."
59,Celica: Of course not! So…do you mean it? We'll always be together?
60,Alm: Yes. I promise. Isn't that what you want?
61,"Celica: Yes, of course! You have my word, I'll never lea—"
62,Faye: [offscreen] Eeeeeek!
63,Alm: Huh? That was Faye!
64,Celica: Is she in trouble?
65,Alm: It came from beyond those trees. Come on!
66,Faye: Stop it! Let me go!
67,"Soldier: Heh… Looks like our luck's picked up, eh, Sir Slayde? After days of the same old trees, such cherubic faces are welcome indeed! After all, where little brats play… we’ll find a village, I say."
68,"Slayde: Listen well, you whelps. My men and I, loyal knights in service to His Majesty King Lima IV— may the powers bless him and his name until the end of days— hereby command you to lead us to your miserable line of hovels, where you shall have the honor of dining us and otherwise providing all comforts. It shall be an evening to remember. So lead on! And make haste, now."
69,"Tobin: B-but, we can't just... We'll get the scolding of our lives if we bring strangers to the village!"
70,"Gray: Good Sir Knight, if I may… Ahem! Our home is but a small village—to call it a line of hovels is too generous. We do not wish to offend you when you are clearly deserving of so much more. So please, we humbly implore your great mightiness to—"
71,Slayde: You. Boy. Have you an older sister?
72,"Gray: Er, me? I have two, actually. What about 'em?"
73,"Slayde: Ha ha ha! That’ll suffice! We’ll take all the food and drink you can muster—and your sisters can serve it! I wager we’ll get naught but pig feed and horse piss, but so be it. I shall force it down if I must."
74,Gray: Grrr…
75,Kliff: *sniff*
76,"Gray: Gods, Kliff, shut your hole! Don’t cry in front of ’em!"
77,Kliff: B-but Gray…
78,"Tobin: We should ALL be crying, Gray! We’re not really gonna take 'em to the village, are we?!"
79,"Gray: Hey, I don’t like it either! If I knew the royal knights were such royal turds, I never would've—"
80,"Slayde: Enough chittering, little squirrels, I am not a patient man! If you do not wish to entertain us the one way, you can entertain us the other. Perhaps we shall remove your tiny heads from your shoulders, one…by…one."
81,Gray: Aaaaah! 
82,"Slayde: You first, filly. Don’t worry, lass— I’ll make a nice, clean cut..."
83,Faye: No!
84,Alm: Back off!
85,Slayde: Ugh. How many whelps does this blasted village contain?!
86,Alm: Get away from my friends! You're not going to set one foot in our village!
87,Slayde: Is that so? Someone neglected to teach this mangy pup any manners… Hmm?
88,Celica: *gasp*
89,Slayde: [to Celica] You there! Girl! Show me your face.
90,Celica: No…
91,"Slayde: By the gods… It really IS her! Heh heh. How you came to walk among these animals is beyond me. Regardless, you shall make a fine prize to take back to General Desaix. [to his minions] Seize her!"
92,Celica: No… L-let me go!
93,Alm: Get your hands off her!
94,Slayde: Ooof!
95,"Gray: *gasp* Alm, you did NOT just punch a knight!"
96,Slayde: Urgh! You dare raise a hand to me?! You baseborn…barn-bred… So be it. You will stave off your death sentences no longer—especially you!
97,Alm: Ah!
98,"Slayde: Ha ha ha! The Mother can’t save you now, brat!"
99,Celica: Alm! Look out!
100,Alm: …Huh? *gasp* Grandpapa?
101,Slayde: What? Mycen?! What are you doing in a backwater wasteland like— …Ah. But I think I know.
102,Mycen: ……
103,"Slayde: Now, this…this is indeed good fortune. We never finished what we started in the flames that night, old man. I have much to repay you for. …I mustn't forget ALL my virtues, after all."
104,Mycen: …Children. Run to the cemetery up ahead. Go on now.
105,Alm: What? Why? What are you gonna do?
106,"Mycen: Now, Alm! All of you! RUN!"
107,"Alm: A-all right. Come on, guys!"
108,"Mycen: Listen well, children. We will drive these ruffians away, but you must follow my every command."
109,Alm: What? But we’re no match for them!
110,"Celica: ...You’re serious, Grandpapa?"
111,"Gray: He’s ALWAYS serious! It’s just that this time, he’s also crazy!"
112,Tobin: We can’t do this! Half a dozen children can’t win against mounted knights!
113,Faye: *cries* I…I want my mother...
114,Kliff: [sniffles] I wanna go home!
115,Mycen: ENOUGH!
116,Alm: ...!
117,Mycen: The only way you’re going home is by fighting as if your life depends on it! Alm! Celica!
118,"Alm: Uh, sir!"
119,"Mycen: I trust you two remember some of what I’ve taught you of the sword. Now, clear the mind, steady the hand, and show me what you’ve learned. Only you can get yourselves through this!"
120,"Mycen: Are you ready? I want you to follow my every command. First, get yourselves to a safer position!"
121,Mycen: Keep your distance from the enemy. Don’t try to pursue them!
122,"Mycen: Take shelter in the trees there. They can provide cover. Remember, always use the surrounding terrain to your advantage!"
123,Mycen: You’ve done all you can for now. Now brace for their attack!
124,Slayde: Damn! They nearly have me… But not today. I must return to the castle. General Desaix will be eager to learn that we have found…her. The princess who refuses to die. Heh heh heh…
125,"Alm: We did it! We actually did it! Look at 'em run, Grandpapa!"
126,"Gray: So, wait. HOW did we do that. exactly?"
127,Tobin: Ha ha! It’s all in the wrist.
128,Kliff: You wish. We only survived because we did exactly as Sir Mycen commanded.
129,Tobin: Oh yeah? Does that mean Sir Mycen commanded you to sob like a baby?
130,Faye: [pants for air] How can you guys joke about this?
131,"Alm: Grandpapa, Celica, that was great!"
132,Mycen: Mmm…
133,Celica: ……
134,"Alm: What? You’re not happy? We saved the village from those despicable knaves! We’re heroes! I mean, if nothing else, we’re not dead. You could at least crack a smile."
135,"Celica: Alm, you don’t understand."
136,"Mycen: Now that they know Celica is here, they will stop at nothing. It’s no longer safe for her to stay in the village."
137,"Alm: …What? But…why? It doesn’t have to be like that. Tell him, Celica!"
138,"Celica: I'm so sorry, Alm. I know that you would have kept your promise."
139,"Alm: Don’t apologize, Celica. Just… Just tell me that this is a mistake! That you don’t have to go!"
140,"Mycen: It is already settled. And we lack the time to discuss it further. Get back to the village and pack your things, Celica. Hurry."
141,"Celica: Yes, sir…"
142,"Alm: Hold on a second! Explain this to me, Grandpapa. Why are you making her leave? I want to know!"
143,"Mycen: No, my boy—I fear that’s a page you don’t want to turn. …Not yet, at any rate."
144,"Alm: Oh, great. Now you’re talking in riddles? I won’t let you do this to her! She needs me!"
145,Mycen: You? A foolish boy who won’t listen to reason? Celica has proven she has the strength to make hard choices. Yet what of you?
146,Alm: Please… Don’t take her away…
147,Celica: Alm… Would you mind looking after something for me?
148,Alm: *gasp* But this is… This is your good-luck charm. You never take this off! It’s…special.
149,"Celica: Yes, it is. And now it’s yours. I want you to keep it close always. As close as you would have kept me. My mother gave that to me. Not that I actually remember, but…"
150,"Alm: Celica, I can’t take this from you."
151,"Celica: You’re not taking it, I’m giving it. I pray that it keeps you safe. Take care, Alm."
152,Alm: Wait… Celica!
153,"Tobin: Well, this turned into a fine mess."
154,"Kliff: We don't know why she’s leaving, or even where she’s going. And whatever Sir Mycen knows, he isn’t telling the likes of us."
155,"Gray: Hey, not everything is our business. I just feel bad for her, you know? She and Alm are different from us."
156,Tobin: Different? In what way?
157,Gray: In every way.
158,"Mycen: Are you certain, Celica?"
159,"Celica: Yes. If I try to say good-bye to him, I’ll just end up crying. Grandp— Er, Sir Mycen? Where will I go next?"
160,"Mycen: Hmm… I have a place in mind. Perhaps it's time to call on an old friend. Under his care, I am certain your enemies will never find you. Forgive an old knight for failing you, Princess. Had the Mother willed it… I would have stayed by your side and protected you to my dying days. But I cannot leave Ram Village. Not yet."
161,"Celica: You don’t need to apologize, Sir Mycen. I regret nothing. The days I spent here with you and Alm were wonderful. The experiences I had and the friends I made all mean the world to me. You don’t have to be my shining knight, Sir Mycen— you just have to promise to always be my grandpapa."
162,Mycen: Of course.
163,Alm: CELICA!
164,Celica: *gasp* ...Alm?
165,Alm: Celica!
166,Celica: Alm! You came for me.
167,"Alm: I want to make a new promise. One day, when I’m older and stronger, I’m going to find you. It doesn’t matter where the world hides you or how long it takes. I promise to find you. So please…don’t forget me, okay?"
168,"Celica: I could never forget you, Alm. And I promise too. I’ll be waiting for the day we can meet again. But for now, I have to go. [to Mycen]…Grandpapa?"
169,"Mycen: Yes, child?"
170,Celica: …Do you think I’ll ever see him again?
171,Mycen: I do. So long as destiny wills it.
172,Celica: Destiny… So be it.
173,"Narrator: Once, the gods themselves walked these lands. Our continent of Valentia was home to two of them: sibling gods named Duma and Mila. The elder god, Duma, believed mankind must be ruled by strength, lest we become corrupt, while his sister, Mila, believed we should be free to pursue lives of pleasure and comfort. The two clashed ceaselessly. It was a long, dark age before the bitter conflict was resolved with the binding of a divine accord. Valentia would be divided in twain—with Duma ruling the north and Mila ruling the south—and in order to secure a lasting peace, each pledged never to violate the other’s dominion."
174,"Narrator: For millennia, this accord was honored, and peace did indeed reign. In time, the Kingdom of Zofia, which Mila founded in the south, prospered with the goddess’s love and blessings. Hers were a happy people who knew no toil and lived free of hardship, but Mila's gifts spoiled the Zofians, and it was only a matter of time before they sank into depravity."
175,"Narrator: Meanwhile, in the north, Duma had built his own empire. Tempered by harsh lands and the even harsher teachings of their fierce god, the people of Rigel had grown strong. But in their quest for power, the Rigelians had let their hearts grow cold and numb to all kindness."
176,"Narrator: Both halves of the continent were in a fragile state, and the cracks had begun to show. And now, Valentia lies on the cusp of a terrible war that could forever alter its history..."
177,"*This is from the international version of Fire Emblem Echoes: Shadows of Valentia.
"
178,"Mycen: Well done, Alm. We’ll end today’s training here. Your swordsmanship has come a long way. I’ve always known you had talent."
179,"Alm: You really think so? You’re not just saying that, are you, Grandfather?"
180,Mycen: Either I’m getting old or you’re getting better—and we both know I’m not old.
181,"Alm: Ha! Well, good. Then that means you’re ready to let me travel outside the village."
182,"Mycen: Hmph. Don’t misconstrue my words, boy. The rule still stands."
183,"Alm: But why?! I’m not a child anymore. You just said I can fend for myself! If I meet with any dangers, I’ll have my sword and my wits."
184,"Mycen: Alm, that’s not what this is about."
185,Alm: Then what IS it about?
186,Mycen: Alm…
187,"Alm: Look, I’ve heard from the others. I know the drought’s made Zofia a scary place. People are starving, and many have turned to thievery and plunder. Brigands loot villages for a mere sack of grain, and soon they’ll be at OUR door! And don’t think I haven’t heard what the Rigelian army has been up to. They’ve been crossing the border for years in violation of the Divine Accord. And with that sacred bond broken, now the Terrors have resurfaced as well…"
188,Mycen: …All true.
189,"Alm: Zofia is full of innocent people who are looking for help. Please, Grandfather. I want to make a difference in a world bigger than a handful of houses. I want to see all the amazing places you’ve told me about— that Celica told me about!"
190,Mycen: Suppose you do set forth with your sword and your wits. So what?
191,Alm: ……
192,"Mycen: Will the grand story of your life be how you met the end of a brigand's axe? Before you dream of changing the world, learn your damned place in it, and no more talk of leaving."
193,Alm: …What's his problem?! Why teach me to use a sword if you’re not going to let me fight? Every day in this place is exactly the same as the next. I know I’m meant for more than this! But you have to let me find it!
194,Alm: Huh? What's all the commotion? It’s coming from the gates. Hmm…
195,"Woman: Well, if it isn't Alm! You all finished with today's training? I still remember when you were only THIS tall, and now look at you. Sir Mycen has certainly made a strong young man out of you. I say ""Sir"" Mycen, but the story is your grandfather was once a famous general. General Mycen! Ha! I always wondered why such a fellow would end up here. Then again, the woods around Ram have become dangerous as of late. Perhaps it's for the best that we have him—and YOU—to keep us safe!"
196,"Young Woman: *sigh* What I wouldn't give for some food. It’s been years since we’ve had a proper harvest. Can’t grow much without rain… Why has Mila forsaken us? What’s happened to the Earth Mother? She's killing us by withholding her blessings. The Rigelian Empire will seize our lands and we’ll be too weak to resist… You've heard how well trained their soldiers are, haven’t you? We’ve never toiled or fought for a thing, and we’re about to pay for it…"
197,Young Man: It's good to know our plight has the nobility so grief-stricken. King Lima dances at the end of Chancellor Desaix's puppet strings. The king would rather eat grapes and frolic in a seraglio than actually rule. It's no wonder the kingdom’s being torn apart by rebellion after rebellion. I wish someone would come along and save us from ourselves already. …What's that? The Mother Mila? Pah! Like I'd waste my prayers on a goddess as useless as her.
198,Tobin: Alm! Hey. This fellow's here to see Sir Mycen. He was just about to tell us more.
199,"Gray: Sorry, pal, but I still can’t trust a man in full armor. Keep one hand on your hilt while you talk to this guy, yeah?"
200,Tobin: A knight—can you believe it? What's he doing in OUR village? You'd have to practically ride off the edge of the map to find this place!
201,"Kliff: He's sure come a long way just to find a whole lot of nothing… Whatever he’s here for, I hope he hasn't brought any trouble with him."
202,Faye: Alm! How was sword practice? Everything go okay? Sir Mycen is far too hard on you… I hope you don't have any new bruises!
203,"Lukas: Good day. You must be Sir Mycen's grandson. Alm, was it? My name is Lukas. I fight for the Deliverance."
204,"Alm: The ""Deliverance""? What's that? Aren't you one of the Knights of Zofia? The king's knights?"
205,"Lukas: Oh, I see. I suppose that means word hasn't yet reached your village. In that case, please forgive me for heralding such dark news, but… King Lima IV is dead. He met his end some days ago at the hands of Chancellor Desaix."
206,Alm: What? You're saying it was regicide?!
207,"Lukas: I fear so. It seems Desaix sold Zofia to the Rigelian Empire along with his soul. No doubt they promised him lands. Perhaps even a title. Upon Lima’s death, the chancellor and the Rigelian army seized Zofia Castle and began to visit unspeakable injustices upon the king’s people. Sir Clive—of the Knights of Zofia you mentioned—would have none of it. He formed an army to free us from Rigel and named it the Deliverance. However, we are outmatched and fast losing this war. We need a hero’s aid. And so I have come to the home of one of Zofia's greatest heroes: Sir Mycen."
208,"Lukas: Do you see, Alm? Sir Clive would not have sent me were it not urgent. Will you take me to see your grandfather?"
209,"Alm: Y-yes, of course."
210,"Gray: Good goblets… I knew Zofia was in hot water, but is this guy serious?"
211,Tobin: So there's going to be a war?
212,"Kliff: There already is one, from the sound of things."
213,"Faye: But that’s... that's awful! If Sir Mycen rides off to war, what'll happen to Alm?"
214,Kliff: You got me.
215,Lukas: *sigh*
216,Alm: Lukas! Were you able to speak with my grandfather? What did he say?
217,Lukas: He said no. Sir Mycen made it clear he has no intention of joining the Deliverance.
218,Alm: What? But he's ridiculously strong! He could defeat some stuffy chancellor with his eyes closed! Why would he refuse when so many people are suffering?
219,"Lukas: I cannot speak to Sir Mycen's thinking, but it seems we misplaced our hopes. I'll have to return to our hideout and bring Sir Clive the ill news. Perhaps Mycen has simply grown too old for the battlefield."
220,Alm: *gasp* ......!
221,"Lukas: It was good meeting you, Alm. I must be on my way. Thank you again for your assistance."
222,Alm: He's not old… He’s tougher than men half his age!
223,"Alm: Lukas, wait!"
224,Lukas: Alm? What is it?
225,Alm: I'll go. I'll join the Deliverance.
226,Lukas: You?
227,"Tobin: Alm, what the hell?! You can't do that! …Wait, CAN he do that?"
228,"Gray: I'll admit, you fight like a beast and they’d be lucky to have your sword, but this isn't sparring with your gramps, Alm. You're volunteering to go to war!"
229,"Alm: I know what it is. And if Grandfather won't do it, then I’ll do it for him. Consider my sword as his."
230,"Lukas: Alm, I understand how you feel, but—"
231,"Alm: Sir Mycen has been teaching me to use a blade since I was a boy. I've received tutelage in military tactics, medicine, weather, terrain… I know as much about war as any man who has never seen one can. Let me fight for you with my grandfather's gifts. I’ll prove he's no cowardly old man. He’s a warrior who trains warriors."
232,Lukas: Hmm… That might just work.
233,Alm: Huh? Then you mean…!
234,"Kliff: Oh, come ON! You can’t be serious!"
235,"Lukas: Why not? Alm presents a good case. He has a hero's blood in him. …And clearly a hero's fire. His presence is sure to raise the troops' morale. And for my part, I'm curious to see what a self-proclaimed warrior can do. Especially now that he’ll be doing it for the Deliverance."
236,"Alm: Thank you, Lukas… You won't regret this!"
237,"Gray: I've seen a lot of cake-taking in my day, but this REALLY takes the cake!"
238,"Faye: Alm, you should back out of this. It's far too dangerous! If anything were to happen to you, I'd… I mean… Just don't do it, okay?!"
239,"Alm: I'm sorry, Faye, but I’ve made up my mind. But…maybe all of you could come with me?"
240,"Faye: Er, what?"
241,Kliff: Splendid idea. Maybe we could all get impaled on the same lance.
242,"Alm: I'm just saying we could do it together. …Fighting, I mean. Not the lance. Grandfather trained all of us, right? Not just me. You already know how to use a sword and a bow. So what’s the problem?"
243,"Tobin: Alm, are you insane? We were sparring with wooden fences and tree trunks! They don’t hit back!"
244,"Gray: Oh, sod it all. I’m not as bright as I’d like to think I am, so, uh…count me in!"
245,Tobin: Gray! Not you too?!
246,"Gray: Me too, Tobi-poo. It’s better than waiting for Rigel to reach Ram and kill ""slash"" enslave us. Might as well bring the fight to them."
247,"Tobin: But you’re gonna— I mean, once they— [in frustration] ...Ugggh!"
248,"Lukas: You have my thanks, Gray. And the Deliverance welcomes you. In the end, we need every able fighter we can get. There will be much to learn, but I can teach you a great deal in battle. And you’ll be given a proper wage, of course."
249,"Tobin: Wait. You mean we get paid? As in, actual money?"
250,Lukas: Of course. Our soldiers work hard and sacrifice much. We would be remiss not to offer compensation.
251,"Tobin: I've got little brothers and sisters who could use that gold… Ma and Pa struggle to make ends meet, but if there’s a way to help… Hmm…"
252,"Alm: Tobin, you don't have to go if you don’t want to. Why don't you all take a little time to think about it? Let's split up for now and meet back here later. I need to go thank my grandfather and say good-bye."
253,"Lukas: Take all the time you need, Alm. You should pay your respects to Sir Mycen."
254,"Young Man: I heard what the knight said, but it sounds like a load of horse plop to me. Everyone knows it’s Zofia's fault that Rigel invaded in the first place. King Lima refused to help the Rigelian Empire during their famine, remember? And we all know the emperor didn't take too kindly to THAT little slight. Such a shame. The kingdom and the empire had been getting along so well. The king may be dead, but his choices live on. Ain't that always the way of it?"
