,0
720,"Claud: ...Tailtiu, please. Do try to mind your manners. This is a legendary magical staff with the power to restore life to the deceased. It is usable only be the direct descendants of Saint Bragi. That is to say, me alone."
721,"Tailtiu: Huh. So what you're saying is, with this rod you could bring my sweet old grandma back to life?"
722,"Claud: Alas, most likely not. Valkyria is limited in many particular ways, and so cannot be used on just any lost soul. You see, all of mankind is born bearing a life force called quintessence, which-"
723,"Tailtiu: Yaaawn... Er, what's that? You lost me. Why're you still talking about this, anyway? We've still gotta get outta here!"
724,"Claud: Ah, of course. Let us go."
725,"Sigurd: Good. We've subdued the pirate castle. Oifey, would you please gather our troops here? Now that this is all over, I'd like to ensure that everyone's alright."
726,"Oifey: At once, sire."
727,"Lombard: Is the army ready? Good. All units, move in! Apprehend the traitor Sigurd and his cohorts! Seize these vile allies of Byron, accomplices to his murder of Kurth and his bid to take over the kingdom! It is the will of His Majesty! No mercy for enemies of the state!"
728,"Reptor: Kehehe... Oh, Lombard. Such audacity! To think, he personally put an end to that miserable prince and nearly killed Byron for putting up a fight... I've never seen such a bold ploy! And with Arvis using His Majesty's trust, it all worked flawlessly! Convincing the king of anything is hardly a challenge, but to succeed with a tale of this scale takes quite the storyteller... And here we are, the the entirety of House Chalphy framed for the crime! Heh heh... Our victory is all but assured. The throne of Grannvale shall be mine, one way or another. I'll leave no pest who dares interfere with me alive..."
729,"Sigurd: What in blazes is this?! I'm a traitor now, and a Grannvale legion now waits at our doorstep to arrest me?!"
730,"Oifey: Sire, and to think, the war here was over at long last, and you were about to go and search for Deirdre."
731,"Sigurd: Gah... How could His Majesty have fallen for Reptor's lies? How could he possibly believe that my father, of all people, would kill Prince Kurth?! Aah... If only Father Claud had gotten back to the capital before they struck... Why?! Why is this happening?! I fought a pointless war, I let Eldigan die, and now this! What have I been fighting for all along?!"
732,Oifey: Sire...
733,"Annand: Lord Sigurd, I presume? I am Annand, a knight in the service of Silesse. Queen Lahna bade my corps and I to come and retrieve you. We invite you and your subordinates to retreat with us to Silesse, until your good name has been cleared in Grannvale."
734,"Sigurd: ...Queen Lahna of Silesse, you say? Why is Silesse willing to give aid to an alleged traitor like me?"
735,"Annand: Please, sir. Time is of the essence. The Grannvale assault is sure to begin at any moment now. My pegasus knights will escort you across the sea to safety in Silesse."
736,"Dew: Oh, whoa! This is that Tower of Bragi place, isn't it? Hee hee! Got a good thiefy feeling about this one! Let's see what it's got..."
737,"Dew: Mmm? Nope, nothin' over here. Over there, maybe? ...Aww, man! What a borin' little dump."
738,???: ...Who... Who are you...
739,Dew: Huh?!
740,???: ...State your business...
741,"Dew: Heh, maybe if I pretend I can't here 'em..."
742,???: How dare you... defile this sacred ground... ...BEGONE!
743,Dew: Kyaaa! S-sorry! Please don't hurt me!
744,"Dew: Hah... hah... What just happened?! ...Hang on. A sword? What's it doin' sitting around a place like this? Eh, who cares? Guess I'm gettin' something outta this after all!"
745,"Man: No matter how much I think about it, I just don't get why the Orgahil pirates have so suddenly turned on us like this. We could've sworn that boss of theirs was a good lass... Brigid or something, was it?"
746,"Old man: Oho! Glad to see ya've come. I got this 'ere sword for ya in 'preciation. They call it the wingslayer. It's enchanted to be lethal to sky-riders. If it flies, this sword'll bring it down. 'Course, if ya can't use it, sell it!"
747,"Politician: Oh? Here to help, are ya? Huzzah! The village is saved! We can't thank ya enough, but mayhap this magic staff'll help ya out. They call it a Restorestaff. If yer allies've been put t'sleep or silenced, one cast of this staff'll get 'em back on their feet. This oughta be a big help for ya."
748,"Woman: We're so glad to see you! Here, have a quick sip of our local special brew. For generations, it's made us all hardier!"
749,"Young woman (Sylvale has not been seized): Ah... the Cross Knights. Lord Eldigan's elite knightly battalion. Their might is legendary, and none in Jugdral can even compare to them. Actually... My boyfriend is a Cross Knight! Hee hee... amazing, isn't it? Don't be shy. Drink up! Well, how 'bout that? Feel the might swellin' in yer muscles! Oughta make yer work out there so much easier."
750,"Young woman (Sylvale has been seized): Sniff... I can't believe it. My boyfriend died in this blasted war. Damn the Grannvale army... No, no... Damn King Chagall! This is all his fault!"
751,"Young man: Hey, be careful out there! Rumor has it that King Chagall's got the infamous Thracian wyvern riders on his payroll. Don't think there's been a war lately where someone or other didn't hire 'em. They're like a pack of hyenas descendin' on fresh prey: brutal and indiscriminate. Nothin' survives in their wake..."
752,"Old woman: Oh, it's so nice to see visitors! How 'bout a little somethin' for yer troubles? Here, take a draught of our secret medicine."
753,"Woman: Ugh. I can't stand people like you who've nothin' better to do than start more wars! Why are you even here? We've absolutely nothin' to do with Agustria or Grannvale! Look. If you've really gotta fight, take it somewhere else, you thoughtless sod."
754,Lex: Ayra! Hey there.
755,"Ayra: Sigh... What do you want, Lex?"
756,"Lex: Sheesh! Courteous as ever, aren't you?"
757,"Ayra: Look, get to your point, whatever it may be. I've better things to do than waste time on you."
758,Lex: Hold on. I've got a little gift here. I thought of you the moment I saw it.
759,Ayra: You can foist it on some other woman. I've no use for such trinkets.
760,Lex: Heh... Not even something like this?
761,Ayra: Oh? ...Wait! That's-
762,"Lex: Ah, good! You're well acquainted with the famous brave sword, then."
763,Ayra: I never thought I'd see a real brave sword! Never have I seen a blade so beautiful...
764,"Lex: Glad you like it! It's yours. I guess I'll see you around, Ayra."
765,"Ayra: Er, Lex! Wait a moment!"
766,Ayra: Oh...
767,"Chulainn: Hey, Ayra! This is for you. Here."
768,"Ayra: Isn't this a brave sword? Why me, though? Shouldn't you be wielding this yourself?"
769,"Chulainn: This thing's only gonna get harder from here, yeah? You burn through blades so fast you could do with a spare or two. Look after yourself out here, okay? One day I might not be here to watch your back."
770,Ayra: Chulainn... Thank you. I promise I'll put it to good use.
771,"Ethlyn: Pardon me, dear... But I think I owe you an apology."
772,"Quan: Eh? What's happened, Ethlyn? By the look of it, it must be grave indeed..."
773,Ethlyn: Here. Take this.
774,Quan: A spear? ...What?! I-isn't this Gáe Bolg?! Why do you-
775,"Ethlyn: Your lord father entrusted it to me, Quan. He thought it prudent for you to have it at hand, in case our battles grew too fierce."
776,"Quan: Even just holding it, I've seldom felt so strong! Why did you wait till now, though?"
777,"Ethlyn: With the spear, your lord father also passed onto me its tale... I'm so sorry..."
778,Quan: ...Aye. Gáe Bolg bears the baggage of a truly sad legend. But that is all it is: a legend.
779,Ethlyn: But-
780,"Quan: Ethlyn, trust me. Triumph is within our grasp this day. I'll not fall victim to an old myth. I'll not let it stop me from returning home. Our dear little Altena still awaits us, and I'll not allow some fairy tale to disappoint her."
781,"Ethlyn: Yes... Quan, no matter what happens... We'll never lose each other... Right?"
782,"Quan: Ah, you're concerned about Deirdre, aren't you... There's nothing to worry about. It won't be long until we find her."
783,"Ethlyn: Yes... I want to believe she'll be okay, too. I wish I could believe it. But..."
784,Quan: Ethlyn? Come now! Dry your tears. Do you truly feel so bad about this?
785,"Ethlyn: I... Yes... Knowing th-that Sigurd and Deirdre may never meet again... Th-they love each other so... so much... Why, Quan... Why did this happen to them?!"
786,Quan: Ethlyn...
787,"Sigurd: Are you holding up okay, Brigid?"
788,Brigid: Huh? Who're you? Wait... How do you know my name?!
789,"Sigurd: The villagers told me of a woman who leads the pirates of Orgahil, and of her devotion to aiding the poor and weak. That would be you, correct?"
790,"Brigid: You must be that Grannvale man... Sigurd, right? Guess this is it. Come on. Just get it over with."
791,"Sigurd: Ahahaha! Oh no, you're mistaken! I'm certain not here to kill you. I just want to talk to you, Brigid. I'd like you to ally with us. We'd love to add your strength to our own, to help us better fight the pirates. What say you?"
792,"Brigid: Wait. You really want me, of all people?"
793,Sigurd: Certainly! You'd be a tremendous asset.
794,"Brigid: You're a strange little man, Sigurd..."
795,"Edain: Pardon me, but are you not... Yes! It is you! My sister! Brigid! I am Edain, your sister! Surely you recall me?"
796,"Brigid: What? How do you know my name? Hang on... You look just like me! Edain, huh... It sounds kinda familiar... But where from?"
797,"Edain: Brigid, listen well. I am your twin sister! We lost you to pirates years ago, when you were just five years old. I've searched for you for years. I never lost hope that we would meet again."
798,Brigid: This is all so sudden... No. Weird feelings like this aren't enough! I need proof!
799,"Edain: Proof, you say? Here. Draw this bow."
800,"Brigid: Huh? Okay, that's a nice bow and all, but what's it gotta do with anything? Guess I'll humor you. So I draw it and- ...Whoa! W-what's going on?! The hell is this...? I... What's this weird feeling boiling within me... Are these memories? Ah... my heart is on fire... Edain? Yes... I remember now! You're Edain... my sister."
801,"Edain: Oh, thank the gods! You remember! That bow is your birthright, Brigid. It is Yewfelle, the sacred bow of Yugvi. Legends tell that the exalted weapons of this land, such as this one, can only be wielded by a single heir per generation. For House Yugvi and Yewfelle, that rightful heir is you, Brigid. I trust this proof will suffice?"
802,"Brigid: Oh, Edain... Come here... Let me get a good look at you... How's our father doing? And our brother... Andorey, right?"
803,"Edain: I've so much to tell you, too... Brigid... My sister."
804,Midir: ...Lady Edain?
805,Brigid: Huh? Who're you? You don't look familiar.
806,"Midir: Oh, sorry! You're not her. My mistake. But then, that must make you..."
807,"Brigid: What's this you're mumbling about? Speak up, you weird little man!"
808,Midir: Er... May I ask your name?
809,Brigid: I'm Brigid.
810,Midir: Brigid... You're gorgeous...
811,Brigid: Excuse me?! You've gotta be joking!
812,Midir: I must be dreaming... There's another one... And she's even more beautiful!
813,Brigid: Ugh... That's it!
814,Claud: Lord Sigurd! I apologize for the wait.
815,"Sigurd: Father Claud, you're safe! We heard about how you ended up amidst all those pirates. Everyone was so worried."
816,"Claud: I'm glad Tailtiu was close at hand. We may not have survived, if not for her magic. More importantly, Lord Sigurd, my prayers to Saint Bragi were answered."
817,"Sigurd: You have the truth of all this, then?"
818,"Claud: That I do. As I thought, Duke Reptor is behind all of this. On his orders, it was Duke Lombard who killed Prince Kurth. The two then successfully framed your father, Lord Byron, for the crime."
819,Sigurd: Just as I thought...
820,"Claud: The pair's treachery runs deeper still. The murder of Isaach's King Mananan was also the handiwork of Duke Reptor. He feared a peaceful end to the war would end the sole excuse for the conquest of Isaach, so he secretly had the king killed."
821,Sigurd: Is that so... Reptor's grubby hands are all over this mess...
822,"Claud: Not quite. In the shade of his avarice, there's something else at work... Something unsettling and terrifying. Not even Lord Bragi could scry this evil presence, obscured by its power as it is."
823,"Sigurd: An evil presence? Could it be that dark priesthood... Wait! What of my father, Claud?"
824,"Claud: Lord Byron yet lives, but is injured and weak. I fear he is not long for this world..."
825,Sigurd: Father... This can't be happening...
826,"Claud: I'll hasten back to the capital. His Majesty needs to hear the truth. Lord Sigurd, for the time being, stay here and restrain yourself from rash action."
827,"Sigurd: Understood. I can't thank you enough, Father Claud. I beg of you, do everything you can. Save my father and his good name."
828,Claud: Our fates lie with the mercy of the gods...
829,"The reason given was: Needs more html markups as seen on Birth of a Holy Knight/Script.
"
830,"Generation 1
"
831,"Chapter 4: Dance in the Skies
"
832,"The unthinkable has come to pass. Sigurd is now a traitor in the eyes of his beloved Grannvale. In desperation, his army flees to find refuge in the northern Kingdom of Silesse. Silesse was founded by the Wind Crusader, Ced. It lies under the watchful guard of the valiant pegasus knights and wind mages, and so for over a century since its foundation, Silesse has maintained itself as a neutral nation and persistent all invaders. However, ever since the death of its king several years ago, the royal family has been plagued with strife over its inheritance, and shades of war creep over the peaceful land. The late king and his wife, Queen Lahna, had a single son, Prince Lewyn. The king's greedy younger brother, Duke Daccar, objects to Lewyn being heir to the throne and has confined himself to Zaxon Castle in protest. As if acting in concert, the king's youngest brother, Duke Myos, has set to work raising an army for himself at Tófa Castle. Out of disgust at his uncles, Prince Lewyn left Silesse to travel the world years ago. Is there no end to the dukes' avarice? Their lust for power will condemn Silesse, a beautiful and majestic land, to the searing ravages of a brutal war.
"
833,"Turn 1 – Enemy Phase
(Cuvuli’s wind mage squad)
"
834,"Annand Gets Near Pamela
"
835,"Andrey’s Squad Conquers Silesse
"
836,"Saving Civilians
"
837,"
"
838,"Villager: The drawbridge over Tófa River is under the control of Lord Myos. If it’s not down, and you don’t have a key, you’re not getting across. But I bet if you had someone handy along like a thief, you might be able get it down.
"
839,"Villager: Huh… The bridge is already down? How did you know how to do that?
"
840,"Second Most Northeastern village (Silvia’s Dance)(If you enter with someone else than Silvia)
"
841,"Oifey: Sire, Queen Lahna is here to see you."
842,Sigurd: Queen Lahna?
843,"Lahna: Good evening, Lord Sigurd. Are you comfortable settled into Sailane yet? Is there anything at all that you need?"
844,"Sigurd: As much as I appreciate the offer, we're fine. I can't thank you enough for your hospitality, Your Highness."
845,"Lahna: I know Sailane is perhaps too small to house all of you adequately, and I'm sorry, but please, bear with me for a while longer... I'm doing all I can to hasten your liberty. I've sent letter after letter to Belhalla to advocate for your innocence. As of yet, however, I've still heard nothing at all from King Azmur."
846,"Sigurd: This... This has to be Reptor's doing! First he betrays my father, and now he's stopping all of your letters! He must be!"
847,"Lahna: Calm yourself, Lord Sigurd! I know well the pain you're feeling, but you cannot let your grudges rule you. Your anger will not save your father. Hatred will only destroy you from within. I swear to you, I can and I will find a way to set this to rights, but you must be patient."
848,"Sigurd: You're right... I'm sorry, Your Highness. I really appreciate all you've done for me."
849,"Lahna: It's alright, Lord Sigurd. Oh, before I forget... There actually has been some good news from Grannvale of late."
850,"Sigurd: Good news, you say?"
851,Lahna: Mm. A previously unknown daughter of Prince Kurth has been discovered. All of Grannvale is rejoicing at the news.
852,Sigurd: Huh?! Is that even possible?
853,"Lahna: It took King Azmur only a glance to recognize her true heritage. She bears the brand of Naga, the proof of a true heiress to House Belhalla. There is no doubt. She is Kurth's child."
854,"Sigurd: I see... Thank goodness. At the very least, this means the royal lineage won't go extinct."
855,"Lahna: That's not all. The princess and Duke Arvis are in a relationship. King Azmur has given his blessing, and a magnificent wedding will soon be held."
856,Sigurd: Arvis? Really?
857,"Lahna: All who've seen the happy couple eagerly attest that this beautiful princess and Duke Arvis are perfectly matched together. To say nothing of how happy the couple is said to be! Young love is wonderful, isn't it? ...Oh. Lord Sigurd, I'm so sorry. I forgot. Your wife is still-"
858,"Sigurd: Deirdre... My wife's still gone, yes... It's been over a year since she vanished. She's missed an entire year of watching Seliph grow up."
859,"Lahna: I'm so sorry, Lord Sigurd, but cheer up. I know you'll reunite someday."
860,"Sigurd: You're right. I feel it, too. I can't give in to sorrow just yet. I can't give up on finding her."
861,"Annand: Pardon me, milady, but the hour is late. We should be on our way soon."
862,"Lahna: Ah, of course. I'll be with you in a moment. Lord Sigurd, one last thing... Beware of Duke Myos of Tófa. I regret to say that my brother-in-law has long hungered to claim Sailane for himself. It's only a matter of time till he goes so far as to attack you. I wish I could provide you with reinforcements, but..."
863,"Sigurd: ...I know. The capital is under the very same threat from Duke Daccar of Zaxon. You cannot afford to weaken your own guard. Daccar will pounce upon you given even a hint of weakness. Don't worry about it, Your Highness. There's nothing the Tófa army can throw at us that we can't handle."
864,"Lahna: Ah, of course. I should be more confident in such veteran heroes as yourselves. Oh! I've been talking for so long, I lost track of the time. Take care, Lord Sigurd."
865,"Sigurd: You, too, Your Highness. Thank you."
866,"Lewyn: Mother! Aren't you forgetting somebody? You've just chatted for hours and hours with Sigurd, yet you can't even acknowledge your own son?"
867,"Lahna: My son? The one who abandoned me two years ago, going gods know where? How do I talk to someone who's clearly not here?"
868,"Lewyn: Heh heh... So this is how it's going to be, is it? You're still mad at me, then?"
869,"Lahna: Of course I am! Do you have any idea how hard it was without you, and how worried I've been after you? That my own son could be so cold-hearted... I thought I knew you better than this."
870,"Lewyn: Look, I know you're upset, but I had my reasons for all this. But come on, I'm home safely! Surely that counts for something and you can forgive me? I swear I'll make up for it and be the very picture of a good son. Hey, how about I give you a shoulder massage to start?"
871,"Lahna: Oh! What nerve! Treating me as if I'm an old crone... Look, Lewyn, there are more pressing matters which we need to talk about, and soon. Come to Silesse as soon as possible. Do not forget! Do I make myself clear?"
872,Lewyn: ...Sigh. I thought she'd never stop.
873,"Annand: Don't be fooled by your mother's outward behavior, milord. She's actually very happy, now you've returned. Indeed, she hasn't been anything as cheerful as this since before you left."
874,"Lewyn: Thanks, Annand. Knowing you're at her side is a big relief. Look after her, okay?"
875,"Annand: Yes, sir! Rest assured, I will protect the queen with my life, on my honor as the captain of the Silessian pegasus knights."
876,"Lewyn: Thanks. Oh, one more thing... Are you gonna leave Erinys here with Sigurd?"
877,"Annand: I am... Milord, I'd like you to keep my sister at your side. She-"
878,Erinys: Annand!
879,"Annand: Oh. Eavesdropping, were you, Erinys?"
880,"Erinys: You were about to tell him too much, so..."
881,"Annand: Ah. My apologies, Erinys. There are things he shouldn't know just yet, of course... Erinys, I'll be leaving with Queen Lahna and returning to Silesse Castle shortly. You'll stay here and keep and eye on Prince Leywn. Best of luck."
882,"Erinys: Thank you, Annand."
883,"Quan: Sigurd, we'll now be taking our leave. It's high time we returned to Leonster. Rest assured, we'll be back, this time leading the full military might of Leonster to your aid. May that day come soon, my friend."
884,"Ethlyn: I'm going with Quan, Sigurd. Don't worry, though. We'll be back before you know it! Take care of yourself."
885,"Finn: By your leave, sir, I'll be departing with my lord. Thank you for all you've done for us. Don't give up, sir. One day, I know, the charges against you will be cleared and your good name restored. I know you can do this."
886,Sigurd: Thank you. You've got quite the journey back to Leonster ahead of you. I wish I could do more to help you on your way. May your journey be a safe one!
887,"Finn: Sir, thank you for everything. I’m heading back to Leonster to help Quan assemble some reinforcement troops. I know you’ll be cleared of that false accusation soon. Stay strong and persevere."
888,Sigurd: Thanks. You’ve got a long trip ahead of you. I wish I could help you out somehow… I’ll be praying for your safety.
889,Myos: Díthorba! Is the army ready to deploy yet?
890,"Díthorba: Yes, sir. Bishop Cuvuli's wind mage unit has infiltrated the forests near Sailane. They await your command, sir."
891,"Myos: Very well. Relay my orders to Cuvuli: move in on Sailane! Díthorba, I trust your pegasus corps are already briefed on your mission?"
892,"Díthorba: Yes, sir. Our task is clear. My squadron is to raid the enemy from above, disrupting their tactics."
893,Myos: Good. Now get to work! Grannvale will owe us a handsome reward for bringing them the heads of their infamous traitors! Heh heh heh...
894,"Cuvuli: There's the signal to assault Sailane, as planned. I trust you're all ready? Move in! Teach the traitorous scum the terror of a wind mage's wrath!"
895,"Daccar: The Tófa army's attacking? Looks like Myos has finally made his move. Heh heh... Why, this little drama is finally getting interesting. Wouldn't you say, Pamela?"
896,"Pamela: Indeed, sir. However, as I recall we didn't account for Sigurd's fugitives being here. Their strength poses a real risk to the plan. If Myos at least succeeds in weakening them, perhaps Silesse's fall will still go smoothly?"
897,"Daccar: Even if he fails, I still have my private deal with Grannvale in my favor. Their Lord Andrey should arrive shortly with a battalion of reinforcements. Heh heh... My victory is certain, Pamela! I'll be sitting on the Silessian throne by the end of the week!"
898,"Pamela: Without a doubt, sir."
899,"Silvia: Hey! Hey, Erinys! You totally like Lewyn, don't ya? Like, do ya really like him?"
900,"Erinys: Huh? I... that's... Er, no. Prince Lewyn is beloved and respected by all the people of Silesse, myself included."
901,"Silvia: Oh? Okay, then. Then I guess you'd be okay with me and Lewyn getting together, right?"
902,Erinys: Er... Yes. I wouldn't really mind...
903,Silvia: Reeeeally? That wouldn't bug ya at all?
904,"Erinys: No, I'm sure I'd have no issue. Why do you ask? Am I supposed to object?"
905,"Silvia: I dunno! But if it's all fine by ya, then I guess it's time for me to go work my magic on Lewyn..."
906,"Erinys: Er... The thing is, a prospective queen of Silesse ought to possess the same grace and dignity as our Queen Lahna."
907,"Silvia: Oh, so you're sayin' I'm not cut out for it? How rude!"
908,"Erinys: Er, no... That isn't-"
909,Silvia: Hrmph! Fine then! I'll show you!
910,Erinys: .....
911,"Myos: Hm? I'd say those traitors are drawing perhaps a bit too close for comfort. You there! Raise the Tófa River drawbridge! Without this key, there's no way they'll ever get over here. Heh heh... I almost wish I could see the looks on their faces!"
912,"Dew: What, just one of these locks? C'mon, at least gimme a challenge... Ta-da!"
913,"Oifey: Sire, the Tófa village elder would like a word with you."
914,"Sigurd: Of course. Actually, I'd imagine we need to talk this situation over. Bring him in."
915,"Old man: Lord Sigurd, I presume? We can't thank you enough for getting rid of Lord Myos. The entire population of Tófa is rejoicing at his downfall!"
916,"Sigurd: Hm? Are you sure? I mean, I just conquered you. Am I not the enemy here?"
917,"Old man: Lord Myos was nothing but a tyrant. All he ever did was bleed us dry. You fight in the name of Queen Lahna, and there isn't a Silessian alive who doesn't bear the utmost adoration for our queen."
918,"Sigurd: Is that so? Thank you. Anyway, in the interim I think I'll leave governing Tófa to you, sir. Once the crisis has settled, the queen will be in touch to arrange a proper successor. Until then, I'm sure you'll be a just governor to help heal Tófa's wounds."
919,"Old man: Very well. Please, Lord Sigurd, do all you can to protect the queen. She is a treasure to us, and a beacon of peace and kindness."
920,"Sigurd: Rest assured, my good man. So long as I live, I swear that I'll let no harm come to Queen Lahna. You have my word."
