,0
2142,"Coulter: Is everything ready, my liege? We'll be closing in on Munster shortly. Let's waste no time in besieging them!"
2143,"Altena: Hold, Coulter! Those are nothing more than common citizens standing in our way. Killing them would be the foulest of crimes. Wait here with the squad. I'll see if I can negotiate a surrender."
2144,"Coulter: You know I can't do that. My orders come from over your head. You may spout all the lovely nonsense you wish, but the king forbids me to stay my hand."
2145,"Altena: Are you questioning a direct order from your commander and your princess, General?!"
2146,"Coulter: These are my men, princess! If you don't wish to partake yourself, then stand aside, make yourself useful and watch our backs! Now, then... Is everyone ready? All hands, prepare to strike Munster! Leave no survivors!"
2147,Altena: C-Coulter! Get back here at once!
2148,"Seliph: Ced the Brave, I presume? I couldn't possibly thank you enough for all you've done for the people of Munster."
2149,"Ced: Lord Seliph... I'm so glad you're here at last. Sire, I implore you! Save this world! Too many of us have already given into despair... The city of Munster has been robbed by the Empire of countless young children. All were sent to the shrines in Miletos... I... I couldn't save even a single child. Me, brave? Hah! I hardly deserve such a lofty label. I'm just another coward..."
2150,"Seliph: That isn't true, Ced! If I were to fight alone, I know that there'd be precious little that I could do. It was uniting the strength of my friends, a team effort, which brought us this far! And I believe that your strength could be a valuable part of our cause. Please, Ced the Brave. Grant us your power!"
2151,"Ced: Thank you, sire... You'll have my loyalty, no matter what!"
2152,"Maykov: The rebels have made it to Munster? What in the blazes is Princess Altena doing? Men! Bolster our defensive line! Until His Majesty the King returns, we must protect the border at all costs!"
2153,"Seliph: The Thracians are on such a different level to anybody we've fought before, Lewyn. It almost feels as if each blow is fueled by pure desperation..."
2154,"Lewyn: See, Thracia's always had a bad lot in life. Much of its land is consumed by mountains. Farming its own food is a near impossible task, so they struggle to keep themselves fed. Thracia's men seek mercenary work to find the money to stay alive, while its women are stuck in whatever dreary jobs they can dig up. Don't get me wrong, Seliph. King Travant is still an awful man, but there's far more than his own petty gain at stake in his schemes. The Thracian army is as loyal to Travant as they come. They ardently believe it's Travant who'll guide Thracia out of its endless famine."
2155,Seliph: I see... That does make sense...
2156,"Lewyn: The thing is, no amount of poverty will ever justify Thracia's aggression. Travant's brand of nobility and justice would never be accepted anywhere else in the world. All the peninsula's north can see are rowdy aggressors, who threaten their peaceful lives. As harsh as it may seem, Seliph, I trust you know you can't afford to stay your hand here. The Thracian royal family is the enemy, and a grave threat to the north's peace. Stripping them of power is the only choice. That task falls to us, and we can't fail now."
2157,"Altena: The liberators have seized Meath?! Could I have been wrong about them? Oh, Arion..."
2158,Young man: You're with Lord Seliph's liberators? Gods be praised! You've come at last.
2159,"Young man: We're saved! Oh, thank you!"
2160,Young man: Three cheers for Lord Seliph!
2161,"Young woman: Thank you so much, noble warrior!"
2162,"Young woman: Please, we beg of you... Do all you can to help sir Ced!"
2163,"Young woman: Thracia's wyvern knights are still on the prowl 'round these parts. Be careful, won't you..."
2164,"Man: I've heard tell that over in Munster, people're planning a revolt against the Imperial rule. Apparently the ringleader there's some Silessian mage called Ced... The people there are so sure that he's the man for the job. Of course, the real problem for Munster is that Thracia's got their grubby eyes on the city... I hope they'll be alright."
2165,"Young woman: Ohh, thank you so much! I've heard all the stories about your army, and I've been praying that you'd come someday. Lord Seliph is our beacon of hope! Here, take this power ring. It's not much, but it's all we have to show our gratitude."
2166,"Woman: For as long as anyone can recall, Thracia's wanted to claim this region as their own. And for just as long, House Leonster always stood in their way, wielding their holy lance Gáe Bolg to defend our lands. At least, until Gáe Bolg was lost a decade ago in the Aed Desert... The Thracians ambushed and murdered Prince Quan, his wife Ethlyn, and their daughter Altena as they crossed Aed, and the lance vanished..."
2167,"Villager: The Kingdom of Thracia was founded by a wyvern knight named Dáinn. He took the Divine Gungnir in hand and took on the devil himself. Supposedly the founder of the Leonster Kingdom, Crusader Njörun, was Dáinn’s younger sister."
2168,"Old woman: Hoo hoo! What brings you all the way out here? You must be quite the curious one! Either way, I want to thank you for coming all this way for such a small and remote town. This here trinket's a thief's band. She's an odd little thing: slip her on and you'll soon find yourself stealing like you've done it all your life. Hoo hoo hoo! Take care of yourself, dearie."
2169,"Young woman: Long ago, Thracia and the states of the Munster District were a single nation. 'Course, you'd never know that from how they've hated each other so for as long as anyone can recall! I wish they could just try to make peace..."
2170,"Young man: Gaah! I-I don't believe it... The Conote Hitman's back for more blood! Run, everyone! Run for it!"
2171,Asaello: ...
2172,Girl: ...
2173,"Asaello: Er... Shouldn't you be running, too?"
2174,"Girl: But you look so sad, mister..."
2175,Asaello: ...I do?
2176,Girl: Take these! We picked up all these fruits in the woods. Eat 'em! They'll make you grow up big and strong! I hope you feel better soon!
2177,"Asaello: Thanks, kid..."
2178,"Fee: Whew! What a view, huh? I wonder if I can spot Ced from here... Hey, you alright, Annand? Ready to fly yet? Y'know, Annand, you're named for my aunt... She was one of the greatest Silessian heroines. I bet that name's why you just don't give up. Don't you worry. The very instant everything's peaceful again, We'll be going right back home to Silesse! And once it's all done... Hee hee! Maybe I'll find someone really cute, and we'll spend the rest of our lives together! But I guess we've got a little more work to do before the guys or girls come along! Come on, Annand!"
2179,Muirne: Sir Seliph…
2180,"Seliph: Muirne, what’s the problem?"
2181,"Muirne: I know I was all pumped up when we left Isaach, but now I’m… I’m scared. Just seeing everybody fighting and all… Well, one of us is gonna get killed sooner or later."
2182,Seliph: Muirne…
2183,"Muirne: Sir Seliph, you saw that mage, didn’t you? She just vanished into thin air! I just sense an evil power at work here that may just be beyond all of us!"
2184,"Seliph: Muirne, to be honest, I’m scared too. Some nights I can’t even get any sleep… Some days I wish I could just pack up and get out of here! But I can’t… and I won’t. You saw the people at Ulster and Conote. They cried with joy when we liberated them! That just goes to show how cruel the empire’s rule has been on them. We can’t just leave things the way they are. We need to help out any way we can."
2185,"Muirne: I’m sorry, sir. I didn’t mean to make you worry. I’ll try a little harder. But please be extra careful, okay? If we ever lost you….."
2186,"Seliph: Thanks, Muirne. I… I feel the same for you."
2187,Muirne: Sir Seliph…
2188,Leif: Hold on a moment. Over there... Is that a wyvern knight dame? She has such a sad look in her eyes...
2189,Jake: Wow! A human! I’m saved!!
2190,Linda: What are you doing way back in here?
2191,"Jake: Well, I initially set out t’join the liberation army, but I got lost. What’s your story?"
2192,Linda: I’m fighting to restore peace to the land with Sir Seliph.
2193,"Jake: You’re a member of the liberation army!? Hahahaa! T’think I’d find you guys here! Actually, I was just on my way home. This hurts to admit, but I kinda scared myself out here. I’m sure my girl Anna is plenty worried about me, too."
2194,"Linda: Oh, that’s a shame you can’t fight with us."
2195,Jake: Yeah. Problem is I go pretty stiff ’round them ballistas. I wouldn’t have been much help to y’all had I joined anyhow. So… you have a name?
2196,"Linda: Yes, it’s Linda."
2197,"Jake: Linda? Hmm… Where have I’ve heard that name before? Well, I should get moving. Here’s an amulet for ya. I won’t be needing it anymore."
2198,Linda: Thank you…
2199,Jake: Good luck to ya and may the grace of Naga be with you!
2200,Jake: Wow! Another human! I’m saved!!
2201,Amid: What happened to you?
2202,"Jake: Ahh… it’s a long story. Anyway, I was lost, you see… Lucky for me this girl named Linda showed up and got me on the right path. And then… well, this hurts to admit, but I got lost all over again!"
2203,Amid: Is that right? Linda is my sister. I’m Amid. I’ll get you in the right direction.
2204,"Jake: You’re Linda’s brother!? Hahahaa! Of all places to meet… I’m worthless, I tell ya."
2205,"Amid: Look, just stick with me and you’ll be fine. If an enemy shows up get behind me, okay?"
2206,"Jake: Ahh, you’re a good person. You and your sister alike."
2207,"Amid: Well, you’d do the same for me if I were in trouble."
2208,"Jake: I’m not kidding, friend… You’re like as good as they come. Here, I’ve got an amulet for you too. I brought an extra one just in case. Heh heh…"
2209,Amid: Thank you. That’s very thoughtful of you.
2210,"Jake: Once I get home to Anna, we are gonna have ourselves some kids just like y’all!"
2211,"Amid: Well, before that we need to get over these mountains. Follow me."
2212,"Jake: Hey, wait up!"
2213,Julia: Lord Seliph...
2214,"Seliph: Oh, Julia. Is something the matter?"
2215,Julia: I... I'm scared... I sense an evil presence... Something dark... And it's closing in...
2216,Seliph: What do you mean?
2217,Julia: (slowly) ...Seliph... Be on your guard... Ishtar is a fierce foe... You cannot fight her... You must not...
2218,Seliph: Julia! What's happening to you?!
2219,Julia: Ahh... I... W-what in the world just...?
2220,Seliph: Julia... You're...
2221,"Arthur: You need to be careful, Fee. I know you can fly and all, but that doesn't mean you should just take off by yourself."
2222,"Fee: Oh? Are my ears playing tricks on me? Could it be you're actually worried about me, Arthur?"
2223,"Arthur: Er... Yeah, I suppose so."
2224,Fee: Hmmm! Who knew you had it in you? I never would've guessed that you're even able to worry about anyone but yourself! I might have to rethink everything just a bit!
2225,"Arthur: Well, er, you're something of a special case..."
2226,Fee: Huh?
2227,"Arthur: Er, never mind! Anyway, just don't do anything too rash, alright? See you..."
2228,Fee: Arthur...
2229,"Finn: Lord Leif, the protection of the peninsula realm is our duty as House Leonster's remnants. We aren't in for an easy battle, but no matter what happens, we must persevere."
2230,"Leif: I know, Finn. I've always dreamed that this day, the day of Leonster's freedom, would come... I'll do all I can to bring peace to the peninsula and save the people from King Bloom's tyranny. To fulfill Father's final wishes at last... And if I need to lay down my life to make our dream a reality, then so be it..."
2231,"Finn: Please, my lord! It ill befits a future king to do something so rash! You mustn't say such things!"
2232,"Leif: Er, you're right... Sorry, Finn. I know how hard you had to work to protect me from the Empire's pursuit in my youth. I recall how often you'd let yourself starve, just so I wouldn't have to go without food... All my life you've made sacrifice after sacrifice for my sake, and only now do I understand this... I'll always be grateful for all you've done, Finn."
2233,"Finn: My lord, the Thracian region has been plagued by strife for generations, but your father dared to dream of uniting it under a lasting peace. He may be gone, but you still yet live, and so too does the hope of fulfilling his dream. Only you stand a chance of uniting Thracia."
2234,"Febail: Prince Seliph? Please, sir, forgive my foolishness!"
2235,"Seliph: Febail, yes? Patty has already told me your story. Relax! I understand why you did what you did. You've nothing to worry about."
2236,"Febail: I don't think so, sir. Letting myself work for the very same Empire I've supposedly been opposing? That was shamefully half-witted of me... Sir, I swear I'll make up for my bad choices. I'll do everything I can to aid you!"
2237,"Seliph: Thank you, Febail. I'm glad to have you."
2238,"Seliph: Pardon me, Tine. I don't suppose you're acquainted with Princess Ishtar?"
2239,"Tine: I am... When I was growing up, Ishtar was like a sister to me. She was one of the few who treated me well..."
2240,"Seliph: Would you have any idea who the man who came to collect her was, then?"
2241,Tine: That... was most likely Prince Julius.
2242,Seliph: The crown prince himself?! Are you certain?
2243,"Tine: I think so, yes. The two are a couple. That would be why he..."
2244,"Seliph: Have you met Prince Julius before, then?"
2245,"Tine: Once or twice, when I visited Belhalla. He... How can I put this... He has this odd charm which draws people to him... only for them to find that he's colder than ice. He's terrifying! If I didn't know better, I would swear he isn't even human..."
2246,Nanna: Are you Ares?
2247,"Ares: Yeah, what do you need?"
2248,Nanna: I heard you’re King Eldigan’s son. Is that true?
2249,"Ares: Yeah, so what about it?"
2250,"Nanna: It is you, after all! I am Nanna… I’m the daughter of King Eldigan’s sister!"
2251,Ares: What? You’re Lachesis’ daughter!?
2252,Nanna: Yes! She was so worried about you for the longest time… That must have been why she came to Leonster. She was looking for you!
2253,Ares: My father knew Agustria was about to be engulfed in war. So he sent me and my frail mother to her parent’s residence in Leonster. But I lost my dear mother to the flames of war during the empire’s invasion of Leonster.
2254,Nanna: And that’s when you went with Javarro?
2255,"Ares: Yeah, he took me in after that, and I traveled the world with his mercenary troops."
2256,"Nanna: No wonder we never met… Ares, I have something for you."
2257,Ares: What… Is that from my father!?
2258,"Nanna: Yes. My mother passed it on to me. It’s addressed to you, Ares."
2259,Ares: …!!
2260,Nanna: See… Sir Sigurd never once betrayed King Eldigan’s trust. I’m sure they were good friends till the very end.
2261,Ares: Whoa… I’ve had it wrong all this time.
2262,"Nanna: Ares, keep Sir Seliph safe, okay? He needs you on his side more than anything!"
2263,"Ares: Yeah… I’ll do that, Nanna. Hey, I’ll teach you some sword fighting tactics before you go. Now watch carefully…"
2264,"Ced: Huh?! Er, pardon me, Lord Seliph, but... ...That man standing by your side..."
2265,"Seliph: Ah, Ced. I'd like you to meet Lewyn, my tactician."
2266,Ced: Lewyn? I knew it. That's my father...
2267,"Lewyn: Oh, Ced. I guess you've found me. Been a while, huh? How's things?"
2268,"Ced: How's things? HOW'S THINGS?! Father, don't you realize? I've been searching for you for all this time! Do you even realize how long it's been since you ran away from home?"
2269,"Lewyn: Oh, yeah. I guess it has been a few years... Hey, how's Erinys doing these days?"
2270,Ced: How dare you... Mother is DEAD! All we ever wanted was for her to see you one last time before she died... That's why I've been looking for you!
2271,"Lewyn: Huh... Erinys... Such a shame, too..."
2272,"Ced: Are you capable of any emotion at all, Father?! You just heard your wife's dead, and you won't so much as shed a tear... And what about Fee? You've hurt her so much! It still pains her... She's adamant that she won't speak to you. You've known she was here all along, Father. Why didn't you try to fix this?"
2273,"Lewyn: Look, Ced. I left my old life behind long ago for a reason. That goes for my wife and kids, too. End of story. That's all there is to it."
2274,Ced: ...Father?!
2275,Fee: Ced...? Cedsy! It IS you!
2276,Ced: Fee?! What are you doing here? Is something the matter?
2277,"Fee: I've been looking for you, of course! I mean, you've been gone from Silesse for so long, and we had no idea where you were!"
2278,"Ced: I know, Fee, and I'm sorry... See, what happened was I was passing through Munster in my search for Father. I would've moved on, but the people's plight was nothing short of heartbreaking. I couldn't just leave Munster to waste away..."
2279,"Fee: I should've known. That is so like you, Cedsy! And here I was, almost starting to forget why you're so incredible."
2280,"Ced: You're with the liberation army, then?"
2281,Fee: Yep! I just knew I had to help Lord Seliph.
2282,Ced: Is that so... You're even more like Mother than I thought! Not once in her life did she ever turn her back on someone in need.
2283,"Fee: You're just like her, too, Cedsy... Poor Mom, though. Just thinking about how Dad left her... It makes me so mad!"
2284,Ced: Mm... I still can't make sense of his actions. What could he have possibly been thinking...
2285,"Hermina: Hawk? Is that you!? It’s me, your sister!"
2286,Hawk: Hermina!? What’s going on? What are you doing here?
2287,Hermina: I’m here looking for you! What could I do… You never once returned home after you left!
2288,"Hawk: I’m sorry, Hermina. I wandered into Munster while looking for our father, and the people were so bad off I just couldn’t leave them."
2289,"Hermina: That’s just like something you’d do, Hawk. No wonder I love you so much."
2290,"Hawk: So you joined the liberation army, did you?"
2291,Hermina: Yep. I wanted to help out Sir Seliph.
2292,Hawk: Hmph… I’m not surprised. You’ve admired his father ever since you were little.
2293,Hermina: Yeah. My dream has always been to become a Pegasus Knight just like Erinys was. You just watch… I’m gonna make it!
2294,"The reason given was: Needs more html markups as seen on Birth of the Holy Knight/Script.
"
2295,"Generation 2
"
2296,"Chapter 9: For Whose Sake
"
2297,"With the liberation of the peninsula's north, Seliph's liberation army occupies Mease Castle as their headquarters, uncertain of how to next act. Beyond Mease and the engulfing maw of its peaks lies the dracoknights' kingdom, Thracia. This rural nation is ruled by King Travant, who remains bound in coalition to Emperor Arvis. Thracia is the only state anywhere in Jugdral regarded as an ally by the Grannvale Empire. Within Thracia, Travant's minions await Seliph: his children, Altena and Arion, at the capital; the legendary General Hannibal, dubbed ""Thracia's Shield"", at Kapathogia Castle; the king's trusted advisor, General Disler, at Luthecia Castle; and a Loptyrian agent from the Empire, Bishop Judah, at Grutia Castle. Travant has fortified his kingdom for one final, full-scale showdown with the liberators. Thracia's people hardly offer Seliph an eager welcome. Fearing Seliph as a conqueror, they flock in droves to take up arms themselves. How could any justice lie in this conflict? For whose sake is this war being fought? For the first time, these questions now shake both Seliph and his army's resolve to the core...
"
2298,"Villager:
"
2299,"“I can’t verify this, but word is the empire is sending reinforcements this way. They say Musar is commanding them. Apparently, his father was killed by a Silessian knight among your ranks. He has it in for you all, so you better be on the lookout.”
"
2300,"Oh, hey! You've gone and sorted out them Imperial reinforcements already? Wow... I'm pretty dang impressed!
"
2301,"Travant: ALTENA!! What was that sorry display? Why, pray tell, is Manster still standing?!"
2302,Altena: Father... I...
2303,"Travant: I've no interest in any more excuses! Don't you dare belittle me, Altena. You are a warrior beyond compare, and you and Arion embody my will beyond these walls. I expect no less than for you to do your duty! And what do I find instead? You've ignored my orders, left an entire platoon to the slaughter, and strolled home as if nothing ever happened! I've never been more disappointed..."
2304,"Altena: I'm sorry, Father, but at least let me explain! I could never agree with such tactics, which enrich us at the expense of everybody else! How could you ever expect the proud Thracian people to accept prosperity built on the bones of others? Please, Father, rethink your ways!"
2305,"Arion: Enough, Altena. There's no place here for such meddling. Still your tongue and obey Father! Father, bear in mind Altena is still young and unseasoned. I suspect she merely found the last battle too overwhelming a prospect. Please do forgive her, even just this once."
2306,"Travant: You know, Arion? If you'd just hold back on the coddling, perhaps Altena wouldn't be so stubborn! Look, Altena. I'll give you one last chance. Take a dracoknight platoon and retake Mease! If you so much as slip again, then daughter be damned, I will accept no excuses! Understood?"
2307,"Altena: Yes, Father..."
2308,"Travant: Whew... Family resemblance, indeed! It's plainly obvious that she loathes me..."
2309,"Arion: Father, you have to remember that she's still a child. Like all children, she has yet to realize her thoughtless words have real effects."
2310,"Travant: Hmph, I suppose... I'm off to Kapathogia. I hear Hannibal's found himself some funny ideas about my plans. And so it falls to me to ensure he loses those ideas before somebody gets hurt..."
2311,Arion: I've never seen father so fearful... What could possibly have happened...
2312,Travant: General Hannibal! The rebels have seized control of Mease. Altena is en route to counter-attack. Your armored knights will join her at once!
2313,"Hannibal: Your Majesty, I've said it a thousand times and I'll say it again. There is no use fighting this war! We must arrange a truce with the liberators if we wish to recover the strength to endure! Bowing to the Empire was a despicable choice to start, one which now leaves us serving our citizens to the true enemy on a gilded platter!"
2314,"Travant: I did no ask for such dopey nonsense! The rebels have slaughtered my soldiers, and now they've stolen our territory! The hour is far too late for a truce!"
2315,Hannibal: I thought as much... Very well. I suppose I have no choice.
2316,"Travant: What's this, Hannibal? Do I hear traitorous rumblings coming from that mouth of yours?"
2317,"Hannibal: Come now, Your Majesty! Never would a warrior such as I consider turning my cloak. Traitor, indeed!"
2318,"Travant: Really, now? Then I trust you wouldn't object to a test of your warrior's loyalty. Until the war reaches its victorious end, Hannibal, I'll be taking care of your son."
2319,"Hannibal: I beg your pardon, Your Majesty? Do you have such little faith in me?!"
2320,"Travant: You have nothing to worry about, Hannibal. If you don't intend to betray me, then I don't intend to so much as scratch the boy."
2321,Hannibal: Why...
2322,Travant: Men! Bring me Hannibal's son!
2323,Coirpre: P-Papa...
2324,"Hannibal: Oh, Coirpre... I am so sorry..."
2325,"Travant: Remember, Hannibal. You have nothing to worry about, so long as you behave yourself. As soon as this war is won, you'll get him back. I don't get it, though. The boy isn't even your real son. How could he have such sway over you?"
2326,Hannibal: Coirpre has brought so much joy into my life. A true family transcends simple blood...
2327,"Travant: Ohoho! Could it be? Does Thracia's great statesman have a soft spot for children? Now, then. Thracia depends on you, Hannibal!"
2328,Travant: Disler! War is on our horizon. Defense of this castle is in your hands.
2329,"Disler: Oh, Your Majesty! To have your presence is a true honor and pleasure! Rest assured, milord. Luthecia is as an impregnable wall! I've seen to it myself."
2330,"Travant: I'll hold you to your word. Now, I've reason to doubt the loyalty of Hannibal at Kapathogia. I've taken his son hostage, just in case, and I'm leaving him to your custody."
2331,"Disler: Yes, sir! I'll not let him out of my sight. But should Hannibal turn his cloak-"
2332,Travant: Then you'll kill the son. Don't be lulled into offering even a child such as he any mercy.
2333,"Disler: Understood, milord."
2334,"Travant: Bishop Judah, we may be in need of reinforcements. How soon can I expect the Emperor to honor his end of the treaty?"
2335,"Judah: Heh... Even the great King Travant is wary of betrayal, is he? Be at peace. An Imperial unit is on the march to Thracia even as we speak."
2336,"Travant: Good. In that case, I think I'll leave the defense of Grutia to your hands. Try not to get too cocky with the rebels, Bishop. They're of a treacherous sort."
2337,"Lewyn: Looks like they're finally sending more dracoknights our way, Seliph. This must be it. It's time we readied everybody for battle."
2338,"Seliph: I don't know, Lewyn. Our foremost enemy is the Empire, is it not? Waging a war here feels... meaningless."
2339,"Lewyn: The point of a battle comes from how you conduct yourself in it, Seliph. And we hardly have much choice at this point! We're already this far into the fight..."
2340,Seliph: But what of that dracoknight who was watching us from the Manster peaks? I've seldom seen such a sad look in anybody's eyes... How could I fight somebody like her...?
