,0
1067,"With his cheery outlook and his happy-go-lucky demeanor, Wil has become quite dear to Marquess Caelin’s household. Kent is teaching him manners befitting a sworn man of Castle Caelin.
"
1068,"Once Lyn’s true heritage is recognized in Caelin, Dorcas returns to his home in Bern. There, he cares for his wife and makes a good living as a mercenary, fighting the local bandits.
"
1069,"Ultimately, Erk succeeds in seeing Serra safely to Ostia. While her behavior is irritating at best, she is sorely missed. Her ascerbic tongue has become legendary.
"
1070,"His contract with Serra complete, Erk sets off for Etruria. His time as a mercenary is just part of his training, and he is glad to see it end. He has since returned to his mentor.
"
1071,"In the celebration following Lyn’s return to Caelin, Rath slips out unseen. Whether he has returned to Sacae or has continued to work as a mercenary, no one knows.
"
1072,"Matthew vanishes after the final battle, and his whereabouts remain a mystery.
"
1073,"Nils and his sister, Ninian, take their leave of Castle Caelin after a few days. He may well be traveling the land, mastering his musical skills somewhere.
"
1074,"Lucius studies in Caelin for a time, but he departs after receiving summons to another land. He has since been seen traveling with a hard-eyed mercenary.
"
1075,"For Wallace, Lyn’s struggle only whets his appetite for battle. He sets off in search of a cause worthy of his blade. He lacks any sense of direction, so it may be years before he returns.
"
1076,"Mark leaves Lyn to continue his/her training. He plans on traveling throughout Lycia. Lyn refuses to say good-bye, believing in her heart that she will see him/her again.
"
1077,"Lyn now lives with her grandfather as Lady Lyndis of Castle Caelin. Under her loving care, Lord Hausen recovers, and now the two of them go for many walks in the Caelin gardens.
"
1078,"On clear, dry nights, Lyn can be seen high atop a hill near the castle. Perhaps she is remembering the home of her youth, the plains of Sacae.
"
1079,"Would you like to continue playing? [Yes] [No]
"
1080,"One year later…
"
1081,"Kent: Lady Lyndis, you should be able to see Castle Caelin once we pass these mountains."
1082,Lyn: Grandfather… I’ll be with you soon.
1083,Kent: Everything rests on this next battle.
1084,Sain: Lundgren will not be receiving the reinforcements he expected. He’ll move against us with everything he has soon.
1085,"Lyn: Let him come! Let them all come! I will not be turned away! I will see my grandfather… I’ve come too far to let anyone stand in my way. This is it, Mark. This is our final test. My friends, for one last time, lend me your strength!"
1086,"Lyn: Those clouds look bad. It’s going to rain soon. Let’s go, Mark. We should press on while we’re still able."
1087,Lyn: Look! The clouds are breaking. This rain should stop soon…
1088,"Lyn: It’s begun to rain, but… the sky looks mostly clear. The rain won’t last long."
1089,"Young Lady: Oh, no! If I don’t bring in the laundry now… Oh, hello. Are you a soldier? Sounds like a hard life… Especially when it rains. Rain must make it difficult for you to move around. I used to ride horses when I was little. Oh, I remember how those horses disliked the rain. It’s better to be on foot when it’s wet. Nomadic horses are trained on the plains, so they’re better with rain, but… Well, rain just seems to make it hard for everyone to get around. The weather around here can change in no time at all. I recommend just staying in one place until the rain clears up."
1090,"Young Man: You’re here to fight Lundgren, aren’t you? Do you have enough weapons? Lundgren’s no ordinary knight: he’s a general. Iron weapons lack the edge to penetrate his armor. If you need something, visit my father’s armory. You should go to the shop next door to his, too. They’ve many powerful weapons and items you can use against Lundgren. Head south and cross the river. You’ll see them. Lundgren’s a tricky one. He’s destroyed the bridge. There’s an old snag next to the river, though… If you knocked it over, you should be able to cross. Travel well. You fight for us all."
1091,"Man: You know, you really should visit the armory next door. They’ve got all you need if you’re fighting knights and generals. You need something to defeat Lundgren, right? Once he’s been beaten, maybe peace will return to Caelin. Good luck to you!"
1092,"Old lady: You’ve finally made it here, have you? Such a long way… We’re all behind Lady Lyndis. All of us. Here, take this. Use it in your battle against Lundgren, please. It’s an energy ring. It’ll increase your strength and magic power a bit. There are lots of items that augment your abilities. These are hard to come by, so think carefully before you use them. Of course, not using them at all would be a terrible waste as well, right? Items like this might vanish once you’ve used them. Bear that in mind, and use them wisely."
1093,Lundgren: So you’re the girl claiming kinship with my brother!
1094,"Lyn: You’ll play this farce to the end, won’t you Lundgren?"
1095,Lundgren: The royal house of Caelin has no need of a Sacaen mongrel! I’ll put an end to this foolishness here and now!
1096,"Lyn: To further your own black ambitions, you’ve harmed my grandfather and the very land you ought to serve. I have neither pity nor mercy for you. Lundgren! Prepare yourself!"
1097,Lundgren: Whelp!
1098,"Lundgren: Ah. One of the traitors. You must be…Kent, yes?"
1099,"Kent: Lundgren, your treachery precedes you. I will not listen to any of your poisoned words!"
1100,Lundgren: You’re a fool! You’ll wish you’d never turned your coat!
1101,"Lundgren: Ah, Sain… You’re not like that stubborn fool, Kent. You’re reasonable. Leave this child, Lyndis, and stand at my side. You will go far in my service."
1102,"Sain: That is a gracious offer, my lord…"
1103,Lundgren: Quite…
1104,"Sain: However, I am rather fond of my friend the stubborn fool. And if I am to pledge my service to any liege, I would choose lovely Lady Lyndis over Foul Lundgren, regardless of the risk!"
1105,Lundgren: Fool! I will make you regret your decision!
1106,"Lundgren: This is my realm, and you’ve entered without my permission. You will not leave these lands alive!"
1107,Lundgren: That annoying little girl… Nothing but a savage from Sacae… The Caelin throne…should be…mine…
1108,"Lyn: We’ve won… At last, I can see my grandfather."
1109,"Reissmann: You are Lady Lyndis, are you not?"
1110,Lyn: Who are you?
1111,"Reissmann: I am Reissmann, the chancellor of the Caelin royal family. I had receive word from Kent and Sain when you first met, but then Lundgren discovered the message and imprisoned me. It is my great pleasure to welcome you to your true home."
1112,Lyn: Thank you. May I see my grandfather now?
1113,"Reissmann: Yes, of course. Do not be shocked by what you see. Lundgren has been poisoning the marquess’s meals for some time. His body has been ravaged… He’s been bedridden for months."
1114,Lord Hausen: Who is there? I said no visitors. I will see no one.
1115,Lyn: ……
1116,Lord Hausen: What are you doing? Leave me…to die…
1117,Lyn: Um… Pardon me… My name is… I’m Lyndis.
1118,Lord Hausen: Eh? Did you say Lyndis? Is that…
1119,"Lyn: My father’s name was Hassar, chieftain of the Lorca. My mother was…Madelyn. I was raised on the plains."
1120,"Lord Hausen: … Could it be? Come, come here. Let me see your face."
1121,Lord Hausen: Oh… Yes… There is no doubt… You are Madelyn’s trueborn child… Uhhh…ahhhh…
1122,Lyn: Grandfather!
1123,"Lord Hausen: Lundgren told me that my daughter had died. My heir…and you, too. He told me you were dead. Thank you… Thank you for living. Ahhhh… I am blessed…"
1124,"Lyn: Mother and Father were slain last year by brigands. I… I was the only survivor. I lived on, but…"
1125,"Lord Hausen: Lyndis, please forgive a prideful old man. If I had but accepted your parents’ love… There would have been no bandits. We would have lived here together in perfect peace."
1126,"Lyn: Grandfather. My parents… My tribe… Our life was one of love and peace. The end was tragic, but… up until the attack, we were truly happy."
1127,"Lord Hausen: Truly? Madelyn had a life of happiness? Knowing that gives me so much joy. Thank you, Lyndis. I can die in peace now…"
1128,Lyn: No! Grandfather! You mustn’t say that!
1129,"Lord Hausen: There’s no avoiding it, Lyndis. I’ve taken too much poison for far too long. It’s too late…"
1130,"Lyn: Be brave, Grandfather! You will recover! Believe me! On the plains, we say that illness fails in the face of a strong heart! I am with you now! You mustn’t give up!"
1131,Lord Hausen: You’re…with me…
1132,"Lyn: Yes. We have so much to talk about. Walks to take, music to listen to. There’s so much I want to do with you, so much lost time we can recover!"
1133,Lord Hausen: That does sound… nice.
1134,"Lyn: Doesn’t it? And once you’re well, I’ll take you to the plains. I’ll show you the endless sky, the oceans of grass… I want you to know the lands my mother loved so much!"
1135,Lord Hausen: The lands Madelyn loved… You’re right. I still have… quite a bit of living to do.
1136,"Lyn: You can do it, Grandfather!"
1137,Lord Hausen: Lyndis…
1138,Sain: Lady Lyndis! Do you honestly plan on remaining here? Tell me truly!
1139,"Lyn: Yes, until my grandfather is well. I can’t leave him now. I won’t."
1140,"Kent: The physician says that Lord Hausen looks like a new man. It’s like he was never ill. And it’s all thanks to you, milady."
1141,Lyn: He’s the only family I have left. I want him to have a long life.
1142,Florina: Lady Lyndis!
1143,"Lyn: What is it, Florina?"
1144,"Florina: I’ve been taken into service by House Caelin! From here on, Lyn… I mean, Lady Lyndis… We’ll be together always!"
1145,"Lyn: Really? Oh, that pleases me so…but… Please don’t call me Lady Lyndis. For you, I’m still just Lyn."
1146,Florina: My pegasus and I fly for your house now. I am your servant. There are rules to follow.
1147,Lyn: Florina!
1148,Florina: I’m happiest when I’m with you. That’s more important than how I address you… Please…
1149,"Lyn: I suppose I’ll just have to get used to it, right? Very well. I understand."
1150,"Florina: Oh, thank you! I do love you, Lyn!"
1151,Florina: Oops! I mean… Lady Lyndis!
1152,"Lyn: Ha ha ha… Oh, Florina!"
1153,"Wil: Lady Lyndis! I’ve decided to stay, too!"
1154,Lyn: Wil? Weren’t you planning on returning home?
1155,"Wil: Well, I was but… I’ve grown quite fond of Lyndis’s Legions, you know… I couldn’t possibly leave everyone behind. I’ll send word to my family regarding my decision."
1156,"Lyn: I’m pleased to have you, Wil. Thank you."
1157,"Wil: Thank you, milady."
1158,"Lyn: Mark… you’re leaving, aren’t you? No, I’m not asking you to stay. It’s just… I’ll miss you. When I found you unconscious on the plains… I had no idea we would be together for so long. You’ve helped us so much, and I’m sure you’ve learned all you can from us. You’ll do just fine on your own. I have the utmost faith that you’ll be a master tactician, Mark. That’s from someone who’s seen you at work!"
1159,"Lyn: Well then, take care… I… I hope I see you again. I’m sure that I will someday…"
1160,Tutorial: Here ends Lyn’s story. Would you like to save your progress? [Yes] [No]
1161,"Tutorial: As of Chapter 11, Eliwood becomes the story’s main character. Mark’s role will be to act as tactician, aiding his group. Help Eliwood to fulfill the chapter goals and fight his way to the end of the game. You’ll start your first campaign with Eliwood, then meet his friend, Hector, in chapter 12. And who knows? You might even meet Lyn again. If any of these three is defeated, your game will be over. The game will continue if any other allied units are defeated. However, a defeated unit can never take part in combat again, so be careful!"
1162,"Once, dragon fought man in a war called the Scouring... Mankind vanquished the dragons thanks to the efforts of eight heroes. These eight mighty generals brought peace to Elibe. The continent was divided into nations, and the people enjoyed an easy prosperity. The hero Hartmut settled in the east and founded Bern, famed for its military might. St. Elimine moved west, and her sacred name flourished among the artisans of Etruria. The horseman Hanon's legacy lived on with the nomads of his beloved plains of Sacae. The birthplace of the knight Barigan is now home to the renowned Knights of Ilia. The berserker Durban's final glory was to create a warrior's clan in the Western Isles. The archsage Athos is said to have retired to the barren wasteland of Nabata. The heirs of the champion Roland themselves became the lords of the Lycian League. Elibe has enjoyed a peace that spans 980 years... How much longer can this peace stand before its foundations begin to crumble? Deep within the Lycian League lies Pherae, a land that has known no conflict for many generations, but which now finds itself touched by a shadow of unease. Its beloved and benevolent ruler, Lord Elbert, has mysteriously vanished... as have a number of his sworn men, loyal knights who serve at his side. A month has passed without word from the marquess. Rumors of his death abound. However, the marquess's son believes his father lives, and he has vowed to find him. Marquess Pherae's son, Eliwood: A red-haired youth who will one day become the finest knight in all of Lycia. His long journey begins here.
"
1163,"One Year Later...
"
1164,"A month has passed since word came of Marquess Pherae's disappearance. Rumors and speculation run rampant throughout Lycia. The head of House Ostia, Lord Uther, takes no apparent interest. The marquess's younger brother is considered odd by the populace. He and Marquess Pherae's son, Eliwood, are fast friends. A hot-blooded youth, he cannot ignore his friend's plight. Marquess Ostia's younger brother, Hector. He would one day be a courageous general, a steel warrior to be feared. The path he chooses will test him to the limits of his strength.
"
1165,"Hector: Brother! Brother!! Where is he!? He's here, isn't he?"
1166,Oswin: Lord Hector! Calm yourself!
1167,"Hector: No words, Oswin! Just move!"
1168,"Uther: That's enough, Hector! What is the meaning of this?"
1169,Hector: You know full well! The disappearance of Marquess Pherae!
1170,Uther: We've discussed this time and time again. This matter is none of Ostia's affair. We have no reason to involve ourselves. It would be folly to do so.
1171,"Hector: Eliwood's father is missing, for goodness' sake! We know that Marquess Laus is connected in some way. I say we use Ostia's might to end this mystery and find the truth!"
1172,"Uther: Calm yourself, you fool! An invasion would be madness! Lycia can ill afford the chaos such an action would bring. Surely even you must understand that!"
1173,"Hector: Bah... I understand all too well, Brother! Stay there on your throne. Sit there until it rots beneath you! I will do this alone!!"
1174,Oswin: Lord Hector! You should watch your tone...
1175,"Uther: Peace, Oswin. Let him go. There's no reasoning with him when he gets like this."
1176,Oswin: .......
1177,Hector: Matthew! Matthew! Blast it! Where could he be?
1178,Matthew: I'm right here.
1179,Hector: You... You're not a wraith. Stop skulking in the shadows like one.
1180,"Matthew: Hm? A wraith? And here I thought I was a spy. Be that as it may. As milord ordered, here are your travel rations and your beloved axe. And I've purchased the silence of some royal guardsmen. You're free to slip out the rear entrance and vanish."
1181,"Hector: Well done, Matthew. Try not to let my brother discover my absence too quickly."
1182,Matthew: What? I thought I was going with you.
1183,"Hector: You're a bigger fool than I'd imagined! Did you think I would trust my brother's spy? Who knows when you would turn me in for some favor! Where I go, I go alone!"
1184,"Matthew: Shh! You keep on shouting, and you'll go nowhere! Every guard in the palace must have heard that!"
1185,Hector: Enough... Do not try and follow me!
1186,"Matthew: I did not imagine you would find me so untrustworthy. Professional hazard, it seems. Watch yourself, young master."
1187,Hector: Huh? He... He gave up too easily. I don't trust him... The time has come... I've got to get out of here and rendezvous with Eliwood. These bags! What did Matthew put in these things?
1188,Hector: This is ridiculous even if he was packing for two! Huh? .......Come out. I know you're there.
1189,Mercenary: .......
1190,Hector: Who are you?
1191,Mercenary: .......
1192,"Hector: Too dumb to speak? Makes no difference to me. Move out of my way, or I'll run you through!"
1193,Hector: Hah!
1194,Matthew: Whoa! M-Milord! Stay your arm! It's me!
1195,Hector: Who? Matthew? I was sure you were one of them.
1196,"Matthew: Well, I'm not! I'm one of me. And I would prefer to remain in one piece."
1197,"Hector: Your fault for jumping out of nowhere. Now tell me, what are you doing here?"
1198,Matthew: Hm? I... I sensed that something was wrong and...came to your aid.
1199,Hector: My aid... I'll accept that answer for the time being.
1200,"Matthew: So, what should we do?"
1201,Hector: About what?
1202,"Matthew: About the fellows between us and the way out. I'd say there are 7 or 8 of them. To make matters worse, they seem highly competent. I know you're confident in your martial abilities, but... I'm not the strongest sword arm around, and, well..."
1203,"Hector: If you've something to say, Matthew, then say it!"
1204,"Matthew: We could abandon the rear entrance. I'm sure the royal guardsmen would be happy to aid us, and..."
1205,Hector: Never!
1206,"Matthew: That's what I thought you would say. All that's left is to avoid getting killed, right?"
1207,Hector: You can go back if you want.
1208,"Matthew: In your own words, milord, never. I'm with you, wherever that may lead."
1209,Hector: Right. Then let's give them a good thrashing and get out of here!
1210,"Hector: You're not Marquess Laus's assassins, are you? You're too good, too professional. Nothing like those idiots over there."
1211,"Wire: You've no need to know, little Lord Hector. A fool like you, sneaking out of the country alone... You'll go missing, never to return. Your body will never be found. Tidy story, eh? Ha ha..."
1212,Hector: Tsk tsk... Looks like your luck's run out.
1213,Wire: Our luck? What are you...
1214,"Hector: You see, I'm about as angry as I've ever been. I doubt that even a dozen of you could slow me down. Prepare to die!!!"
1215,Wire: The Ostian spy. Why did you return?
1216,"Matthew: I've known you were here for some time. I also knew you were after Lord Hector, not me. You're all professional assassins. You wait for your chance, and you don't miss it. You were waiting for me to leave Lord Hector alone. That's when you were planning to attack, right?"
1217,"Wire: Ah... So that's why you came back, is it? I was sure you'd gone back to play with the guards."
1218,"Matthew: If I had, I would've taken Lord Hector with me. No matter what it took."
1219,"Wire: Cheeky fellow, aren't you? But you're out of your league."
1220,Matthew: How so?
1221,"Wire: You think to challenge me? Prepare to die, you witless fool!"
1222,Matthew: Ghaa...
1223,"Matthew: Whew... That was close. Glad we're both all right. Come, milord, we must fly! The castle guard must have heard all the noise."
1224,"Hector: Matthew, you rogue. You knew this was all going to happen, didn't you?"
1225,Matthew: What else could I do? Those assassins wouldn't show themselves until you were alone.
1226,"Hector: I suppose... Mark my words, Matthew! You're coming with me. But from this point forward, you are no longer my brother's spy. You are my man now, to the bitter end."
1227,"Matthew: Yes, milord! Shall I swear a knightly vow?"
1228,Hector: To what purpose? Your own words will hold you well enough.
1229,Matthew: True enough!
1230,Hector: Let us go then! To Eliwood!
1231,"Hector: Is it…over? Oh, no… I can’t…… ……… I can’t mourn you now. Matthew… If I turn back now… Your… Your death will… It will be for naught. I must find Eliwood… I cannot afford to waste a minute more!"
1232,Soldier: My lord! Marquess! It's Lord Hector! He's--
1233,"Uther: He's gone, isn't he?"
1234,"Soldier: Ye... Yes, milord! We are gathering men now to give chase."
1235,Uther: Attend me. We will let him go.
1236,Soldier: Milord?
1237,Uther: A... Headstrong fool... Oooh... Cough...cough...
1238,Oswin: Lord Uther! Are you well?
1239,Uther: ... ...I'm fine. It has passed. There is no need for concern.
1240,Oswin: You must not rely so much on physical strength alone. It has been most trying these past few weeks. The affairs of the court have not let you sleep. You might endanger your health if you keep on...
1241,"Uther: Yes, Oswin. I understand. I will speak with a physician on the morrow. Will that allay your fears?"
1242,"Oswin: Yes, my lord. I shall make the arrangements."
1243,"Uther: Oswin... About Hector... I can entrust him to you, yes?"
1244,"Oswin: Of course, my lord. I will guard him with my very life's blood."
1245,"After speaking with the village magistrate, Eliwood and company set their sights on Laus. The road from Pherae to Laus passes through Santaruz. Eliwood suspects his missing father must have visited Santaruz en route to Ostia. Eliwood arranges a meeting with the local ruling lord to see what he can learn.
"
1246,"Before Battle
"
1247,"Hector leaves Ostia. He moves towards Santaruz to meet up with Eliwood as quickly as possible. He encounters a mysterious group whose dark garb hide an even darker secret. Perhaps these same powers have turned their blades on Eliwood...Hector hurries south, praying for his friend's safety.
"
1248,"Dorcas: Here we go again, eh, Mark? Just like old times... Seems our fates are bound. Natalie? Oh, she's still in Pherae. I'm working for you this time, so she's not too worried. Guide my axe, Mark."
1249,Matthew: Lord Hector! I have it! I know where Lord Eliwood is. He entered Santaruz not far from here.
1250,"Hector: Is that so? We've read his movements fairly well, then. Let's move due south and cross the border. We'll meet up with him in Santaruz!"
1251,Serra: Ah! There you are! Lord Hector!
1252,"Matthew: Oh, no..."
1253,Hector: Serra? W-What... What are you doing here?
1254,"Serra: You're going to meet Lord Eliwood, right? Well, I want to go, too!"
1255,Hector: Go home! This is no game.
1256,Serra: But Oswin told me it was all right to come!
1257,Hector: Oswin?
1258,"Oswin: Yes, my lord. On the marquess's orders. Serra and I will be accompanying you."
1259,"Hector: Bah. This is ridiculous. Always have to have the last word, eh, Brother?"
1260,"Oswin: No matter what you think, he's just worried about you, Lord Hector. You're the only family he has."
1261,Hector: I know...
1262,Matthew: Lord Hector! Up ahead! There appears to be fighting.
1263,Hector: Where? Is it Eliwood? Come! Let's get closer! Hurry! Oswin! Matthew!
1264,"Matthew: Yes, my lord!"
1265,"Serra: Oh! Wait for me! I'm coming, too!"
1266,Hector: Hey! What's going on over there? Looks like some rough business. You! Soldier! Are you just going to stand there and watch?
1267,Soldier: Who do you think you are? This is Santaruz. What occurs here is no affair of any foreign lordling!
1268,"Hector: I believe I'm going to have to disagree with you. You see, the man they're attacking happens to be a friend of mine."
1269,Soldier: A friend? What? ...Urrrgh!!
1270,"Hector: Sorry, but I'm in a hurry."
1271,Serra: Ewww! That's terrible! I loathe violence!
1272,"Matthew: Nicely done, my lord! You're a fighter born."
1273,Oswin: I cannot condone resorting to force so quickly...
1274,"Hector: Chastise me later, Oswin. First, we deal with these brigands! Come! We must help Eliwood!"
1275,Oswin: Help Eliwood? Sounds like a convenient excuse for more violence.
1276,Hector: Oswin!
1277,"Oswin: Yes, yes. I'm coming!"
1278,Hector: Matthew! Bring Serra and follow along.
1279,Matthew: What! With...Serra?
1280,Serra: No! I want to go with you now!
1281,Hector: Absolutely not! You'll slow us down! zzz
1282,Serra: Oh! How rude!
1283,Hector: Oswin! Let's go!
1284,Hector: Whew... Is that all of them?
1285,Eliwood: Hector! Where did you come from?
1286,"Hector: Well met, Eliwood."
1287,"Eliwood: Yes, but...what are you doing here?"
1288,Hector: You wound me!
1289,Eliwood: How do you mean?
1290,"Hector: You're looking for your father, right? Why didn't you send word?"
1291,"Eliwood: Your brother was just named Marquess Ostia. He's going to be very busy setting up his court council. Lord Uther must need your support. You are his brother, after all."
1292,"Hector: My brother is not so weak. Oh, he has mentioned some things in public, but... He knew exactly what I was planning, and he let me go."
1293,"Eliwood: Is that so? Well then, it would be unwise to refuse his kindness! It does me good to see you, Hector. Thank you."
1294,"Hector: Think nothing of it. You know Oswin, don't you?"
1295,"Oswin: Well met, Lord Eliwood."
1296,"Eliwood: It is good to see you again, Oswin. So you came as well?"
1297,Oswin: Yes. Lord Uther was worried about Lord Hector traveling alone. I've been ordered to keep a close eye on him.
1298,Eliwood: Ha ha ha! Of course! Good to have you with us.
1299,Serra: Lord Hector! Why didn't you tell me the fighting was done!?
1300,Matthew: I apologize for the interruption. I couldn't restrain her any longer!
1301,"Eliwood: Are these your companions, Hector?"
1302,"Hector: Oh... Yes, I suppose they are. One might have hoped for better, but..."
