,0
3833,"Desmond: Come, Guinivere. I will play with you."
3834,"Guinivere: No! I want to play with him, not you! I'll go and call him back. Here, hold my fox!"
3835,Desmond: ......Attend me!!
3836,"Solder: Yes, my lord."
3837,Desmond: Take this beast and kill it! Do not let Guinivere know what you do.
3838,Soldier: Understood.
3839,"Desmond: ...Zephiel, you knave. Trying to steal my Guinivere's love... ...You will learn your place!"
3840,Hector: That was close... I was afraid they'd catch us.
3841,Eliwood: This is worse than I'd imagined. The Black Fang has already reached the king.
3842,"Lyn: Their plans for Lycia failed, and now they're targeting Bern."
3843,"Hector: If a country as powerful as Bern moves, peace knows no hope."
3844,"Eliwood: What Nergal desires is powerful quintessence. Calling dragons back.. Does he wish to embroil the world in chaos? Whatever his plans, he must be stopped at any cost!"
3845,"Hector: Right. Find the Fire Emblem and return it to the queen. We do that, and she'll point us toward the Shrine of Seals."
3846,Lyn: If we go to the Black Fang fortress...
3847,Eliwood: That's our goal. I must meet with everyone and seek out their fortress.
3848,Ninian: I wonder if Eliwood and the others are well.
3849,"Nils: Please, Ninian. That's all you've spoken of since they left. I understand your concern for Lord Eliwood, but..."
3850,Ninian: Nils! I...
3851,"Nils: You don't have to hide anything from me. But you must not fall in love with him, you know? We...are different from them."
3852,Ninian: ...I know. But I cannot... ......I...
3853,Nils: Ninian! Where are you going?
3854,"Ninian: I need time to think. May I be alone, please?"
3855,Nils: Ninian...
3856,"Hector: We'd better hurry and rejoin the others. Oh, no! Look! It's a wyvern rider!"
3857,Eliwood: She's coming closer... Has she seen us?!
3858,"Lyn: No, it's not us she's seen. It's... It's Nils!!!"
3859,Eliwood: Let's go! Hector!!
3860,Hector: OK!
3861,Nils: Ahh! Who...who are you?
3862,"Vaida: Light green hair, crimson eyes... No mistake. You're one of Lord Nergal's lost toys. Yes! Found you at last!"
3863,Nils: ...What are you? Why can't I sense you!?
3864,"Vaida: What happened to your bodyguards? I heard they were tough. I wanted to see for myself. Well, you're here, so they can't be too far away, can they?"
3865,Nils: ...
3866,"Vaida: C'mon, boy! Scream! Call your friends to you! I grow weary of waiting. I am not known for my patience!!!"
3867,Lyn: I'm the one you're looking for! Unhand the boy!
3868,Vaida: You've come! I've been looking forward to this!
3869,Eliwood: Looking forward... What do you mean?
3870,Vaida: The chance to crush you! Then hand the children over to Lord Nergal.
3871,"Hector: Nergal? So you're one of his dogs, are you?"
3872,"Vaida: ...I'll not be called a dog by you, blackheart! True, we've a contract with the Black Fang, but... I am loyal to one master only! He who sits on the throne of Bern!"
3873,Eliwood: Then why are you in the employ of the Black--
3874,"Vaida: There's been far too much talking. Let's get started, shall we? I've long hungered for someone to test my strength against. Make this last awhile, will you? I want to enjoy this!!"
3875,"Vaida: Listen up, everyone! It's playtime! Come on out!! The palace has promised to stay out of this! Be as wild as you will!!"
3876,Eliwood: Tactician! Our allies are hidden here and there to avoid being spotted. This is not to our advantage. We must gather everyone quickly!!
3877,"Pent: We'll help, too. Tell us what to do."
3878,"Eliwood: You as well, Lady Louise?"
3879,Louise: Of course.
3880,Pent: No need for concern. She is quite skilled with a bow. Those Bern wyvern riders will be sorry to meet her.
3881,"Louise: Despite what you may think, I shoot much better than I dance or sing. I believe I can be of some small assistance."
3882,Eliwood: I understand. Thank you for your help.
3883,Pent: ...Now let me give you this. It's from Lord Athos.
3884,Eliwood: What is it?
3885,"Pent: A Heaven seal... It reveals hidden strengths. It only works for a select few, but..."
3886,Eliwood: It has an air of mystery to it.
3887,Pent: Do you think you can use it?
3888,"Eliwood: ... ... ......No, it won't work for me."
3889,"Pent: Wait for the proper time, and have the other two try it. It might not work now, but I'm sure that you will all be able to use it at some point. Just keep trying."
3890,Eliwood: I understand. Thank you very much.
3891,"Pent: You're Tactician, is that right? Please...forget about my title and standing in my country. You are our tactician, and I will do as you command. Well then, I hope we'll work well together."
3892,"Louise: Mark, you are the tactician for this company, are you not? May our battles together be successful ones."
3893,"Vaida: Pah! I've had it with being pushed here and there! Withdraw!! Ground forces, pull back! And move quickly!!"
3894,Eliwood: I guess that worked out.
3895,Ninian: Lord Eliwood!
3896,Eliwood: Ninian! Nils! Are you both well?
3897,"Nils: What shall we do, Lord Eliwood? Nergal's power... It's returning bit by bit."
3898,Eliwood: What do you mean?
3899,Ninian: That woman you faced... She was protected by Nergal's magic.
3900,Eliwood: Her strength... It came from Nergal?
3901,Ninian: Yes. It won't be long before he's active again. With all his power restored.
3902,Nils: We must hurry and gain the power to oppose him!
3903,Eliwood: We have to recover the Fire Emblem. If we can do that...
3904,Hector: Come on! The palace is in an uproar. This is our chance to slip away!
3905,Lyn: Wait! I have an idea. Let's follow them.
3906,Eliwood: Lyndis?
3907,Lyn: Leave it to me. I think I might be able to find the Black Fang fortress.
3908,"Lyn: This way. The signs are fading, but they're really moving. I think I can track them if they keep this pace."
3909,Hector: Are you sure? Really?
3910,"Lyn: Remember, I'm from Sacae. Bern's foot soldiers are slow and clumsy... And to a Sacaen, men are easier to track than rabbits."
3911,"Hector: What do you want to do, Eliwood."
3912,"Eliwood: Let's put our trust in Lyndis. If anyone can do this, she can."
3913,Hector: Are you serious?
3914,"Lyn: Over here, everyone!"
3915,"They follow the Black Fang due south. Although the trail vanishes, Lyn uses her tracking skills, and the pursuit continues. The path leads up into Bern's impassable mountains. The peaks know no seasons, and the snow covers all in a bright blanket. In this land of blinding reflections, an ancient castle appears.
"
3916,"Sonia: So, in the end, you failed to defeat them, didn't you?"
3917,Vaida: ......
3918,"Sonia: I only introduced you to Lord Nergal out of respect for your rank. I was mistaken, though, to think that a former royal soldier would be--"
3919,"Vaida: Next time will be different, I swear it. I beg of you, give me one more chance!"
3920,"Sonia: Ha ha ha... ""One more chance""? Surely you jest."
3921,"Vaida: Without Lord Nergal's good word, I'll never fly again! Not as a royal wyvern knight, at least! Please! Another chance!!"
3922,"Sonia: Ah, but you're quite skilled at begging, at least. Desist. You have fallen from our graces, and nothing will change that. Just be grateful. You are an outsider, so you are spared the Fang's judgement."
3923,Vaida: ......
3924,Sonia: You stink of failure. Leave me to breathe in peace.
3925,Vaida: ......Hm.
3926,Eliwood: That wyvern rider.. That was the same woman we fought earlier. This proves that they took this mountain path.
3927,Hector: Now... What have we here... What a complicated place.
3928,"Eliwood: It's little more than whispers, but I can hear human voices."
3929,Lyn: Over there! Let's go take a look.
3930,Eliwood: Marcus! Wait here with Ninian and everyone else. Be ready to escape at any time. I'm counting on you!
3931,"Marcus: Yes, sir. I will not fail."
3932,Nino: Really? You're giving me a mission? Really and truly!? Mother!
3933,Sonia: I am. And it's a very big job at that. ...It's for the king of Bern.
3934,Nino: The king!? Such an important job... for me?
3935,Brendan: Sonia? I'm against this!! Giving such a dangerous job to this child...
3936,Nino: Father?
3937,"Sonia: ...You're right, this really is a job for your sons. However, we've seen nothing of them since their last report."
3938,Nino: Lloyd... Linus......
3939,Brendan: ......
3940,Sonia: So my daughter will do this. And I will have no complaints from you about it.
3941,Brendan: ......
3942,Nino: Ah! Father......
3943,Sonia: ...You may do as you please!!
3944,Nino: But...
3945,"Sonia: First, business! Jaffar! Come!"
3946,Nino: Jaffar!
3947,Lyn: Look! That man! He was at the Dragon's Gate.
3948,Hector: Nergal's henchman. No question about it.
3949,Eliwood: ......
3950,Nino: Jaffar! Should you be up? Don't your wounds hurt?
3951,Jaffar: ......
3952,"Sonia: Must you be so discourteous? It really is quite irritating. You heard the king's request, did you not?"
3953,Jaffar: Prince Zephiel... He wants him assassinated.
3954,"Nino: What? The prince? The king wants to kill the prince? Why? He's his son, isn't he?"
3955,Sonia: Nino! Be quiet.
3956,Nino: Ah... I'm sorry.
3957,"Sonia: Jaffar, this mission is yours... and you're to take Nino."
3958,Jaffar: ......You're not serious?
3959,"Sonia: Yes, I'm serious. This girl is my daughter. She must prove herself as soon as possible."
3960,Jaffar: ...Don't do this. This is too much for her.
3961,"Sonia: As long as you're with her, there should be no problem. I'll brook no disagreement. We must have the king in our debt. Those are Lord Nergal's explicit orders."
3962,Jaffar: ......
3963,"Sonia: Nino! You understand the consequences if you fail, don't you?"
3964,Nino: Um... Yes.
3965,Sonia: Then we're off to investigate the prince's manse. I'll provide more details on the way there.
3966,Sonia: Jerme!
3967,Jerme: Yes?
3968,Sonia: Where is Brendan? He just left the room.
3969,Jerme: He went outside with Jan.
3970,"Sonia: ......I wonder what he's about... ...I'll deal with it later. Listen, Jerme. You're in charge of the guard while I'm gone. Do not let anything happen to the item."
3971,Jerme: In charge of the guard... Bah! I was top dog until that cretin Jaffar showed up.
3972,Sonia: Jerme!
3973,"Jerme: ...I know, I know!"
3974,Sonia: Kenneth!
3975,"Kenneth: Yes, Lady Sonia."
3976,Sonia: Where is Brendan? He just left the room.
3977,Kenneth: He went outside with Jan.
3978,"Sonia: ......I wonder what he's about... ...I'll deal with it later. Listen, Kenneth. You're in charge of the guard while I'm gone. Do not let anything happen to the item."
3979,Kenneth: Understood. I will guard it with my life.
3980,Eliwood: Do they seriously mean to assassinate the prince?
3981,"Hector: Aye. On the orders of the king, it would seem. Unbelievable..."
3982,"Lyn: The Emblem is essential to the prince's ceremony, right? Having the Emblem becomes useless if the prince is dead!"
3983,"Eliwood: We must stop the assassination! The girl, Nino... If we speak to her she might understand."
3984,Lyn: Jaffar looks like a dangerous man... But we have no other course of action.
3985,"Jerme: Oh, here you are! How delicious! My blade shall feast well tonight, won't it?"
3986,Eliwood: Oh!!
3987,"Jerme: Now, which...one...first? Wait! Hold it! There are some nasty ones mixed in with the rest. Mustn't get one of them. Might ruin my sword's appetite. You don't mind do you? If I do it this way?"
3988,Eliwood: That's...
3989,Lyn: Eliwood! There's no reason to treat with that madman!! We must find the exit...
3990,"Jerme: You! Woman! You have beautiful skin. If I sliced you into lovely red ribbons with this, would the pieces be as soft and delicate as silk?"
3991,Lyn: You...
3992,Nils: It's no good! Something's blocking our way. We can't get out!!
3993,"Ninian: I can feel an evil power emanating from every foe here. If we do not defeat them all, the barrier will hold strong."
3994,"Jerme: Hyaa ha ha ha haaa! That's Lord Nergal's doing! He knows how I love to slice through people. He lets me do it as often as I want, which really is all the time. He's after something he calls ""quintessence""... I care nothing for it, but... as long as he keeps bringing me people to slash and cut! I am Jerme! The finest assassin the Black Fang have ever known! Now come! My blade hungers!!"
3995,Eliwood: Gone...
3996,Ninian: ...It's all right. He's still close... In this building...somewhere.
3997,"Nils: We've got to defeat him and destroy this barrier! Otherwise, we'll never leave!!"
3998,Eliwood: Mark! We have to find that man and escape this place! What are your orders?!
3999,"Kenneth: Hello trespassers. I bid you welcome. Imagine, the stronghold of a guild of assassins, infiltrated. Quite amusing, isn't it? Heh heh heh heh."
4000,Eliwood: Oh!!
4001,"Jerme: However, you shall not leave. Sonia has given me authority while she is away."
4002,Eliwood: You... You're a holy man. What are you doing in this place?
4003,"Kenneth: Are you referring to my relationship with the ""gods""? Are you still held in the thrall of such a concept? You've met Lord Nergal, haven't you? Then there is something you must know. Gods are lies created by the weakness in all mankind. ...If a god truly exists, then it is my lord Nergal. Only him."
4004,Eliwood: Insane...
4005,Hector: Eliwood! Waste no time with that madman!! Let's get out of--
4006,Nils: We can't! Something's blocking our way. We can't get out!!
4007,Ninian: ...That man. The one in front of you... A surge of evil...
4008,"Kenneth: Nothing is more beautiful than the suffering of men. When I'm watching, I'm afloat in an ocean of pure bliss... I will watch you for a long, long time."
4009,Eliwood: Gone...
4010,Ninian: ...It's all right. He's still close... In this building...somewhere.
4011,"Nils: We've got to defeat him and destroy this barrier! Otherwise, we'll never leave!!"
4012,Eliwood: Mark! We have to find that man and escape this place! What are your orders?!
4013,"Geitz: Come on, Mark! Do you really want me? Oh, bother. I really hate the cold. What? Everyone's counting on me? ... Oh, fine ..."
4014,"Wallace: Huh huh huh huh. You’ve done well to choose me for this, Mark! Weaklings! Their pathetic attacks mean nothing to me! I’ll cut through this snow like a new-forged blade!"
4015,Eliwood: Who are you?
4016,Karel: Karel.
4017,"Eliwood: Are you fighting the Black Fang, too?"
4018,Karel: I heard the Black Fang was gathering recruits. I'm here to challenge them.
4019,Eliwood: Do you... Do you have a reason to do so?
4020,Karel: My sword is my life. My sword is my reason. You...
4021,Eliwood: What?
4022,"Karel: You are quite good, but you will improve. Very good. I will join you."
4023,Eliwood: You're going to help me and my friends? But...why?
4024,"Karel: Someday, you will be a great swordfighter. It would be a waste for that skill to die here. I must have you... stronger. I will wait for that time with much anticipation."
4025,Eliwood: ......
4026,Karel: Shall we continue? The feast awaits...
4027,Hector: Who are you?
4028,Karel: Karel.
4029,"Hector: Karel, what are you doing in this place?"
4030,Karel: The Black Fang is gathering recruits. I want to hone my blade on them.
4031,Hector: What? Do you have...a reason?
4032,Karel: My sword is my life. My sword is my reason. You...
4033,Hector: What?
4034,Karel: You are unpolished...but powerful. Very well. I will join you.
4035,"Hector: You're going to lend us your blade? That's a nice gesture and all, but... Why?"
4036,Karel: You will someday be a famed general. It would be a waste for that power to be lost here. I must have you...stronger. I will wait for that time with much anticipation.
4037,Hector: ......
4038,Karel: Shall we continue? The feast awaits...
4039,Lyn: Oh! Who are you?
4040,Karel: Karel.
4041,Lyn: You're a...swordfighter from Sacae. Are you fighting the Black Fang as well?
4042,Karel: The Black Fang is gathering recruits. I want to hone my blade on them.
4043,Lyn: Why would you... Do you have a reason to?
4044,Karel: My sword is my life. My sword is my reason. You are... So beautiful...
4045,Lyn: Pardon?
4046,"Karel: Your blade and mine are different, yet...Your swordplay is truly beautiful. Very well. I will join you."
4047,Lyn: You're going to help us? But...why?
4048,Karel: Someday you will be a renowned swordfighter. Losing you here would be a waste. I must see you... stronger. I will wait for that time with much anticipation.
4049,Lyn: ......
4050,Karel: Shall we continue. The feast awaits...
4051,"Eliwood: You... Can it really be? Is it you, Harken?"
4052,Harken: ......Ah!
4053,"Eliwood: Wait, please! You're Harken, a knight of Pherae, aren't you?"
4054,Harken: Lord Eliwood?
4055,Eliwood: I heard that all my father's men had fallen defending him. It's good to see you well. Why didn't you return to Pherae?
4056,Harken: I failed in my duty to protect my sworn lord... I am not worthy of the honor of being a knight of Pherae.
4057,Eliwood: Harken...
4058,"Harken: Before Nergal's magic, we were annihilated. When Lord Elbert was taken away, I was...powerless..."
4059,Eliwood: Nergal...
4060,Harken: I heard he shared some connection to the Black Fang. I searched the continent for signs of them... I intended to strike against them with my final breath.
4061,"Eliwood: And that's what brought you here... In that case, Harken, you should come with us."
4062,"Harken: Forgive me, Lord Eliwood... I would rather die a knight than live in shame. I will trade my life for many of theirs."
4063,Eliwood: Hold! Harken!! Do you think my father would want that?
4064,"Harken: Lord Eliwood, please..."
4065,"Eliwood: Join me, Harken. Neither my father nor I would condone such a senseless death. Help me fulfill my father's one ambition and restore peace."
4066,Harken: ...I understand. My life is yours. May it serve you better than it served your father.
4067,"Isadora: You! Can it truly be you, Harken?"
4068,Harken: Isadora!?
4069,"Isadora: Wait! You are Harken, a knight of Pherae, are you not?"
4070,Harken: Isadora...
4071,Isadora: You... You're alive. We'd heard that all of you had perished. Thank goodness... Thank goodness you're well. But how is it that you're here?
4072,Harken: I failed in my duty to protect my sword lord... I am not worthy of the honor of being a knight of Pherae.
4073,Isadora: Harken...
4074,"Harken: Before that man's magic... we were powerless. When Lord Elbert was taken away, I... I could do nothing..."
4075,Isadora: ......
4076,"Harken: I learned that the man who took Lord Elbert...Nergal, shared some connection to the Black Fang. I searched the continent for signs of them... I intended to strike against them with my final breath."
4077,"Isadora: ...... Lord Eliwood... He's here, too. Come, Harken. You must join us."
4078,"Harken: ...I cant, Isadora. I would rather die a knight than live in shame. I will trade my life for many of theirs."
4079,"Isadora: Wait! Please, Harken! Don't be foolish!"
4080,Harken: Isadora...
4081,"Isadora: I've just now found you again when I thought you were lost. If you vanish from my life once more... Please, Harken. Do not waste this chance. I beg of you..."
4082,"Harken: ...... I understand. Isadora, I'll do as you ask. My life for my dead lord and for his son, Eliwood."
4083,"Marcus: Harken! You are a knight of Pherae! It is you, isn't it, Harken?"
4084,Harken: ...... Lord Marcus...
4085,"Marcus: I received reports that said the entire elite guard had fallen... It looks like you survived. Tell me, why did you not report to Pherae?"
4086,Harken: I failed in my duty to protect my sword lord... I am not worthy of the honor of being a knight of Pherae.
4087,Marcus: Harken...
4088,"Harken: Before Nergal's magic... we were annihilated. When Lord Elbert was taken away, I was...powerless..."
4089,Marcus: Nergal...
4090,Harken: I learned he shared some connection to the Black Fang. I searched the continent for signs of them... I intended to strike against them with my final breath.
4091,"Marcus: ...... Harken, come with me. You must aid Lord Eliwood in this war."
4092,Harken: But...I...
4093,"Marcus: Do not waste the life you swore to Pherae. We are knights, Harken. Be mindful of your oath. You must not die here. For the sake of our fallen master ...live now and, fight."
4094,"Harken: I understand. My life for my dead lord and for his son, Eliwood."
4095,Lowen: You... Can it be? Lord Harken?
4096,Harken: ......!
4097,"Lowen: Wait, please. It has to be you... Lord Harken, a knight of Pherae!"
4098,Harken: You... You're one of Lord Marcus's young men.
4099,"Lowen: Yes! I am Lowen. I'm currently traveling with Lord Eliwood. I'd heard that your entire company fell, Lord Harken... And yet, at least you survived! Lord Eliwood will be pleased. Why... Why are you in this place?"
4100,Harken: I failed in my duty to protect my sword lord... I am not worthy of the honor of being a knight of Pherae.
4101,Lowen: Lord Harken...
4102,"Harken: Before that monster's magic... we were annihilated. When Lord Elbert was taken away, I was...powerless..."
4103,Lowen: ......
4104,"Harken: I learned that the man who took Lord Elbert...Nergal, shared some connection to the Black Fang. I searched the continent for signs of them... I intended to strike against them with my final breath."
4105,"Lowen: What a tale... Come, you can join us, Lord Harken."
4106,"Harken: I cant, Lowen. I would rather die a knight than live in shame. I will trade my life for many of theirs."
4107,"Lowen: Wait, please! Lord Elbert would not have wanted this!"
4108,Harken: Lowen...
4109,"Lowen: Please, be prudent. Lord Eliwood, Lord Marcus, and Lady Isabella... I know that none of them would want you to do this."
4110,"Harken: ...... You're right. You speak the truth, young Lowen. Let us go and see Lord Eliwood. My life for my dead lord and for his son, Eliwood."
4111,Hector: You-- It can't be... Harken?
4112,Harken: ...Oh!
4113,"Hector: Hey, hang on! Wait a moment! Wait! You're one of Pherae's knights! Harken, right?"
4114,Harken: ...Lord Hector.
4115,"Hector: You were one of Lord Elbert's sworn men, right? I'd heard all his knights died on Valor... Why didn't you return and report to Eliwood."
4116,Harken: I failed in my duty to protect my sword lord... I am not worthy of the honor of being a knight of Pherae.
4117,Hector: ...
4118,"Harken: Before Nergal's magic, we were annihilated. When Lord Elbert was taken away, I was...powerless..."
4119,Hector: That dog Nergal...
4120,Harken: I learned he shared some connection to the Black Fang. I searched the continent for signs of them... I intended to strike against them with my final breath.
4121,"Hector: And now you are here. You can fight with us, Harken. Eliwood is here as well."
4122,"Harken: Forgive me, Lord Hector. I would rather die a knight than live in shame. I will trade my life for many of theirs."
4123,"Hector: Hold, Harken! Do you think that's what Lord Elbert would ask for?"
4124,Harken: ......
4125,"Hector: I'm not from Pherae, so it may not be my place to say, but... Eliwood waited for you... for any of you to return."
4126,Harken: ...Lord Eliwood.
4127,"Hector: Eliwood is in a war. If you're a true knight of Pherae, you need to be by his side."
4128,Harken: ...I understand. My life is his. May it serve him better than it served his father.
4129,Isadora: Young sir... Are you not Sir Harken?
4130,Harken: ......Oh!!
4131,"Isadora: Hold! Are you not Sir Harken, a knight of Pherae?"
4132,Harken: ...Sir Oswin.
4133,Isadora: I'd heard that your entire company had fallen. It is good to see that you are alive and well. Is Lord Eliwood aware that you survived?
4134,Harken: I failed in my duty to protect my sword lord... I am not worthy of the honor of being a knight of Pherae.
4135,Isadora: Sir Harken...
4136,"Harken: Before Nergal's magic... we were annihilated. When Lord Elbert was taken away, I was...powerless..."
4137,Isadora: Nergal...
4138,Harken: I learned that he shared some connection to the Black Fang. I searched the continent for signs of them... I intended to strike against them with my final breath.
4139,"Isadora: I see... Be that as it may, Lord Harken, you may now travel with us. Lord Eliwood is also with us."
4140,"Harken: Please, Sir Oswin... I need you to understand. I would rather die a knight than live in shame. I will trade my life for many of theirs."
4141,"Isadora: Sir Harken, did you not swear a life of service to Pherae?"
4142,Harken: ......
4143,"Isadora: As a knight of Ostia, it may not be my place to speak, but... Lord Eliwood waited for you... for any of you to return."
4144,Harken: ...Lord Eliwood.
4145,"Isadora: Lord Eliwood waits for you still. We are knights, bound by duty to the houses we serve. You can still be of service to your lord and master."
4146,"Harken: ...You are right, Sir Oswin. Forgive my weakness. My life for my dead lord and for his son, Eliwood."
4147,Eliwood: Everyone is being driven mad by Nergal...
4148,"Lyn: It must be terrifying, to lose yourself entirely... To fall completely under the sway of Nergal's power... ...Hey! What could this be?"
4149,Eliwood: It can't be... the Fire Emblem?
4150,Hector: So this madman had it all along? Let's take it and go!
4151,Lyn: We've finally gotten it back... Let's not waste our good fortune.
4152,Hector: Eliwood! There's no reason for us to stay any longer!
4153,Eliwood: I know! Let's make haste for the manse! We must stop the assassination! We cannot let the prince's life be put in jeopardy!
4154,"Sonia: You know your role, yes? The plan must be carried out tonight."
4155,Nino: Mother...just once...if only for a little while...may I...hold your hand?
4156,"Sonia: Nino, you know how I abhor such displays."
4157,Nino: I... I know. But...I may not get another chance... And I thought...
4158,Sonia: ...Very well.
4159,Nino: Huh?
4160,"Sonia: If you complete this mission, I'll hold your hand as often as you like. I will even hug you and stroke your face."
