,0
2217,"Eliwood: We can go to the Dread Isle now. Please, Father... be well."
2218,"After speaking with the Ostian spy Leila, Eliwood realizes he must travel to Valor, the Dread Isle. They head straight to the port city of Badon seeking passage. After a long journey, they spot a fog-enshrouded isle on the horizon. Eliwood's father is on the isle, as is the Dragon's Gate. As they draw closer to the isle, Eliwood no longer fears that his father might be one of the conspirators. As the moment of truth nears, Eliwood only prays that he is safe.
"
2219,"Fargus's ship sails along smoothly. At last, they spot a fog-enshrouded isle on the horizon. Eliwood's father is on the isle, as is the Dragon's Gate. As they draw closer to the isle, Eliwood no longer fears that his father might be one of the conspirators. As the moment of truth nears, Eliwood only prays that he is safe.
"
2220,"Fargus's ship sails along smoothly. At last, they spot a fog-enshrouded isle on the horizon. According to Leila's information, the enemy is gathering there. Darin, the marquess of Laus, the Black Fang assassins, the mysterious Nergal, and his henchman, Ephidel. As the island draws closer, Hector hears death whispering on the wind.
"
2221,"Fargus: Ahoy, laddie! You don't get seasick, do you?"
2222,"Eliwood: I'm fine, sir. This is a beautiful ship."
2223,"Fargus: Gwaa ha ha! For a sea rover, eh?"
2224,Eliwood: May I ask you a question?
2225,Fargus: What is it?
2226,"Eliwood: Why did you agree to give us passage? When we said that we wished to travel to Valor, the people in the harbor treated us as though we were mad."
2227,"Fargus: I'm sure they did. It is the Dread Isle, after all. If not for good reason, we wouldn't want to go either."
2228,Eliwood: And yet... you've given us free passage. Why is that?
2229,"Fargus: Listen to me, laddie. Man are strange beasts. We can't resist a challenge. Something appears on the horizon, and we immediately set sail. Some dreams we conquer, others we abandon... I've grown old. I haven't had a good challenge in many a year. Then you mooncalves appear seeking passage to the Dread Isle. I was impressed with your courage. I think you may be the ones to survive the Dread Isle."
2230,Eliwood: We won't disappoint you. We will return.
2231,"Fargus: All right. Then we'll weigh anchor and wait for you. Light a signal fire when you want to return, and we'll pick you up."
2232,Eliwood: Thank you.
2233,Dart: Captain! There's a dory adrift to port! It looks like there's someone aboard. What're your orders?
2234,"Fargus: Bring 'em aboard..... Looks like we've got a visitor. Odd though, finding a boat adrift near here..."
2235,Eliwood: Odd? Why is that?
2236,Fargus: The sea currents in this area... Anything drifting around here must've come from the Dread Isle.
2237,Eliwood: Oh...
2238,Fargus: Shall we greet our guest?
2239,Lyn: .......
2240,Hector: Eliwood! ...Huh?
2241,"Lyn: If you're looking for Eliwood, he's talking with the captain."
2242,Hector: Oh. I won't bother him then.
2243,Lyn: ....... ...Do you need something?
2244,Hector: I'd like you to stop pouting. This pirate ship is the only way for us to get to the Dread Isle. I thought you understood that. Was I mistaken?
2245,Lyn: How I feel or what I think is no concern of yours!
2246,Hector: Eliwood told me...about your parents and those bandits. But these pirates? They don't seem like bad fellows.
2247,"Lyn: It wasn't just my parents! My entire tribe! Everyone was killed! They poisoned our drinking water... My people were in such pain, they could hardly stand... That's when the bandits attacked! They waited until we were defenseless!"
2248,Hector: .......
2249,"Lyn: My father put me on his horse, and I escaped... Just me. My poor father... The pain must have been terrible. He lifted me up...his arms shaking... ...with his last breath... Now do you understand? I was found unconscious by another tribe...and I awoke ten days later. When I awoke... What I felt... The bodies of my people had already been buried. I never even had the chance to say farewell. My last memory of my father... He was...broken...dying. I can still see the axes rising and falling. It... It's not........"
2250,Lyn: Hey!! What are you doing?
2251,"Hector: You're a strong woman, Lyndis. I thought you would not want anyone to see you cry."
2252,"Lyn: You're such a fool! If you think that's what I want, then why not just leave!"
2253,"Hector: I... I lost my parents, too."
2254,Lyn: You...
2255,"Hector: It was illness that took them. Nothing like what happened to you. Still, I wanted nothing more than to cry like a little baby. And yet, I couldn't cry... Not in front of others. And when I was alone, I found I still couldn't. So...I simply thought...I don't know..."
2256,Lyn: You really are a fool. That's no way to... You can't just... ... .... ...
2257,Hector: .......
2258,Pirate: Ahoy! There's a small dory adrift to port!! Someone's on board! Tell the captain!
2259,Lyn: A boat? What's going on?
2260,Hector: Let's go see!
2261,Hector: Eliwood! You done talking to old man Fargus?
2262,Eliwood: You saw us?
2263,"Hector: No, I heard you'd gone off with him. You learn anything?"
2264,"Eliwood: ...We can trust him. We got lucky, finding him."
2265,Hector: Hmmm. If you say so.
2266,"Lyn: Hey, you two! Come here! They've pulled the dory aboard! I wonder who's on board. It's... It's a girl!?"
2267,???: ...Uh...uhnn...
2268,Dart: Oy! You there!
2269,Lyn: Me?
2270,"Dart: Give me a hand, will you? I don't know where to... grab her."
2271,Lyn: ...OK.
2272,Hector: Such the gentleman.
2273,Dart: Stow it!
2274,Lyn: Hm? Ninian!? Ninian! Wake up!!
2275,Eliwood: Unbelievable... What are the chances?
2276,Hector: Do you know her?
2277,Eliwood: She's how Lyndis and I met a year back. I rescued Ninian from a band of villains.
2278,"Lyn: Please, Ninian! Open your eyes!!"
2279,Ninian: .......Ah....
2280,"Lyn: Ninian, can you hear me?"
2281,Ninian: ............Unnn...I.......
2282,Lyn: Are you well? Why were you on that boat? Where is Nils? Why wasn't he with you?
2283,Ninian: .........Ah...ah....
2284,Lyn: Ninian?
2285,"Eliwood: Lyndis, something's wrong with her."
2286,Ninian: Who...Who..
2287,Dart: Captain! Pirate ships approaching from the northwest!
2288,Fargus: Do they dare attack Captain Fargus and the Davros? They must be mad!
2289,Dart: What flag are they flying? I've never seen that pattern before.
2290,"Fargus: These seas belong to us! Whoever they are, they're in our waters! This is a day for strange occurrences, it seems. You whelps watch your own hides. We've no time to waste on you!"
2291,???: Uwaaaaaaa!! Water!!! The hull's been breached! We're taking on water!!!
2292,Fargus: Breached? Those scum are more dangerous than I'd thought!
2293,"Dart: It's bad, Captain! We need all hands belowdecks, or we'll sink!!!"
2294,Fargus: Take care of it! I'm going to carve these scallywags some new gizzards!
2295,"???: We need your help! The water's up to the galley! You must come below, Captain!"
2296,Fargus: Grrr...
2297,Eliwood: Fargus! Leave the enemy to us!
2298,"Hector: Fighting is something we're good at! But a sinking ship? That's your affair! You have to do something, or we'll all drown!"
2299,Lyn: We'll deal with things up here. Please! Hurry!
2300,Fargus: Fine!! The deck is yours! I'll be back as soon as we've plugged the breach in the hull!
2301,Eliwood: Go! (Fargus and pirates leave) Lyn! Take her to that room!
2302,Lyn: I will. (She and Ninian leave)
2303,Hector: Here they come!
2304,Zoldam: All we want is the girl. Kill the rest.
2305,"Jake: Ahoooy! Can you hold the deck until reinforcements arrive? Who? Me? I’m Jake. Hm? Aye, I’m new to the Davros’s crew. Huh? You heard about me from Anna? Oh… So she’s worried about me? That warms my heart, my friend! Let me give you some information. We’ve got merchants aboard. Buy what you need from them. This is the armory. This is the shop. You won’t be able to stock up once we reach the Dread Isle. Buy as much as you can carry while you’ve got the chance!"
2306,"Dart: Ahoy! We’ll leave the fighting to you. Hold on until we can help! Oh, and we’ve merchants aboard. This is the armory. This is the shop. You won’t be able to stock up once we reach the Dread Isle. I suggest you buy as much as possible while you’ve the chance!"
2307,"Guy: Ohhh... I'm going to be sick. Doesn't this bother you, Mark? This ship moves too much... I... I can still fight, though. My sword arm's fine!"
2308,"Priscilla: Mark? What is it? No, I'm fine. I'm not seasick at all. Thank you for your concern."
2309,Zoldam: Move ’round to the enemy ship’s stern. That’s where they should be waiting… That’s where they’ll die.
2310,"Fargus: Ahoy! I’m back! Now, who wants to die first? What’s this? You’ve routed ’em already? Nicely done, whelps!"
2311,Hector: Those sea dogs were no match for us!!
2312,Eliwood: ……
2313,Lyn: Ah! Ninian! You can’t come out yet! There’s blood everywhere!
2314,Ninian: …Blood?
2315,Eliwood: Look out!
2316,Ninian: …Ah! I’m sorry.
2317,Eliwood: Are you OK? Ninian?
2318,Ninian: Ninian? Is that…me? Is that…my name?
2319,Lyn: Ninian! What’s happened to you…
2320,Ninian: …I… My head…is so foggy. Am I…at sea?
2321,Lyn: Yes. We found you adrift in a small boat.
2322,"Fargus: Those scum were after the girl, it seems. Will you take her with you? The men are afraid she, well, she might be cursed, you know?"
2323,Hector: Cursed…?
2324,Lyn: Are you suggesting we leave Ninian behind?
2325,"Hector: We can’t take her with us, can we? We’re heading for the Dread Isle. It’s dread for a reason, you know!"
2326,Lyn: Regardless…she goes with us!
2327,Eliwood: Lyndis?
2328,"Lyn: When I saw her, I remembered something. The last time I saw Ninian… She and her brother were being hunted by some dark-robed men."
2329,Hector: Dark-robed? Are you sure?
2330,"Lyn: Yes, I think it must be the Black Fang. It didn’t occur to me before, but now I’m certain."
2331,Eliwood: How can you be sure?
2332,Lyn: I can’t explain… There’s something in the air that hints at their involvement.
2333,"Eliwood: If it’s true, then she’s likely to be attacked again."
2334,Lyn: Almost certainly. We can’t leave her behind. I will watch over her. Please…
2335,Eliwood: I understand. We should be by her side to protect her.
2336,Lyn: Thank you.
2337,Eliwood: We’re all going to that island. Will you come with us?
2338,Ninian: Yes… Please…take me with you.
2339,Hector: “Something in the air”… Are you some sort of hound?
2340,Lyn: Ah! Are you mocking me?
2341,"Hector: No, the opposite. I’m in utter admiration. …Say, Eliwood. When I left Ostia, I was attacked by a dark-robed group."
2342,Eliwood: What? Why didn’t you tell me this before?
2343,Hector: Many people hold a grudge against Ostia. I didn’t think it had anything to do with this. Until now…
2344,"Eliwood: Hector, do you think…"
2345,"Hector: They were all wearing very distinct black robes. I don’t know about “something in the air,” but… I’m convinced they were related."
2346,Eliwood: What in the world is happening in Lycia? …Father……
2347,Fargus: We’ve arrived.
2348,Eliwood: Thank you very much.
2349,Fargus: We’ll wait two weeks. Finish up by then.
2350,Hector: That’s more than enough time!
2351,"Fargus: And I’ve got a half-wit sailor who wants to go sightseeing. C’mere, Dart!"
2352,"Dart: I’m here, Captain! Ready to serve!"
2353,Eliwood: We’re pleased to have you.
2354,Fargus: His only redeeming feature is his sturdiness. Maybe he’ll come in handy.
2355,"Dart: Come on, Captain! I’m better’n that!"
2356,Eliwood: You’ve done so much… I can’t thank you enough…
2357,Fargus: Come back alive! That’s all the thanks I need.
2358,Eliwood: All right. Farewell!
2359,Hector: We’ll be back before you know it!
2360,"Lyn: …There are good people, even among pirates."
2361,Hector: I don’t think the old man and his group are your average pirates.
2362,Eliwood: Somewhere within that forest is the Dragon’s Gate.
2363,"Hector: Eliwood! No matter what it takes, we’re coming back with your father!"
2364,Lyn: …We’ll surely find him. We’ll all do our best to make it so.
2365,Eliwood: You’re right. Let’s make preparations to enter the forest.
2366,Hector: Oh!
2367,Ninian: Dragon’s Gate…
2368,Lyn: Ninian? What is it?
2369,Ninian: It’s…nothing……
2370,"Eliwood arrives on the shores of Valor with a new companion in his numbers, an enigmatic young girl named Ninian. The majority of the island is covered in dense forest. Legend has it that no one has ever returned from those dark woods. A dense fog crawls over the party, engulfing them one by one... Cautiously, they move deeper into the trees.
"
2371,"Nergal: Shame on you, Marquess Pherae. You freed the boy AND the girl?"
2372,Elbert: I will not let you move unopposed!
2373,"Darin: (Appears behind Nergal) Wh-What shall we do, Lord Nergal? With both siblings gone, we can no longer hold the ceremony."
2374,"Elbert: How many times must I tell you, Lord Darin? You are being used by this man!! By helping him bring dragons back into this world, you are helping him destroy mankind! Do you understand?!?"
2375,"Darin: Pah...ha ha ha... Destroy mankind? Dragons may have been a threat to mankind in ages past, but with Lord Nergal's power, we've got nothing to fear! Lord Nergal can control dragons!!! Ha ha...ha ha ha..."
2376,Elbert: Lord Darin.... You're already lost. (Darin leaves)
2377,"Nergal: I'd planned to start a war in Lycia. The war I was plotting in Lycia would've generated a glorious amount of FORCE in one blow. You were not equal to the task, it seems. Not to worry, I've other means at hand."
2378,Elbert: Black-hearted fiend! Guuuh!!
2379,Nergal: Hold your tongue. There is still a task you must perform for me. Ephidel! Limstella! (Ephidel and Limstella appear)
2380,"Nergal: My beloved morphs, my beauteous works of art. I've new jobs for you, my pets. First, Limstella. You will go to Bern and contact Sonia. I want you to arrange a meeting with the king."
2381,Limstella: Understood. (Limstella leaves)
2382,"Nergal: Ephidel, take this... man, Marquess Laus, and go. I want you to exterminate the mice who've landed on the island."
2383,"Ephidel: Yes, master. (Ephidel leaves)"
2384,"Nergal: That leaves you, Marquess Pherae. It seems your legacy is one of endurance."
2385,Elbert: !?
2386,Nergal: ...The mouse who interfered with my conquest of Lycia is named Eliwood. Should he be congratulated on making it this far?
2387,"Elbert: Eliwood? My son is here? Stop! Do with me what you will, but let my son be!"
2388,"Nergal: Hm? Heh... Hehahahaha!!! Remember the siblings you freed? The girl's here, too. As a matter of fact, she's with your son, Eliwood. Quite a delicious twist of fate, wouldn't you say?"
2389,Elbert: ....This can't be...
2390,"Nergal: Eliwood will die in these woods. The girl will be returned to me, and the ceremony will take place. Hm... Despite those long hours of torture, you remain undaunted. Such courage will make you the perfect sacrifice, Marquess Pherae. (Nergal leaves)"
2391,Elbert: Eliwood... Turn back... Take the girl and flee...... Please.........
2392,"Leila: I can't believe it's come to this. I must inform Lord Hector of these events... If I hurry, I may be in time. What!?"
2393,Ephidel: (Appears) Leila... Where are you going?
2394,Leila: Lord Ephidel... The sentries... I'm going to check on...
2395,"Ephidel: (Moves closer) You overheard, did you not? ...And I had such hopes for you. Jaffar! (Jaffar appears behind Leila)"
2396,Leila: Ah!!
2397,Jaffar: The punishment for traitors is death. (Combat animation of Jaffar killing Leila)
2398,Lelia: !!!!! Aa.......Ma....Matthew........
2399,"Ephidel: ....Impressive, Jaffar. Your power is beyond compare."
2400,Jaffar: ......
2401,Ephidel: Take this woman's corpse and leave it in the forest. Let it serve as a warning to those fools.
2402,Lyn: Let's get through these woods. It's starting to get foggy... Try not to get separated.
2403,"Hector: (Appears behind her) ""Enter and be lost."" It feels like we're not coming back."
2404,Lyn: Hector!! Are you trying to curse us?
2405,"Eliwood: Are you well, Ninian?"
2406,Ninian: ....Y-Yes... I'm.... I'll be fine.
2407,Eliwood: !? Someone's there!
2408,Hector: Who? A sentry?
2409,"Hector: Leila! Is that you? Impressive work, finding your way here!"
2410,Eliwood: ...Something's wrong. Leila? (Leila's sprite disappears) Lei--!!
2411,Lyn: She's...dead...
2412,Ninian: No!
2413,Hector: ...This can't be. She was one of our best spies. Leila....
2414,Matthew: ......
2415,"Hector: ...I'm sorry, Matthew."
2416,"Matthew: ...Why do you apologize, my lord? Leila blundered. ....That's all."
2417,Eliwood: Matthew... Leila was... She was...
2418,"Matthew: After this mission, I was going to ask her to put this life behind her... Waited too long, didn't I? Ha..... .....My lord, might I...rejoin you later? She has to be buried..."
2419,Hector: ...Of course.
2420,Lyn: Ah... I'll go with you...
2421,Eliwood: ...Let them be alone. There's nothing else we can do....
2422,Hector: Blast! They put her out here for us to find like this!
2423,Lyn: Unforgivable! This is... a foul deed. Beyond foul.
2424,Eliwood: .....Let's go! The foe is somewhere in this forest. We must stop this before any more die!
2425,Ninian: Ah! ....Beware! Something comes!
2426,Lyn: What? (Uhai appears behind Lyn) Kyaa!
2427,Eliwood: Lyndis!!
2428,"Uhai: ...If you value her life, send the girl to me."
2429,Ninian: ...Ah.
2430,"Lyn: You, you're Sacaen!"
2431,"Uhai: That's correct... I am Uhai of the Black Fang. I've been sent to capture the girl... And to kill the lot of you. If, however... you hand over the girl and depart the island at once, I'll grant you your lives."
2432,Lyn: And if we refuse?
2433,"Uhai: You know nothing, little lord. Nothing of Nergal's might. Nothing of his terrible power. You are ignorant, and so you hope to oppose him. You are insects railing against the heavens. Your actions will change nothing. Speak no more foolishness and begone!"
2434,"Eliwood: ...Maybe we don't know what it is we're fighting... But if we flee, our loss is assured. So we will continue to struggle, and we may yet prevail!"
2435,Uhai: ...Folly. (Moves back)
2436,Lyn: What?!
2437,"Lyn: Why are you letting me go? Holding a woman hostage during battle is shameful. You, too, are of Sacae, and I've a mind to show you mercy. I will let you die with a sword in your hands. But rest assured... I will kill you all here. But be of good cheer! In dying, you shall all be spared the calamity that is to come!"
2438,Ninian: ......
2439,"Eliwood: Ninian, you must hide. We will meet the enemy!"
2440,"Dart: You're Mark, right? I'm Dart, leader of Fargus's suicide squad! The captain's ordered me to follow your commands. So, who do you want me to take care of?"
2441,"Rebecca: Um, Mark. Can I ask you something? Do you think Dart and I...have anything in common? What? Not at all? Hmmm... I don't know, there's something about him."
2442,"Uhai: Guuu... Well...done...... You are...stronger...stronger than I expected. Out of respect... ...a final gift from me... From here, go south. ...Turn at the rotted tree. Head...west. There lies the path to the... ...Dragon's Gate... Unnh..."
2443,Eliwood: Uhai... I wish we could've met under different circumstances.
2444,Hector: ...Do we trust him?
2445,"Lyn: He was a Sacaen. He would not lie. ...I, at least, choose to believe him."
2446,Hector: ...Let's go then.
2447,Eliwood: To the Dragon's Gate!
2448,"With Uhai's dying words still sounding in their ears, they venture deep into the forest's heart. Lyn moves in utmost silence, cautious not to alert any hidden enemy. However, following on her path, a new Black Fang shadow appears.
"
2449,"Fiora: Honored tactician... Your name is Mark, correct? The enemy commander is readying his troops beyond that mountain. I can fly over the mountain and direct you, but... Getting too close could prove to be dangerous. Bear that in mind when you give me my orders."
2450,"Following Uhai's last words, Eliwood ventures toward the heart of the forest. He is greeted by an extraordinary sight. A building unlike any he's ever seen. It was clearly not wrought by human hands. It is waiting...waiting for the masters who abandoned it centuries past. Massive beyond belief, these ancient ruins have nothing to do with humankind. Eliwood has arrived. He has found the Dragon's Gate.
"
2451,"Battle Quote
"
2452,"Defeat Quote
"
2453,Eliwood: ...We’re here. The Dragon’s Gate...
2454,Ninian: ......
2455,"Eliwood: What’s wrong, Ninian? You’re trembling."
2456,Ninian: ...This place... so frightening. Something... powerful...
2457,"Lyn: It’s her power, isn’t it?"
2458,Hector: Her power? What’s that?
2459,"Lyn: Ninian has the ability to sense impending danger. Her memory may be gone, but her power remains."
2460,"Eliwood: What is it you sense, Ninian?"
2461,Ninian: I... should not have... come here. Something awful will happen if I’m here. Ah!!
2462,Eliwood: Ninian!? Snap out of it!
2463,Ninian: This place... No... I... I...
2464,Eliwood: She’s getting worse! Let’s get her away from here!
2465,Ephidel (out of screen): You’ll not be going anywhere.
2466,"Ephidel: That little bird has escaped this island cage twice. Now that she’s back, she’ll not be allowed to fly away again."
2467,Eliwood: Who are you!?
2468,Ephidel: We meet at last. I am Ephidel. Pleased to make your acquaintance.
2469,Hector: You’re Ephidel? I’ve been looking forward to this.
2470,"Ephidel: ...Gallantly spoken. Of course, I know who you are. Marquess Ostia’s younger brother, Lord Hector. And here we have Caelin’s beloved princess, Lady Lyndis."
2471,Lyn: ......
2472,"Ephidel: By the way, the gift I left for you in the forest… Was is to your liking? The corpse of that filthy red-haired traitor?"
2473,Hector: Monster! Stay right there! I’m going to crush the life from you with my bare hands.
2474,"Ephidel: Now I see! She was an Ostian spy, wasn’t she? Don’t worry, she did not suffer. It only took one blow."
2475,Hector: Die‼
2476,Eliwood: He vanished‼
2477,Ninian: What--!?
2478,Ephidel: This girl is needed for my master’s ceremony.
2479,Eliwood: Ninian!
2480,Ninian: Lord Eliwood! Let me go!
2481,Lyn: Vanished...
2482,Hector: Blast!!
2483,Darin: Lord Ephidel! Is the girl with you?
2484,Ephidel: As you can see...
2485,Darin: Oho! The ritual can take place at last!
2486,"Ephidel: Yes. However, we have an infestation of mice to deal with… They should be scurrying in here momentarily. They must be dealt with before the ritual takes place. May I entrust this task to you?"
2487,"Darin: Of course. Who do you think I am?! I am Darin, Marquess Laus! Ruler of this world!"
2488,"Ephidel: Very well, I leave it to you."
2489,Darin: Ruler of the world... Ha ha ha ha ha ha ha!
2490,Ephidel: Humans… They are so very fragile.
2491,Nergal: Ah... you’ve done well. Precious Ephidel. Shall we prepare for the ritual?
2492,Elbert: Nergal!!
2493,"Nergal: Does it gall you, Marquess Pherae? It’s destiny. There could be no other outcome. Despite all of your mischief, the girl was fated to return to me."
2494,Elbert: My son... Where is Eliwood?
2495,"Nergal: He’s still alive. Of course, it’s only a matter of time before the Black Fang finishes him."
2496,Elbert: ...Nergal! Prepare to die!!
2497,Nergal: Eh!?
2498,Jaffar: ...
2499,Elbert: Urrgg... grrr... haa...!!
2500,"Nergal: ...That was a surprise. When did he undo his bonds? Heh heh... Why do you not heed my warnings, Lord Elbert? You cannot alter destiny. Stop this foolishness."
2501,E lbert: ...Urrgh... grraa...
2502,"Nergal: Jaffar, take Marquess Pherae and the girl to the far chamber. I will begin preparations for the ritual."
2503,Jaffar: Thy will be done.
2504,"Cameron: I’ve been waiting for you, son of Pherae."
2505,Eliwood: Where is my father?
2506,"Cameron: Inside… He’s farther inside. You will never see him, though. Even if you break through here, the path you seek is guarded my Marquess Laus. Will you not withdraw? It’s too late for that, isn’t it? You’ll never leave here alive. Ha ha ha ha ha!"
2507,"Sain: Tactician! The final battle is approaching. That traitor, Laus… He harmed Lord Hausen, caused grief to Lady Lyndis… As a true knight of Caelin, I will make him pay! Leave him to me!!"
2508,"Kent: Mark, let me take the point. I will break through, even though it may cost me my life. If something does happen to me, Mark... Lady Lyndis... Please watch over her. Now, Mark, give me my orders!"
2509,"Enemy: Hey, you! What are you doing here?!"
2510,"Legault: What am I doing? Is that a proper greeting? If you don’t know me, you must be a new recruit, yes?"
2511,Enemy: Uh... I was assigned to the Dragon’s Gate about one month ago.
2512,"Legault: I thought as much. I am Legault. You’ve heard my name, yes?"
2513,Enemy: Legault... Ah! You... You’re the Hurricane? Second in ability to none but the Four Fangs?
2514,"Legault: Yes, yes. That’s me."
2515,Enemy: I... I beg your pardon.
2516,Legault: No worries.
2517,"Legault: ...Now then, time to fill my purse with treasure and leave the Black Fang behind. No sense staying on a sinking ship. No sense at all."
2518,"Legault: Well now, a welcome visitor, indeed. I must thank you for coming so far."
2519,Eliwood: What!? You’re a...
2520,"Legault: Mmm... To be accurate, I would say a former Black Fang member."
2521,Eliwood: Black Fang‼
2522,"Legault: Ha, no! ""Former"" Black Fang. Now I’m simply a thief."
2523,"Eliwood: Huh? So you’re not my foe, is that what you’re saying?"
2524,Legault: Correct. So let’s pretend we never saw each other.
2525,Eliwood: Hold on!
2526,Legault: Hm?
2527,"Eliwood: If you’re not my enemy, may I ask for your aid?"
