,0
4728,"Sanaki: I've received reports that Bishop Oliver, the duke of Tanas, is up to something suspicious. Duke Tanas has a villa near the woods of Serenes. Go there, and return with irrevocable proof of...whatever he's doing. If you succeed in this, I promise to support your Princess Elincia with all the power at my command."
4729,Ike: We'll bring back whatever information it is you're looking for. Be ready for us!
4730,Ike: Is this the place?
4731,"Soren: Yes, it is. It's rather heavily guarded. Even so, I think a direct attack would be our best chance of gaining entrance."
4732,"Begnion Soldier: Halt! Who goes there? What are you doing? This villa is the property of Duke Tanas, senator of the empire! No trespassing!"
4733,"Ike: I am Ike, of the Greil Mercenaries. Under orders from the apostle, we've been charged with investigating the duke."
4734,Begnion Soldier: What? The apostle sent you? Wa-wait here a moment!
4735,"Mist: All right, Brother, we'll sneak around out here and see what we can see."
4736,Ike: Good idea.
4737,"Titania: Leave it to us. If we get stopped, we can talk our way out of it. All right, Mist, let's get going."
4738,Mist: Yeah!
4739,Oliver: What is it I hear? That you lads claim to be here on the apostle's business?
4740,Ike: We have a letter here that bears her seal.
4741,"Oliver: Hmm... Well... I see. It appears genuine. Very well. Am I in a position to ask what, exactly, I am suspected of doing?"
4742,Soren: We are here by the apostle's leave. Do you honestly intend to make us discuss this private matter outside?
4743,"Oliver: Oh! No, no, of course not. Never! I would never insult...Please, c-come inside..."
4744,Oliver: Oh? Slavery? Me? The apostle would honestly accuse me of such an unfashionable thing as slaveholding? Oh ho ho ho!
4745,Ike: Do you claim no knowledge of such a thing?
4746,"Oliver: I've shown you every nook of my mansion, every cranny. I've been most thorough, have I not? And you saw no trace, not a single sign, of any laguz here, did you?"
4747,Ike: That is true.
4748,"Oliver: This accusation is absolutely ridiculous! To think that I, a bishop who serves only the apostle's will, would do anything to violate our country's emancipation act! Be certain that you tell the apostle everything! Tell her that Duke Tanas is upright and cleanhanded! There is not even a shadow of falsehood in my noble eyes! Look into them deeply, my boy, and tell me what you see..."
4749,Oliver: Well? Hmmmmm?
4750,"Ike: Ugh! Hey, stop that! Back off!"
4751,"Soren: We have little choice, do we...I think it would be best if we left for the time being."
4752,Bengion Soldier: Hey! Halt! You can't go in there!
4753,Ike: Ah!
4754,Mist: Ike!
4755,"Ike: Mist, what is it?"
4756,"Mist: Ike, I saw him! In a room on the top floor of this building, I saw someone--I think he was one of the bird tribe! He looked like he was trying to jump out a window, but he was forced away from it and back into the room."
4757,Oliver: Wha-what? What is this...this child babbling about?
4758,Soren: Someone from the bird tribe? Can you describe him?
4759,"Mist: Um, he had long hair! It was...sparkling, like gold. And his skin...it was so pale--almost translucent. Oh! And his wings! They were pure white!"
4760,"Ike: Is that accurate, Titania?"
4761,Titania: It is. I saw him as well.
4762,"Soren: That can only mean there is a member of the heron clan in this place. According to books, only members of the royal heron family possess white wings."
4763,"Ike: It appears that there is at least one room we have yet to see. What is it going to be, Duke Tanas? You can cooperate and show us this room that you somehow forgot, or..."
4764,Oliver: Guards! Kill them all! Don't let a single one escape!
4765,"Ike: So this is how you want to play it, eh? I thought it might come to this. Mercenaries! It's time!"
4766,Devdan: Devdan hears the sounds of battle...
4767,Kimaarsi: You dare to bring conflict into Bishop Oliver's home? My lance will make you pay for your impudence!
4768,"Devdan: Uh-oh. This won't do. Youngsters like you aren't supposed to be fighting, you know?"
4769,Tormod: Wha-what are you doing old man? Don't startle me like that.
4770,"Devdan: Devdan is no old man. Devdan was imprisoned for looking at the lovely flower garden. The punishment for trespassing is to work here for a single year... without pay, unfortunately."
4771,"Tormod: For free? Oh, I know all about that! Well, it's time to fight back! C'mon! We came here to help you out! Fight with us! Get your freedom back!"
4772,"Devdan: You speak oddly, but if you help me, then Devdan says thank you. Devdan is polite and well mannered!"
4773,"Devdan: Uh-oh. This won't do. Youngsters like you aren't supposed to be fighting, you know?"
4774,Sothe: And you are?
4775,"Devdan: Who is Devdan? Devdan is Devdan. Devdan was imprisoned for looking at the lovely flower garden. The punishment for trespassing is to work here for a single year... without pay, unfortunately."
4776,"Sothe: Is that so... That's too bad, but I've got a job to do! A sad story won't make me stay my blade!"
4777,Devdan: A moment! Wait a moment. Devdan does not fight children.
4778,"Sothe: Hmm... In that case, you should join us. That way, we can take care of this without me killing you."
4779,Devdan: Understood. Devdan is a friend to young people everywhere.
4780,"Devdan: Uh-oh. This won't do. Youngsters like you aren't supposed to be fighting, you know?"
4781,"Mist: Who, who are you? Aren't you one of the guards?"
4782,"Devdan: Devdan is not a guard, little one. Devdan was looking at the pretty garden and was captured. The punishment for trespassing is to work for a year without pay... That makes Devdan upset!"
4783,"Mist: Well, that doesn't seem fair. But there's no need for you to just accept such injustice. The owner of this place, Duke Tanas, is keeping innocent laguz as slaves. He's a very bad man."
4784,Devdan: Mmm... That is not acceptable. Devdan cannot forgive such callous and unjust actions.
4785,"Mist: So, why don't you come with us then? Let's go and teach the bad guys a lesson together!"
4786,Devdan: That is a fine idea. Let us make this Duke Tanas pay!
4787,"Devdan: Uh-oh. This won't do. Youngsters like you aren't supposed to be fighting, you know?"
4788,"Rolf: Huh? Uh, who are you, sir?"
4789,"Devdan: Sir? Ho! Devdan is no knight! Devdan is just a simple man who was imprisoned for looking at the flower garden. The punishment was to work here for an entire year... without pay, unfortunately."
4790,Rolf: Is that so? That doesn't seem fair.
4791,"Devdan: This sad world knows little of ""fair,"" does it? Now tell me, young one, what are you doing here?"
4792,"Rolf: Um, well...there's a laguz birdman being held captive here. I came to help him. Duke Tanas is a bad man who keeps laguz as slaves. That's why my friends and I are here to stop him!"
4793,Devdan: Slaves? That is not acceptable! Devdan cannot forgive such callous and unjust actions!
4794,"Rolf: If that's the case, you should join up and help us free them!"
4795,Devdan: Mmm... A fine idea! Devdan is ever on the side of justice.
4796,"Devdan: Uh-oh. This won't do. Youngsters like you aren't supposed to be fighting, you know?"
4797,Soren: What was that? And who are you supposed to be?
4798,"Devdan: Devdan is not supposed to be anyone. Devdan was imprisoned for looking at the flower garden. The punishment for trespassing is to work here for an entire year... without pay, unfortunately."
4799,Soren: And then? Are you telling me this so that I will let you go?
4800,Devdan: A moment! Wait a moment. Devdan does not fight children.
4801,"Soren: If that's true, then why not switch sides and join us? If you become a member of the Greil Mercenaries, we would pay you for your services."
4802,"Devdan: That would be an honor! Please, allow Devdan to join you!"
4803,"Soren: Our contract is complete then. I will pass along the terms of the agreement to our commander, Ike. Now then, I expect you to do your best."
4804,Devdan: Understood. Devdan is a very hard worker.
4805,"Devdan: No, no, no! Devdan does not fight children! Let us talk, please!"
4806,"Devdan: Forgiveness, please. Devdan will try to restrain himself."
4807,Devdan: It is better...that Devdan gets hurt...than hurts...someone else...
4808,"Kimaarsi: This is the domain of my master, Bishop Oliver, the duke of Tanas. You will learn that no one impugns his honor and lives to walk away!"
4809,"Ike: I don't want unnecessary bloodshed. Tell your men to stand down! In your service to Duke Tanas, would you go so far as to oppose the will of the apostle herself?"
4810,"Kimaarsi: ...Defying Apostle Sanaki? Mmm... It is not something I am fool enough to take lightly. Therefore, I will simply ensure that the incompetent messengers who attacked us never return to her palace..."
4811,"Ike: So that's your answer, is it?"
4812,"Kimaarsi: Wretched, baseborn animal! Begone! You will not defile this place!"
4813,Kimaarsi: What... What fate is this? Is it just punishment...for my complicity...in this evil...
4814,Reyson: Ah!
4815,"Oliver: Oh, my sweet, beautiful little bird! Don't be frightened! Come, let us fly away together..."
4816,"Reyson: Stay away from me, you filthy fat man!"
4817,Reyson: ...Urgh!
4818,Oliver: Come quietly! You belong to me! I will not give you up. No one shall take you from me...
4819,"Reyson: Though the price may be my life, I will never cooperate with you!"
4820,"Unknown: Hey! Where are you, Duke Tanas? ...Are you in here?"
4821,Oliver: ...Ah... N-n-nooo...
4822,Ike: Duke Tanas...
4823,Reyson: Who are you?
4824,Ike: Ah! You... You're the Serenes--Are you unharmed? We have come to help you. Your injury... Did that man do that to you?
4825,Ike: This wound must be tended to...
4826,Reyson: Stay back!
4827,Ike: But...
4828,Reyson: Do not approach me! Cursed human!
4829,Ike: The Greil Mercenaries have returned.
4830,"Sigrun: Ah, Master Ike. It is good to see you well. How went the mission? Did you unearth any meaningful proof?"
4831,Ike: Where is the apostle?
4832,Sigrun: Master Ike?
4833,Ike: I must speak with the apostle. Where is she?
4834,"Sigrun: Apostle Sanaki is in the garden, having a pleasant conversation with Princess Elincia. I will go directly and see if she will meet with you. Please wait here."
4835,Ike: In the garden? Great.
4836,"Sigrun: Ah, Master Ike! No! You mustn't behave so! You will cause such problems!"
4837,Ike: Apostle...
4838,"Sanaki: What? You! What are you doing? How dare you approach me unannounced! This is most inappropriate, and I will not--"
4839,"Elincia: What has happened, my lord Ike?"
4840,Ike: All of it. I want to hear all of it...Now!
4841,Sanaki: What are you talking about?
4842,Sigrun: Master Ike! One must not speak to the apostle in such a discourteous fashion!
4843,"Ike: Twenty years ago, something happened in Serenes Forest. Something terrible. I want to know."
4844,Sanaki: What?
4845,Sigrun: Master Ike?
4846,Elincia: W-what happened twenty years ago?
4847,Sanaki: You found one of the heron clan? And a Serenes noble no less...One of them still lives? But that...such a thing...
4848,Sigrun: Apostle Sanaki...
4849,Ike: Tell me.
4850,Sanaki: That is a very...difficult problem...Hmm... How to impart this tale...
4851,"Nasir: It would appear that no one is willing to begin this story. That being so, I would open with what is commonly known of the matter. Do you find this acceptable?"
4852,Sanaki: And you are?
4853,"Ike: He is a friend of mine. Nasir, if you know something, I would hear it. When you are done, the apostle can clarify. Agreed?"
4854,Sanaki: Hmmm...
4855,"Nasir: It begins with the assasination of the previous Begnion apostle. It was twenty years ago... One year after the declaration of emancipation was made. The leader at the time was the Apostle Misaha, who was more adored by the public than any apostle before...or since. When she was assassinated, the citizenry was wracked with grief. All of Begnion despaired. And then, a rumor began to circulate that the assassination was the work of the Serenes herons. In the twinkling of an eye, the rumor spread throughout the Begnion capital. One night shortly thereafter, it happened. The citizens grew violent. They massed at the edge of Serenes Forest, home of their supposed enemy, and set it to burn. The crowd raged on for three nights, and in the end, the heron clan was lost."
4856,"Elincia: But their involvement was just a rumor...Wasn't it? Why, why did they..."
4857,"Sanaki: Oh, the shame of it..."
4858,"Nasir: Apostle? The remainder of the tale is yours. You stand as the empress of Begnion. You are responsible for the acts of your citizens, are you not?"
4859,Sanaki: ...False. The accusation was completely false.
4860,Ike: The assassination of the apostle was not the work of the Serenes clan?
4861,Sanaki: That is correct.
4862,"Nasir: The heron clan possess no fighting skills. Their tribe survived by living a life of peace and piety within their forest. Unlike other laguz, they never focused on developing their strength for the purposes of combat. Anyone with any knowledge of laguz would have known such a thing. At the very least, the citizens of Begnion would have known this. However, they had lost their leader, and in their grief, they cared little for the truth. They were merely looking for some way to vent their rage and despair. Isn't that true...Apostle?"
4863,"Elincia: Please, Lord Nasir! Your tone of voice..."
4864,"Sanaki: It's all right, Princess Elincia. He speaks the truth, be it with a sharpened tongue or no."
4865,"Nasir: Ike, the bird tribes of Phoenicis target only Begnion ships with their piracy. The ravens of Kilvas are after cargo, and so they attack everyone with equal vigor. The hawk clans, however, hold the heron clan as brethren...and still remember the false accusations. And their brutal murder."
4866,"Ike: The heron at Oliver's mansion...He slapped my hand away when I tried to help him. He had such hatred in his eyes. When he leapt from the window, he spoke to me. ""Remember the genocide,"" he said. ""Twenty years have passed, but I will never forgive what you did!"""
4867,"Sanaki: Such needless pain...It may sound like utter hypocrisy, but my people regret deeply the actions of that horrific night. We stole the heron clan from this world... Every time we see the blackened forest, our grave sin comes back to haunt us."
4868,"Nasir: Apostle... You are honorable. The majority of the senators have done their best to banish all memory of the Serenes and that night. Yet you have resisted. That is your intent, is it not? You are not like them... You are attempting to take responsibility for the actions of the people. To undo the wrongs of the past, you launched your own investigation into the laguz emancipation issue. You've even gone so far as to hire outsiders like Ike and his mercenaries to expose the problem, haven't you?"
4869,Sanaki: ...Princess Elincia?
4870,Elincia: Yes?
4871,Sanaki: I would like once more to make use of your escorts. Would you grant me this boon?
4872,"Elincia: Of course! Er, that is...If Ike and his group agree, I have no objection to your proposal."
4873,Ike: Depends on what you want.
4874,Sanaki: The member of the heron clan you met...I want you to find him. I want to meet with him. I want to speak with him.
4875,"Ike: If that is your wish, we will do it. In any case, we let that monster Oliver slip through our grasp. We'll handle both tasks at the same time."
4876,Sanaki: I'm counting on you.
4877,Muarim: Ahem...
4878,Tormod: Muarim!
4879,Muarim: Little one! How... How was it? Were you treated roughly? Did they attempt to punish you?
4880,"Tormod: No, it was nothing. And the apostle? I thought she'd be some mean old hag, but she's just a kid. Really, she's even shorter than I am."
4881,Muarim: Li-little one! You must lower your voice. And watch your tongue!
4882,Tormod: What? Why?
4883,"Ike: Rest easy, Muarim. Everyone in this room is with me. The apostle has no ears here."
4884,Muarim: That is good.
4885,Tormod: Muarim?
4886,"Muarim: Speaking ill of the apostle here is considered treasonous. Keep it up, and they'll kill you--or threaten to."
4887,Tormod: What?
4888,"Muarim: Little one... While we are here, please choose your words with more care than you have shown. I beg of you."
4889,"Tormod: Oh, right. Right. I understand."
4890,"Ike: For a laguz, you seem to know more about the court etiquette here than my fellow beorc, Tormod."
4891,Muarim: Bah...
4892,Tormod: That's 'cause...'cause I don't know much about any of this stuff. That's all!
4893,"Muarim: It is no matter, little one. Ike, the reason I am familiar with the customs of the Begnion nobles is...I myself was once a slave."
4894,Ike: What?
4895,"Tormod: Oh, no..."
4896,"Muarim: For generations, my family...served as slaves to one house. They were wealthy and powerful, senators all. As a child, I was raised never to question my station as a slave. From the day that I was born, the most grueling physical labor was as natural as breathing. I knew nothing else. To ensure we were liked by our masters, we were drilled in the etiquette of polite society until it became second nature. We were slaves... We did what we could to live as long as we could. The most important thing was not to incur the wrath of our masters. If we displeased them, we were punished. If we were lucky, we were beaten. If we were unlucky..."
4897,Tormod: Muarim! That's enough!
4898,"Muarim: I am sorry. Lord Ike...If a former slave like myself is present, all of you will be judged, scorned, and looked down upon. I came here...to ask if you would... take care of something for me. I would have you take care of the little one."
4899,"Tormod: Why would you say such a thing? You were born a laguz slave...And you're not allowed to be free...That's not right! That's why we promised each other we'd change all of that. We made a promise! Laguz, like beorc, would build homes and plant fields! Families would live together in peace and freedom! That's the world we dreamed of..."
4900,Muarim: That's a dream that belongs to us as former laguz slaves. We don't need the help of another beorc like you.
4901,Tormod: What?...sniff!
4902,Muarim: Little one!...
4903,Ike: ...Does it really warrant that much concern?
4904,Muarim: Huh?
4905,"Ike: Since I first arrived here in Begnion, it's something that's been bothering me. If you're born into a noble house, you're a noble. If your parents are slaves, you're a slave. Do you think a person's worth is decided at the moment of their birth? That's... I can't understand a country where that passes for normal, I just can't."
4906,"Muarim: Those don't sound like the words of someone working for Princess Crimea. Princesses are princesses because they're born into royal families, right? Are you going to deny that?"
4907,"Ike: No, you're right. Elincia... She is a princess. I don't think we've treated her with more respect than any other employer we've had, but...Heh. Funny. We've addressed her as ""Princess"" the entire time, but I've never really considered what it meant."
4908,"Muarim: From where I stand, I think you've been blessed. You were born a beorc and raised in a country with a lenient social structure. That's an enviable life."
4909,"Ike: It's so hard... I... No matter how I try, I'll never fully understand your pain. But listen, I didn't treat Elincia any differently after I learned of her heritage. I'm not going to think of you or treat you differently just because you used to be a slave. It's not going to happen. You're...you. And I'm free to think of it that way if I want, right?"
4910,Muarim: ...
4911,"Ike: Muarim, there's nothing anyone can do about your past. About the burdens you carry. And I know I don't know everything that's going on, but you shouldn't be trying to push Tormod away. He's dedicated to you, and being with you is his choice. It's part of his freedom."
4912,Muarim: ...I see now. I will go...and find him.
4913,"Ike: If meeting those in the temple is uncomfortable, I can go and bring him back. What do you think?"
4914,"Muarim: No, I can do it. I have a good nose. Tracking the young one's scent while avoiding other beorc is an easy task."
4915,Ike: I see.
4916,Muarim: Ike... I want... I mean...Never mind. May our friendship be true and enduring.
4917,Ike: I share your sentiment. Our troop will have you for as long as you wish.
4918,Ike: What the...? Um...who are you? How long have you been a member of my troop?
4919,Stefan: I joined after the battle in the sands. My name is Stefan. I apologize for not introducing myself earlier.
4920,Ike: Why are you here?
4921,"Stefan: In part it's because I'm curious. But mostly, it's the guiding hand of fate that has led me to you."
4922,Ike: Huh?
4923,"Stefan: In the desert, I watched the dance of your sword. You have a unique style, but it is incomplete, filled with hesitation. You have recently lost your teacher, no?"
4924,Ike: Ah...
4925,"Stefan: Luckily, your foundation is quite strong. Which is why I can be of service. Your technique... How powerful will it be when perfected? I would like to know."
4926,Ike: Wh-who are you?
4927,"Stefan: You can learn the dance of blades from me without knowing my history, can you not? What say you? Let your heart decide."
4928,"Ike: I understand. If you can help me perfect my technique, I will gladly accept an invitation to learn from you."
4929,Stefan: Then prepare yourself. Come! Attack me with all your strength.
4930,"Ike: I appreciate the offer, but I decline. I must perfect my technique on my own. Under my own power."
4931,"Stefan: Very well. That, too, is an honorable path. With your leave."
4932,"This content was originally provided by Generic Officer.
"
4933,"Exit Base
"
4934,Tibarn: Is that it?
4935,"Nealuchi: Wait, there's more! It seems that Prince Reyson was able to escape Duke Tanas's villa and make his way safely to Serenes Forest. However...we have word that Tanas's men have entered the forest in hopes of recapturing the prince. We've not a moment to waste! Please, O king of hawks! Reach out your mighty talons, strike down these wretched humans, and rescue Prince Reyson. I implore you, Your Majesty, take wing at once!"
4936,Tibarn: Why is Naesala not here?
4937,Nealuchi: That...er... His Highness must not be seen here at this time... It's--
4938,"Janaff: What's going on, you old buzzard? King Kilvas is the White Prince's friend, isn't he?"
4939,"Nealuchi: Well...how do I put this? Hm, it's all very complicated..."
4940,"Tibarn: I care not for excuses. If anything happens to Reyson, blood will be spilled."
4941,"Nealuchi: Oh, no! Please! There's no cause for worry. Duke Tanas treats his works of art with a delicacy so extreme that it could best be called...abnormal. He would never let any harm befall Prince Reyson....He probably can't even bring himself to touch him. The king himself told me so. That is the only reason he accepted this proposal--"
4942,Ulki: Proposal?
4943,Nealuchi: Ah! Um... What I mean is...Er...
4944,Janaff: Hold it! You crows set the prince up?!
4945,"Nealuchi: S-set up? Set up? Oh, no, no! Well...not exactly. Um...Please don't hurt me!"
4946,"Tibarn: So that's the truth of it, eh? Naesala treated Reyson like a piece of merchandise and sold him. To a human..."
4947,"Nealuchi: No, that's not... The only one who referred to him as merchandise was Duke Tanas. We never--"
4948,Tibarn: It doesn't matter! Claiming ignorance does not grant you innocence. You treated Reyson like a trinket in a public market!
4949,"Nealuchi: Oooh, dear..."
4950,"Tibarn: If Reyson hadn't escaped on his own, perhaps the crow king would have rescued him when things cooled down. Regardless, Reyson trusted in his friend and followed him into the trap... And Naesala spit on that friendship. That, I cannot forgive!"
4951,"Nealuchi: Your assessment of this old bird is correct. I am a worm, nothing more. But please, I beg of you... Temper your outrage. Let it cool."
4952,"Janaff: You're unbelievable. What is it with you crows, anyway? Everything you do is so dirty and deceptive. We will never understand your ways. Do you hear me, greywings?"
4953,"Nealuchi: I hear you well, young hawk. But our nation... Our nation has... It has its own issues."
4954,"Nealuchi: Please, this is not the time to yell at a tired old man. You must hurry to Prince Reyson's side! Once he is safe, you can punish me in any way that you see fit... Tear me limb from limb if you wish...But please! Go to Prince Reyson! I beg of you!"
4955,"Tibarn: This begging is unseemly and unwanted. We would rescue Reyson regardless of this pathetic show of tears. Return to Kilvas and report these events to your accursed king. Tell him that when this is over, King Tibarn of Phoenicis will be paying him a visit."
4956,"Nealuchi: ...Y-yes, Your Highness!"
4957,"Janaff: Sigh... I know he deserves it, but I still feel bad for badgering the old coot."
4958,"Ulki: Your Majesty, what will we do now?"
4959,"Tibarn: Ulki, use your ears to pick out the sound of Reyson's wings, then tell me the direction from which it comes."
4960,Ulki: At once!
4961,"Tibarn: Janaff, use your eyes to peer between the trees and find me a road."
4962,Janaff: You got it!
4963,"Tibarn: Human scum...If you think to replay that night from twenty years ago, you'll get no quarter from me."
4964,"Ike: Hm? Is that you, Soren? You're up early."
4965,"Soren: Actually, I'm always awake at this time."
4966,Ike: Really?
4967,Soren: Yes. You're the one who's up earlier than normal.
4968,Ike: I want to finish our mission today. I think my nervous energy woke me up.
4969,"Soren: I understand... The last two days spent searching Serenes Forest for that heronhave been frustrating and fruitless. I'm sure he's in there somewhere, but..."
