,0
2568,"Lethe: Bah! Open your ears! If you wish it, we shall…follow your orders. Hssss! But you must Direct us."
2569,Ike: Really? You’re willing to take orders from me?
2570,"Lethe: This is a beorc fight. If you don’t Direct us, then we have no reason for being here. So spoke our king."
2571,"Ike: But last night, you…"
2572,Lethe: THAT…That was an…emergency.
2573,Mordecai: We thought you were in danger.
2574,Ike: You thought correctly. We were in danger. I thank you. We were greatly aided by your arrival.
2575,Mordecai: You are welcome.
2576,Lethe: Hmm.
2577,"Mordecai: Very well. Let us fight together. If you choose not to Direct us, we shall do as we please. Do you find this acceptable?"
2578,"Ike: Of course. Well then, good fortune to us all."
2579,Marcia: Let’s see now…Where are they? Aha! I’ve found them!
2580,Nedata: Yar har ho!
2581,Pirate: Yo ho har!
2582,Nedata: Scallywags of the sea are we!
2583,"Pirate: We fight like beasts, an’ men do flee!"
2584,Nedata: We earn our gold with axes bold…Yar! Ye scurvy bilge rat! Why aren’t ya singin’?
2585,"Pirate: Har! Over there, Nedata! Fix yer eyes on that. Do ye sees what I sees?"
2586,"Nedata: Oh ho ho! What’s this, then? Humans battling humans here in Gallia? What in the briny beard of Shanty Pete is going on?"
2587,Pirate: Oy! Do ya think they may be the king’s curs out to capture us and claim the bounty?
2588,Nedata: Gahar har har!
2589,Pirate: Shall we unfurl the mainsail and steer for calmer waters?
2590,"Nedata: Bite yer tongue, ye kelp-brained idjit! We’re pirates! We don’t turn tail from government scum! I’m goin’ ashore! Watch me, and you’ll see a true sea-dog in action."
2591,"Pirate: Yar, well said! You’ve set me blood aboil! I’m with ye all the way, matey!"
2592,Nedata: Aarrr! Let’s see what we can see then!
2593,"Pirate: Yar! Me axe is sharp, and me spirit is bold!"
2594,Nedata: Yar har ho!
2595,Pirate: Yo ho har!
2596,Marcia: Ike!
2597,Ike: You! You’re that…
2598,"Marcia: That’s right. It’s me! Marcia! As promised, I’m here to pay my debt…I’m going to join your group!"
2599,Ike: Join us? But I thought you were one of the holy pegasus knights of Begnion…
2600,Marcia: Pfff! I resigned So what do you say? Are you going to let me in or what? Come on!
2601,"Ike: Are you sure about this? I mean, I’ll be honest with you. We’re a destitute band of mercenaries. Your wages will be a pittance compared to what you’re used to."
2602,"Marcia: So, what? Are you saying no?"
2603,"Ike: No, I’m simply pointing out that you’ll be losing almost all of…"
2604,"Marcia: Pfff! I won’t lose out on anything! Plus, I’ll work twice as hard as anyone else. C’mon, please let me join? PLEEEEASE!"
2605,"Ike: Well, if that’s what you want, I guess we’ll give it a shot. We’re shorthanded though, so you’re going to be busy."
2606,Marcia: Huzzah! That’s great! Just tell me what needs doing!
2607,"Boyd: Rolf, stay by my side."
2608,Rolf: You got it!
2609,Boyd: Hold a minute. That was too easy. What’s going on?
2610,"Rolf: Nothing. But if I’m close to you, I can protect you. So you have no need to worry."
2611,"Boyd: What? Hey, that’s my line!"
2612,Oscar: Rolf!
2613,Rolf: I’m…I’m sorry!
2614,Oscar: Huh Why are you apologizing?
2615,Rolf: What? But…Aren’t you here to yell at me?
2616,Oscar: Why? Did you do something to make me mad?
2617,Rolf: I thought maybe my whole decision to fight and stuff…I made that on my own. I thought that it might upset you.
2618,Oscar: I won’t complain about the commander’s decisions.
2619,"Rolf: So, you’re all right with it?"
2620,"Oscar: I suppose. But I want you to stay close, so I can watch out for you."
2621,Rolf: Got it!
2622,Oscar: Wait! There is one thing. When did you learn to use a bow?
2623,"Rolf: Um, it’s a secret!"
2624,Oscar: That’s no answer. Rolf! Blast! I told you to stay close!
2625,"Oscar: Rolf, do not leave my sight. Do you understand?"
2626,"Rolf: Yes, I understand."
2627,Oscar: I can’t let you die. When Boyd…When we lost Boyd…I don’t…I don’t ever want to feel that kind of pain again.
2628,Rolf: I know.
2629,Woman: Eeeek! Hu-hu-humans! Yaaaaah!
2630,Character that entered the village: Um…
2631,"Woman: Urk! Urk! Ahhh…Oh, come on! You are so rude! If you can’t tell, I’m playing dead. So go away! Huh? Why? Because my mother told me, If you ever meet a beorc, play dead, and it will leave you be. It’s not true, is it? Hsss! I knew it wasn’t true! I knew it! Well then, take this, and get out of here! Quickly! I HATE humans! I don’t want to talk to you! Hsss! SHOO!!"
2632,"Soldier: You’re from Crimea, aren’t you? I’m a warrior of the beast tribe. Lord Ranulf spoke of you.  Doubtless you have noticed that Fort Tatana has been taken by Daein forces. Watch your step around that bunch. There’s a dangerous mage with them. We of the beast tribe find magic, and especially fire magic, particularly threatening. I am waiting for friends and cannot take leave of this house, but…I would give you this. If you use it, your magical resistance will increase. It will help you fight that mage. Take care."
2633,Nedata: Scallywags of the sea are we! We earn our gold with axes bold!
2634,Nedata: Ya ha ho!
2635,Ike: Huh?
2636,Nedata: Yo ha ha.
2637,Ike: What a ragged bunch.
2638,Nedata: Scallywags of the sea are we. We'll not lose to the likes of thee!
2639,Nedata: Ya har! Beasties! No need to panic! Try to hit them while they’re in human form!
2640,Lethe: Thieving worms! Prepare to die!
2641,Nedata: Ya har! Beasties! No need to panic! Try to hit them while they’re in human form!
2642,Mordecai: Beorc fools. I will punish you.
2643,Nedata: Scallywags of the sea…are we…An end like this is quite…worthy!
2644,Kotaff: Death to the rogues who defy Daein! Defend our brethren! Erase their shame!
2645,"Kotaff: Bah! So the sub-humans have come crawling out of their dens, eh?"
2646,Lethe: Beorc maggot! Those who call us by that hateful name shall earn a swift and merciless death!
2647,"Kotaff: At last we meet, sub-human! I will exterminate you with my own two hands! My HUMAN hands!"
2648,Mordecai: Sub... Sub-human? Grrraaaaaa!
2649,"Kotaff: So you are the new commander... Tell me, boy, what cowardly tactics did you employ to fell our brothers? You must have deceived them. There's no way rabble like you could defeat Daein troops in a fair fight."
2650,"Ike: From the very beginning, every last one of you has underestimated us. Will you never learn? Your refusal to recognize our strength will forever keep victory at arm's length."
2651,"Kotaff: Silence! Silence, you idiot child!"
2652,Ike: You're right. No more talk.
2653,Kotaff: Arrgh…urr…urg…In the name…of the empire…Cleanse…my shame…
2654,"Ike: We defeated their commander, but we still don’t know what they were after."
2655,Titania: It seems unlikely that they were merely pursuing Princess Elincia. I wonder if Daein is planning to invade Gallia. Perhaps Crimea was only a stone on which to whet their blades.
2656,"Soren: No matter the motive, the fact remains that Daein crossed the border. Under such circumstances, hostilities between Daein and Gallia could break out at any time."
2657,"Ike: So, it’s war…Again."
2658,"Titania: If war erupts between the beorc and laguz, it’s only a matter of time before other nations become involved. Could Daein truly mean to set the land aflame in a blaze of war? If that happens, many of our citizens will be sacrificed on the altar of their ambition."
2659,"Soren: We, too, need to choose which way to move, whose side to take…"
2660,Titania: Whose side? We shall never support Daein! Unthinkable!
2661,"Soren: Captain Titania, we are human. Would you truly have us side with sub–with laguz against other humans? THAT is unthinkable."
2662,Ike: Beorc and laguz…
2663,Lethe: Are you going to sit here and argue about a war that hasn’t started? You beorc are all so timid! It’s pathetic.
2664,Mordecai: Lethe! You must not say such things.
2665,Ike: Mordecai? Lethe? What do you think? Will it come to war?
2666,"Lethe: Our claws are sharp. If Daein invades Gallia, we are ready for battle. If our king wills it, war will come."
2667,Mordecai: I like it not…War brings pain. Sorrow.
2668,Ike: This is troubling…
2669,Lethe: Enough. We have lost much time. Let us make for the palace. We must reach tonight’s camp before the sun sets.
2670,Ike: Is the palace still far?
2671,"Lethe: On your skinny beorc legs, it is very far. But we will do as we can."
2672,Elincia: My lord Ike! Everyone!
2673,Ike: Princess Elincia.
2674,Elincia: I heard about…Commander Greil. I…I don’t know what to say.
2675,Ike: Don’t worry. We’re all right. We’re getting by…somehow.
2676,"Elincia: …Oh, Ike…"
2677,Cat Laguz: The king has arrived.
2678,Ike: Um… Hey there.
2679,"Caineghis: Thank you for coming to Gallia Palace. I am Caineghis, ruler of the kingdom of Gallia."
2680,"Ike: These are the Greil Mercenaries. I am Ike, their commander."
2681,"Caineghis: You have been raised well, young pup. I didn’t recognize you."
2682,Ike: What?
2683,"Titania: When last you were here, you were still a small child."
2684,"Caineghis: Is that you, Titania? It’s good to see you."
2685,"Titania: The pleasure is all mine, Your Majesty."
2686,Ike: The two of you are friends? How…How does the king know me?
2687,"Caineghis: Mm. I have something I must tell you about your father, Greil…"
2688,"Caineghis: Lethe. Mordecai. Leave us now. Prepare rooms, so our guests may have a place to rest and heal their wounds."
2689,"Lethe: At once, my lord!"
2690,Elincia: Would it be best if I were to leave as well?
2691,"Caineghis: No, Princess. I would have you stay. And this one also will stay."
2692,Giffca: …
2693,"Caineghis: This is Giffca, my shadow. Pay him no more heed than you would the air."
2694,"Ike: Understood. I would have Titania and Soren stay with me, as well."
2695,Soren: Me?
2696,"Caineghis: So be it. Now then, where to begin?"
2697,Caineghis: Titania? How much did Greil tell his son?
2698,"Titania: Ike was raised with no knowledge of Gallia whatsoever, nor does he recall ever having been here."
2699,Caineghis: Is that so? Then it is best for me to tell him all that I know. …Although that is not much.
2700,Ike: That’s all right. Whatever you can tell me would be much appreciated. I want to know more of my father.
2701,"Caineghis: Hmm…You have good eyes. Honest and brave.I see your father in them. Long ago, Greil…your father…worked as a mercenary for Gallia. We forged a strong bond, he and I. To speak truly, I still do not trust the beorc. But your father was different."
2702,"Caineghis: Princess Elincia’s father, King Ramon, and his brother, Lord Renning, are also of a different kind. All are…or were…exceptional men. Men in whom one could put his trust."
2703,"Caineghis: Oh ho! Titania! You are an exception as well! Among beorc females, you are unique."
2704,"Titania: You are most gracious, Your Majesty."
2705,Ike: My father was a mercenary for Gallia…?
2706,"Caineghis: Correct. And you and your sister? You were both born here in Gallia. You stayed only for a short time, but part of your childhood was spent within these borders."
2707,Ike: Mist and I were born here? Is that so? I don’t remember any of this at all.
2708,"Caineghis: I feel your parents were carrying a dark secret. Someone was hunting them, I’m sure of it. Once, over ten years ago…and after your mother had been slain…Your father chose to leave Gallia. Before he left, I went to him and asked him to share his tale. I asked him, Why are you being chased? Is there anything I can do to help? But I was unable to loosen his tongue. And then I heard he had returned to Gallia, and I thought I had another chance to hear his tale. His fate was black indeed. If I had been faster, if I had hastened my steps, perhaps things would be different."
2709,"Ike: Wait! Now I understand. The voice I heard…That was you, wasn’t it?"
2710,"Caineghis: His wound was fatal. I could do nothing. I thought it best not to interfere in his final moments, so I remained hidden. Tell me, Ike… At his last, did he confess anything to you? The identity of the Black Knight…Did he reveal it?"
2711,"Ike: The Black Knight? No. I don’t know who he was. My father entrusted me with his command, told me to trust King Caineghis and to live peacefully in Gallia. He said to forget everything else."
2712,"Caineghis: Is that so? Well then, let me do as I can. If any of your mercenaries desire to live here, I will so arrange it. I will vouchsafe them homes and land."
2713,"Ike: Your kindness is truly appreciated. But, speaking for myself, I couldn’t live here in peace. Not now. I will avenge my father. I cannot so quickly forget the past…Or the Black Knight."
2714,"Titania: But, Ike! That’s not…"
2715,Ike: I know. I’m not…I’m not strong enough. An opponent who could defeat my father is well beyond my reach…But that’s why I’ve devoted myself to growing stronger. I will lead my father’s mercenaries and prepare for the day when my chance for revenge arrives.
2716,"Caineghis: A prudent course of action. You look as one who would be more impulsive, but you are Greil’s son after all."
2717,"Titania: Ha! You’ve matured, Ike. It seems like yesterday that you were merely a child."
2718,Ike: Titania…
2719,"Caineghis: And now, I would ask a boon of you."
2720,"Caineghis: The strength of your mecenary band, Ike, would you lend it to Princess Elincia?"
2721,Ike: Are you serious?
2722,Elincia: King Caineghis!
2723,"Caineghis: Gallia and Crimea are allied nations, that cannot be denied. However, this alliance in reality binds only the royal families. It is not respected by our citizenry."
2724,"Titania: The people of Gallia are seldom seen in Crimea, are they? Even though our nations are friends, the people of Crimea have little real understanding of the laguz. Many of our people still use that undignified name, sub-human, when they speak of the laguz…"
2725,"Elincia: …My father’s heart was filled with shame and sorrow over what you describe. More than any king in our history, he wanted to deepen relations between our people, and then…"
2726,Caineghis: Perhaps that is why Daein targeted him. Their hatred of the laguz is well known.
2727,Ike: Could it be…?
2728,"Caineghis: In my heart of hearts, I would like to take guardianship of Princess Elincia and assist in the rebuilding of Crimea. However, anti-beorc sentiment is running high here in Gallia. If we were to offer safe harbor to Elincia, I feel many of our elder statesmen would protest. They would say that we are giving Daein an ideal excuse to attack."
2729,Ike: Which means Gallia can’t offer Princess Elincia any relief at all…Is that it?
2730,"Caineghis: Unfortunately, it is true."
2731,"Elincia: My lord Ike, King Caineghis has advised me to turn to the Begnion Theocracy for aid in Crimea’s restoration. He says we should make of Begnion a formal request and gain the support of their shields."
2732,Titania: Passage to Begnion will require several months at sea. An escort will be necessary…
2733,"Ike: As you know, we lack the numbers to serve as a complete mercenary army. So, if the princess were willing to hire us as an escort, it would be an offer beyond our expectations."
2734,Ike: Titania! Soren! I think perhaps we should accept the king’s offer. What do you say?
2735,"Titania: It’s what you want, right, Commander? Well then, it’s our job to follow you."
2736,Soren: However you wish to proceed is fine. I will do all in my power to ensure that our road leads to success.
2737,"Ike: Understood. As of now, the Greil Mercenaries shall assume the honor of serving as escort to the princess of Crimea."
2738,"Ike: Princess Elincia, our journey together will undoubtedly be a long one. May we serve you well."
2739,"Elincia: Oh, thank you very much! I only pray that I, in turn, may be worthy of your service!"
2740,Soren: Hmm.
2741,"Ike: What's wrong, Soren? Are preparations complete?"
2742,"Soren: Yes, everything's ready."
2743,"Ike: You have only a few robes and musty books. I'm taking a bit less, but it looks as though you travel light as well."
2744,Soren: The burden of unnecessary items is something I detest.
2745,"Ike: Me too. We're alike in that, aren't we?"
2746,Soren: Hmm.
2747,Ike: What is it? You've got that worried look again.
2748,"Soren: Well, um... It's nothing. Never mind."
2749,"Soren: ...Everyone's really slow, aren't they? Shall I go and see what's taking them?"
2750,Ike: Soren... Don't worry about it.
2751,Soren: Hm?
2752,"Ike: Sitting here in the morning, in the sunlight... It helps me to understand. I'm alive. I have trustworthy friends. That's how I know I can go on. I just hope I'm not... fooling myself."
2753,"Soren: No, you're not! You're not."
2754,"Ike: Well then, it's business as usual. I know we'll have troubles, but let us set our shoulders straight and get on with it."
2755,Soren: Understood.
2756,"Mist: Ah, Ike... Good morning."
2757,Ike: Mm. Morning. ...Are you alright?
2758,"Mist: If I said I were, I'd be lying. But I'm doing my best. Yesterday, I was so confused. Then, I awoke this morning and saw the blue sky, felt the sun on my face... And I thought, I'm alive. The sunlight was so warm. I mean, it's always warm, but... for some reason, it made me want to cry."
2759,"Ike: Oh, Mist..."
2760,"Mist: It's up to us. We must live the fullest lives we can. We have to live for Mother and for Father. We mustn't dishonor their memory. So... um... I may think about them, and I may cry every now and then, but I'll carry on!"
2761,Ike: You're right... Everything you said is right. We will carry on together.
2762,Mist: Right!
2763,"Mist: Oh! Sorry, but I have to hurry and get ready! I'll see you later, Brother!"
2764,"Ike: Yes, look at the time! Get a move on, will you?"
2765,"Oscar: Hey, good morning, Ike. How're you feeling today? Yesterday's battle was a rough one, wasn't it?"
2766,"Ike: Hi, Oscar. Yeah, I'm sore all over. Every muscle in my body hurts. Hopefully, I'll feel better after I move around for a while."
2767,"Oscar: I hope for the same. When I woke up, it was all I could do to get out of bed. We're truly lucky to be alive. If those two beast fighters hadn't arrived when they did, we might have all been wiped out."
2768,Ike: ...Yeah...
2769,"Oscar: Ike, I can't say I know what you're going through or how you feel. But you should try and remember all that happened last night. The men we fought were professionals. Well trained and under the command of a cunning tactician... but not invincible."
2770,"Ike: ...You're saying they follow certain rules? Specific patterns? Yes, I see. If I can learn what they are, they become vulnerable. The next time we meet, we won't lose."
2771,Oscar: Har!
2772,Ike: What?
2773,"Oscar: For an instant there, looking at you was like looking at Commander Greil."
2774,"Ike: I'm his son. I'm supposed to look like him, aren't I?"
2775,Oscar: It wasn't that. And it wasn't an aura or a hunch or anything like that. I don't know what to call it. It was more like the core of your character... It felt the same as his.
2776,Ike: Huh...
2777,Oscar: Ha ha. Sorry. That must've sounded pretty stupid.
2778,Ike: Oscar?
2779,Oscar: Commander?
2780,"Ike: From now on, when I practice, would you join me? I would be more familiar with the fighting style of knights."
2781,"Oscar: Of course! If there's anything I can do to help, you need only to ask."
2782,"Mia: Oh, Boss! Morning!"
2783,Ike: Good morning. Are you ready to go?
2784,"Mia: All set! It doesn't matter how late I go to sleep, I'm always awake before the sun rises! I can leave whenever!"
2785,"Ike: ...Um, I'm sorry. You know, for everything that's happened. It's all so sudden."
2786,"Mia: Oh, it's nothing. But it's been rough on you, hasn't it?"
2787,Ike: I could say the same to you. It can't have been easy joining a band of wanted mercenaries and fighting every day.
2788,"Mia: Oh, it's not so bad..."
2789,"Ike: You were forced to join us by the whims of fate, not by choice. I know my father said you had a debt to repay, but he's not here anymore. If you want to leave, I won't stop you."
2790,Mia: Um... Er... Aaaaah!
2791,Ike: Aaah! What!?
2792,Mia: Oooh! Times... Times like this... I never have any idea of what I'm supposed to say. None!
2793,"Mia: Uh, darn! Hold on. Yesterday... in the middle of that giant mess, you didn't give up, Boss. And I knew. That is how a true man lives! So now I have to follow you. You see?"
2794,Ike: I... think so.
2795,"Mia: That's my story, Boss. So do me a favor and don't tell me to get lost. I'm good to have around. You'll see!"
2796,"Ike: If that's how you feel, I guess I understand. I'm counting on you. Don't let me down."
2797,Mia: Never! I wouldn't know how!
2798,Mordecai: Ike. Are you prepared? Can we depart soon?
2799,Ike: It's taking more time than I thought. I'm sorry for making you wait.
2800,Mordecai: I see. Then I will talk with you as we wait.
2801,"Mordecai: Grr... My words, are they well? Can you understand them?"
2802,"Ike: Sure, no problem. I understand you."
2803,Mordecai: That is good. Mordecai is not so good with this language.
2804,Ike: What language do you normally use?
2805,"Mordecai: With others of my tribe, I need no words. I say all that I must with gestures and with... how do you say... growls?"
2806,Ike: That sounds convenient.
2807,Mordecai: Yes. But our tongue does not let us talk to other tribes. That is not good. That is why we learn these modern words.
2808,"Ike: I would think that would be enough, being able to speak with only your friends, wouldn't it?"
2809,Mordecai: It is not. If there is danger or conflict... We can use words to avoid a fighting that need not be. So using words that many can hear is good.
2810,Ike: Hmm... Using words to avoid unnecessary fighting... That's one way to think about it.
2811,"After his father's death places the mantle of leadership on his young shoulders, Ike agrees to continue as Elincia's escort. The company heads to the Bengion Empire, the oldest and largest nation on the continent of Tellius. As Crimea is a former fiefdom of Begnion, the princess turns to them for succor, much as a scared child returns to a parent. Many in Tellius believe
that without Begnion's might and influence, Crimea's reconstruction will be nigh impossible. However, Begnion and Gallia have no diplomatic ties and are further separated by an impassable mountain range. So the company is forced to return to Crimea, where they hope to locate a ship to carry them to Begnion. Accompanied by Ranulf the warrior who has volunteered to guide them,
the company leaves Castle Gallia behind. With heavy hearts and wounded spirits, they begin the long march back to Crimea.
"
2812,"Before base preparation screen
"
2813,"Exit base
"
2814,"Ranulf: Hey, Ike! I heard you're leaving. Going to Begnion, eh?"
2815,"Ike: Hello, Ranulf. I was hoping I'd see you. I'd wanted to thank you for everything you've done. I'm glad to have the chance before I leave."
2816,"Ranulf: Well, aren't you the dutiful one! Hey, that reminds me...you were born here in Gallia, right? I knew there was something odd about you. You're awfully friendly for a beorc, you know! Oh, you might not know, but a beorc is what--"
2817,"Ike: I know what it means. It's what you call us humans, right?"
2818,"Ranulf: Oh, knew that, did you? Well then, let me tell you something else. When we use the word ""human,"" we mean it much the way you beorc do when you call us ""sub-human."""
2819,Ike: Really? It's an insult to be called human? I'm glad you told me. I would never have guessed.
2820,"Ranulf: I should warn you, if you run across any laguz who call you that, be careful. They are no friend of yours."
2821,Ike: Got it. Thanks. I won't forget.
2822,Ranulf: But I've digressed long enough. Let me explain why I'm here.
2823,Ike: Huh?
2824,"Ranulf: Princess Elincia, may I have a moment of your time?"
2825,Elincia: Y-yes. Of course.
2826,"Ranulf: The king asked that I give you this. Please, accept it as a gift."
2827,Elincia: What? May I ask--
2828,"Ranulf: Within that leather pouch is twenty thousand gold pieces. Beorc currency, of course."
2829,"Elincia: Oh...I truly appreciate this generous offer, but a gift of this magnitude is not something I can accept. King Caineghis has done so much more than necessary already..."
2830,"Ranulf: The king is ashamed that he cannot, at this time, provide any personal support. Please. Will you accept his apology and acknowledge his desire to aid you?"
2831,Elincia: But...
2832,"Ranulf: No? Well then, let's try this..."
2833,Elincia: Yes?
2834,"Ranulf: You accept the king's gift. Then, as payment for conducting you safely to Gallia, you hand it over to Ike..."
2835,Elincia: Um...
2836,"Ike: Come on, Ranulf. You can't expect her to accept this. And it's an outrageous fee, no matter how you look at it."
2837,"Ranulf: Twenty thousand gold for the life of a princess? Perfectly reasonable. In fact, it almost borders on insulting! Consider how you have suffered, the lives you have lost...Ten, no, a hundred times this amount would not be unreasonable."
2838,Ike: ...
2839,"Elincia: I... I have reconsidered. I will accept the king's kindness. In turn, I will present it to my lord Ike...You will accept it, will you not?"
2840,Ike: I...I will. Thank you.
2841,"Elincia: No, my lord Ike. It is I who must thank you."
2842,"Ranulf: Well, now that that's settled, let's move on. Unfortunately, we do not have any ships here in Gallia. If you are to find a ship that will take you to Begnion, you must return to occupied Crimea."
2843,"Ike: If there's no other way, then we'll just have to risk it."
