,0
6926,Ike: This cowardice will not stand! These priests are being made to fight against their will. We've got to try and save as many of them as possible! Let's go!
6927,"Schaeferr: Hey, robes! If I get so much as scratched, you better get to healing!"
6928,"Schaeferr: Bah! So you've made it this far, have you? Tell me, how many pathetic priests did you have to kill to get here? Come on, five? More? They're pretty scrawny... You could probably take ten or so without breakin' a sweat."
6929,Ike: Cowardly cur! Time to stop hiding and fight like a man.
6930,Schaeffer: Yeowch! Look at that ugly thing! It’s a…sub-human!
6931,Schaeffer: Fly-flying freak! Bows! Get your bows! Bring ’em down!
6932,"Schaeffer: Heh heh heh. Now here’s a familiar face! It’s one of Daein’s old generals! Look, I’m a coward, and you’re a traitor! Let’s be friends! Whattya say?"
6933,"Schaeffer: I’m pretty sure you herons don’t know how to fight. Lucky me! I’m gonna kill ya, stuff ya, and mount ya in my den!"
6934,Schaeferr: ...Gwaar... Haaaarr... Haaaaaa...Shoulda brought...more priests...Or some...babies... Dang...
6935,Tomenami: If this is punishment for betraying the gods... Let us accept it.
6936,Daein Bishop: Thank you very much. I never imagined that we would be rescued by soldiers of an enemy nation.
6937,"Ike: There was no way we'd cut down innocent priests being forced to fight against their wills. And yet, we were not able to save everyone..."
6938,"Daein Bishop: Peace, my lord. We were expecting to be killed at once. Yet somehow you rescued so many of us...I'm sure that even our departed Bishop Tomenami is grateful for your aid."
6939,"Elincia: Father, we bear no ill will toward the kingdom of Daein itself. We wish only to reclaim the homeland which was unjustly taken from us. That is the reason we fight. We had no desire to invade this land. If nothing else, please believe that."
6940,Daein Bishop: I beg your pardon. May I have the favor of your name?
6941,Elincia: Elincia Ridell Crimea. I'm the sole survivor of the Crimean royal family.
6942,"Daein Bishop: Oh! You... Let us give thanks that you are alive and well! And please, I beg your understanding as well. There are many Daeins who do not support the king's actions."
6943,Elincia: I understand.
6944,Ike: ...
6945,Tomenami: Thank you very much. I never imagined that we would be rescued by soldiers of an enemy nation.
6946,"Ike: There was no way we'd cut down innocent priests being forced to fight against their wills. And yet, we were not able to save everyone..."
6947,"Tomenami: Peace, my lord. We were expecting to be killed at once. And yet you rescued so many of us..."
6948,"Elincia: Father, we bear no ill will toward the kingdom of Daein itself. We wish only to reclaim the homeland which was unjustly taken from us. That is the reason we fight. We had no desire to invade this land. If nothing else, please believe that."
6949,Tomenami: I beg your pardon. May I have the favor of your name?
6950,Elincia: Elincia Ridell Crimea. I'm the sole survivor of the Crimean royal family.
6951,"Tomenami: Oh! You... Let us give thanks that you are alive and well! And please, I beg your understanding as well. There are many Daeins who do not support the king's actions."
6952,Elincia: I understand.
6953,Ike: ...
6954,Tomenami: Thank you very much. I never imagined that we would be rescued by soldiers of an enemy nation.
6955,Ike: There was no way we'd cut down innocent priests being forced to fight against their wills.
6956,"Elincia: Father, we bear no ill will toward the kingdom of Daein itself. We wish only to reclaim the homeland which was unjustly taken from us. That is the reason we fight. We had no desire to invade this land. If nothing else, please believe that."
6957,Tomenami: I beg your pardon. May I have the favor of your name?
6958,Elincia: Elincia Ridell Crimea. I'm the sole survivor of the Crimean royal family.
6959,"Tomenami: Oh! You... Let us give thanks that you are alive and well! And please, I beg your understanding as well. There are many Daeins who do not support the king's actions."
6960,Elincia: I understand.
6961,Ike: ...
6962,"Tomenami: My young general, this is for you."
6963,Ike: Huh?
6964,Tomenami: As thanks for saving our lives.
6965,"Ike: In the end, we were unable to save even one of them..."
6966,Elincia: My lord Ike... I know that we bear no ill will toward the kingdom of Daein itself. We wish only to reclaim the homeland which was unjustly taken from us. That is the reason we fight. Yet...to this end... The sacrifices we have witnessed...
6967,"Ike: This is a battle of life and death. If we are attacked, we must act in kind or be killed--no matter the circumstances. That is the essence of war."
6968,Elincia: I will harden my heart and grow stronger. I am the defender of the realm. I am the daughter of House Crimea!
6969,"Ike: Yes. To gain something desired, there is always a price to be paid."
6970,Ike: Now it's time to search this place.
6971,Elincia: My lord Ike. May I join you?
6972,"Ike: Sure, why not? Everyone's lending a--"
6973,Mist: Ike! Ike! Where are you?
6974,Ike: Mist? I'm over here.
6975,Mist: Ike! This way! Quickly! Reyson's in trouble!
6976,Ike: What?
6977,"Ike: Now to search each room, one by one."
6978,Elincia: My lord Ike. May I join you?
6979,"Ike: Sure, why not. Everyone's lending a--"
6980,"Ike: Reyson? Your wound looks pretty bad. If you keep moving around, it's just going to get worse."
6981,Reyson: Something...is calling me. Is it that way?
6982,Ike: Mist! I'm over here.
6983,Mist: Ike! Quickly! This way! Reyson's in trouble!!
6984,Ike: What?
6985,Ike: Reyson? What is it?
6986,Reyson: ...
6987,Mist: He's been like this from the moment he set foot in this room. He's just staring at the walls.
6988,Ike: Reyson! You've taken a terrible wound...What do you think you're doing?
6989,Reyson: ...
6990,Ike: Reyson?
6991,Mist: He's been like this from the moment he set foot in this room. He's just staring at the walls.
6992,Ike: What is all this?
6993,Elincia: Every wall has the same pattern on it.
6994,Soren: It's not a pattern. It's an ancient language. All chants and spells in magic scrolls are written thusly.
6995,"Ike: Can you read it, Soren?"
6996,"Soren: Some, but not all. Spells are simple, whereas this is a complex narrative. I think Prince Reyson could read it."
6997,Ike: I bet this is the same language that Leanne was speaking.
6998,"Soren: It is. It's the Serenes' language...Their chants are all in this language, too."
6999,Mist: So Reyson is reading what's written on the walls?
7000,Titania: It appears that way...
7001,Ike: Shall we leave him be? There's a lot of writing here. This could take hours.
7002,Elincia: I think that's a good idea.
7003,Soren: Ike!
7004,Ike: What is it?
7005,"Soren: From what I could gather, I think a person was locked in this room sometime in the past."
7006,"Ike: ...You don't know who it was, do you?"
7007,"Soren: I wasn't able to read enough of the writing, but... I found this under the bed."
7008,Ike: Is this...?
7009,Soren: I think it may have belonged to whoever was imprisoned in this room.
7010,Ike: ...
7011,Reyson: I apologize. I took up much of your time.
7012,"Ike: Reyson, you don't look so good. Why don't you rest for a bit?"
7013,"Reyson: No, I'm fine. It's more important that we talk."
7014,Ike: About the owner of this feather?
7015,Reyson: ...Was it in that room?
7016,Ike: Soren found it. Whose was it?
7017,Reyson: Lillia... My older sister. The writing on the walls is hers.
7018,"Elincia: ...You have an older sister, too?"
7019,Ike: Will you tell us about it?
7020,"Reyson: She was kidnapped twenty years ago, on the night of the Serenes Massacre. I...I thought that Lillia had been murdered along with my other brothers and sisters. I believed that until today..."
7021,Ike: Who took her?
7022,"Reyson: The walls say only that he was a large human. She probably never knew who it was. He thrust a clan treasure at her and demanded that she use her magic to revive the thing sealed inside it. He exhorted her again and again, but to no avail. Lillia refused his request every time...because she did not possess that power."
7023,Elincia: Someone wanted to revive the dark god...
7024,"Reyson: Shortly after she was brought here, Lillia fell ill and collapsed. I'm not surprised...it was a terrible time... She was imprisoned in that tiny room with no view of earth or sky..."
7025,"Mist: Oh, that's awf...sniff.........sniff..."
7026,Titania: Mist...
7027,"Mist: I'm sorry...I just feel...so sad for Lillia...and for...for Reyson, too..."
7028,"Reyson: I beg your pardon. Let me continue. A young beorc began coming to the room to care for Lillia. She had bluish hair and blue eyes...And her heart was unusually pure for a beorc. In time, Lillia and she came to be friends, and shared a mutual trust."
7029,Mist: Ah!
7030,Ike: ...
7031,"Reyson: Lillia decided to entrust her hopes to the woman. They shared no common language, so it took some time. But eventually, the beorc woman understood what it was Lillia wanted... Which was to take the treasure and the song...and flee this temple."
7032,Mist: B-Brother!
7033,"Ike: Was there anything else written about this beorc woman? A name, perhaps..."
7034,"Reyson: (Elena....) Translated into our language, it was probably Elena."
7035,Mist: I knew it! Mother! It was our mother!
7036,Reyson: What?
7037,"Elincia: Are, are you sure?"
7038,"Ike: Our mother's name was Elena. Like me, her hair was blue...as were her eyes. Reyson, the object you refer to as your clan treasure was an aged, bronze medallion, wasn't it?"
7039,Reyson: How... How did you know that?
7040,"Ike: The medallion became my mother's keepsake. The song, too... My parents both gave their lives to protect it."
7041,Reyson: Ike! You and Mist are Elena's children? Then Lehran's Medallion is here?
7042,Mist: Um...
7043,Ike: The medallion was stolen. Probably by Daein.
7044,Reyson: It can't... This is...unbelievable. Can a thing like this be chance?
7045,"Ike: To be honest, I don't fully understand all that's happened. But...it all makes sense. It all comes together..."
7046,Reyson: Ah!
7047,"Elincia: Mist...That's the song that... But...the melody's a little different, isn't it?"
7048,Ike: It's similar to the song Reyson and Leanne sang in the forest. My mother used to sing it as a lullaby.
7049,Reyson: It is the song of release. The one Lillia entrusted to Elena.
7050,Mist: B-but...I wore the medallion and sang that song almost every single night! And nothing ever happened.
7051,Reyson: The magical effect of the song is awakened by the power of the singer. ...It can't be unleashed by just anyone. The true song of release can only be sung by a girl named Altina...Lillia wanted your mother to take the melody to Altina and return the medallion to its rightful place in Serenes Forest.
7052,"Ike: The story's becoming clearer and clearer. My father fled Daein to protect my mother, who was carrying the amulet."
7053,Titania: Ike? How did you know--
7054,"Ike: Volke told me. He told me about my father's past, and the amulet, and the dark god, too."
7055,Titania: So you know everything...
7056,"Reyson: King Ashnard took Lillia, didn't he?"
7057,"Ike: That would be the final piece of the puzzle. After all, the man who found my father was the king's henchman."
7058,Titania: Ike! Are you saying you know who killed Commander Greil? You never said anything about that! We all thought his murderer was unknown... Why didn't you say anything?
7059,Ike: ...I don't know. I never felt like talking about it.
7060,"Titania: He was a Daein soldier, wasn't he? Who was it? Who was the man who killed Commander Greil?"
7061,Ike: ...
7062,Titania: IKE!! TELL ME!!
7063,Soren: Can we discuss this later?
7064,Ike: ...
7065,Titania: ...Oh... Yes... Yes. Of course.
7066,"Soren: Up to this point, we've all been fighting for the liberation of Crimea. Even if we now add to that stopping the dark god from being released and punishing Commander Greil's killer... Our enemy remains unchanged. King Daein and his henchman are the ones we must defeat."
7067,"Elincia: It's mysterious, isn't it? I mean, Reyson said the same thing earlier, but... Could all of this really be mere coincidence? The fall of Crimea... Ike's parents... The death of Reyson's sister... The fact that everything leads back to Daein..."
7068,"Reyson: If true, it changes the meaning behind this war... The treatment of Lillia is one thing but...The assassination of the former apostle? The framing and destruction of my nation? If it was all part of Daein's plan to steal the medallion and the song, then I...I... The reason I fight..."
7069,Ike: ...
7070,"Ike: The story's becoming clearer and clearer. My father fled Daein to protect my mother, who was carrying the amulet."
7071,Titania: Ike? How did you know--
7072,"Ike: Volke told me. He told me about my father's past, and the amulet, and the dark god, too."
7073,Titania: So you know everything...
7074,"Reyson: King Ashnard took Lillia, didn't he?"
7075,"Ike: That would be the final piece of the puzzle. After all, the man who found my father was the king's henchman."
7076,Titania: Ike! Are you saying you know who killed Commander Greil? You never said anything about that! We all thought his murderer was unknown... Why didn't you say anything?
7077,Ike: ...I don't know. I never felt like talking about it.
7078,"Titania: He was a Daein soldier, wasn't he? Who was it? Who was the man who killed Commander Greil?"
7079,Ike: ...
7080,Titania: IKE!! TELL ME!!
7081,Soren: Can we discuss this later?
7082,Ike: ...
7083,Titania: ...Oh... Yes... Yes. Of course.
7084,"Soren: Up to this point, we've all been fighting for the liberation of Crimea. Even if we now add to that stopping the dark god from being released and punishing Commander Greil's killer... Our enemy remains unchanged. King Daein and his henchman are the ones we must defeat."
7085,"Elincia: It's mysterious, isn't it? I mean, Reyson said the same thing earlier, but... Could all of this really be mere coincidence? The fall of Crimea... Ike's parents... The death of Reyson's sister... The fact that everything leads back to Daein..."
7086,"Reyson: If true, it changes the meaning behind this war...The treatment of Lillia is one thing but...The assassination of the former apostle? The framing and destruction of my nation? If it was all part of Daein's plan to steal the medallion and the song, then I...I..."
7087,Ike: Reyson.
7088,"Reyson: Please, Ike. Allow me to go with you. I... I must confirm the truth of this!"
7089,"Ike: No matter what happens, you must promise to stay off the battlefield. If you do that, then I say yes."
7090,Reyson: Understood. I will stand by my word.
7091,Ike: ...
7092,"Jorge: Hey, Ike! Er... General Ike! Wait up! Say, if there's an enemy in my way, but I don't want to kill him, what do you think I should do?"
7093,Ike: ...Is this about that stupid game again?
7094,"Jorge: Well, it's all your fault! You had to go and tutor Daniel, and now I've been on this losing streak!"
7095,Ike: Tutor? You mean back when we were onboard the ship? It was just one hint!
7096,"Jorge: Daniel isn't like me! He's smart. I'm the one who thought up this game, but he's the one who's getting better and better. I hardly ever win anymore!"
7097,"Ike: Instead of playing that game, why don't you try some real combat?"
7098,Jorge: Stop joking around. We're happy-go-lucky traveling merchants. We don't know anything about fighting.
7099,"Ike: Give me a break! It's nice you're having fun and all, but please... Can you save your stupid game for someone who's not fighting for their life day in and day out?"
7100,"Jorge: Well, what do you expect? Everything's war, war, war, and there's no place for us. All we can do is play this game. Sorry... I'll just go lose again..."
7101,"Ike: Oh, for heaven's sake...Look, if there's an opponent you don't want to kill, just shove him out of the way. Then you don't have to fight him."
7102,"Jorge: Huh? Oh, t-thanks. ...Um...You know, we are what we are, but we'll be with you till the end. I hope we can continue to be of service. All right?"
7103,"Ike: Yeah, thanks. Sorry for being so irritable."
7104,Jorge: That's all right. I know how much stress you've been under.
7105,Ike: ...
7106,Sothe: ...
7107,Ike: Something on your mind?
7108,"Sothe: Oh, Commander Ike! Oops! I guess I'm supposed to call you General now, huh?"
7109,Ike: Commander's fine. So what's going on? Are you thinking about that person you were looking for?
7110,"Sothe: That's...all settled. Actually, no... it's not really settled. It's just...I figured that worrying about it all the time wasn't doing me any good. I turned over every rock in Begnion during my search, but... It's just easier to assume that everything's going well...somewhere..."
7111,"Ike:  Well, as long as you're happy, I won't say a word. So...what were you thinking about then?"
7112,"Sothe: I...I didn't say anything before, but Daein is my homeland."
7113,Ike: Is that so?
7114,"Sothe: Yeah. Until a few years back, I lived in the slums of Nevassa and stole for a living."
7115,Ike: ...
7116,"Sothe: So anyway, I went back to my old stomping grounds and saw some friends. The rest of the city's empty, but they're still here. They've got no other place to go, you know?"
7117,Ike: And what did they have to say?
7118,"Sothe: Every one was mad that Crimea had won. They said if the king had been here, there's no way they would've been defeated. It's so weird. Until now, all they had ever done was complain about this place."
7119,Ike: I see.
7120,"Sothe: You know, Ashnard wasn't such a bad king. At least, as far as we could see. If you were strong enough, you could rise up and become a knight one day. You could escape the filthy slums. He was the only king who ever gave us that chance. That hope."
7121,Ike: ...
7122,"Sothe: Don't get me wrong. I don't mind fighting with all of you. But still, seeing your homeland scarred and trampled like this is tough. I'm sorry. I know Crimea is suffering in the same way, but... I can't change how I feel."
7123,Ike: ...
7124,"Exit base
"
7125,"Zelgius: If that's the decision you've reached, we'll respectfully comply."
7126,"Ike: If we can march quickly and know that someone's protecting our backs, it would be a huge relief."
7127,"Zelgius: As you wish. May the fortunes of war be with the Crimean army. If you have need of soldiers, send word. We'll move out at top speed."
7128,Ike: I'll be counting on it.
7129,"Elincia: My lord Ike, may I have a moment?"
7130,Ike: Of course. What is it?
7131,"Elincia: The soldiers say that tomorrow we'll be able to see the great bridge. Once we cross it, we'll be in Crimea."
7132,Ike: That's what I've been told.
7133,"Elincia: It feels like I've been away for many years. Crimea is the land where I was born and raised. To feel so removed from it... I feel now, at this late juncture, that I know almost nothing of my own country. It is an unreal experience."
7134,"Ike: I know what you mean. I don't have the sense that we're on the brink of being back in Crimea, either. I don't even remember this area at all. Maybe it's because I was born in Gallia and raised in the countryside. But countries are joined together like this all over the continent. I'm really in awe of it all."
7135,Elincia: So am I! For one who knew nothing of life outside the royal villa... Everything...is...So very big.
7136,"Ike: Big? Hmm... Yeah, I guess you're right. When we left Crimea, it was spring... The snows were melting, the days were getting longer, and the weather was mild."
7137,"Elincia: It's been almost a year since we departed. Only a year, but the distance we've traveled to get here has been long and hard...It feels like many years have passed us by. Yet this is the land where I was born and raised... Ah, my dear, sweet Crimea...How is it that you feel so far away?"
7138,"Ike: For me, too, Crimea is my homeland. We're almost there... Let's go home."
7139,"Elincia: It is as you say, my lord Ike....Let's go home."
7140,"Unknown: Oooh, what a romantic setting. Makes it hard to make an appearance! I guess I could just leave you two..."
7141,Ike: Huh? I know that voice...
7142,"Ranulf: Hey there, Ike! Looks like we stayed alive long enough to be reunited! Aren't we the lucky ones?"
7143,Ike: Ranulf!
7144,Elincia: My lord Ranulf! How nice to see you again!
7145,"Ranulf: My princess Elincia! Welcome home! I'd curtsy, but the tail makes it look silly."
7146,Ike: What are you so darned chipper about?
7147,"Ranulf: Once I heard the news that the Crimean army had taken the Daein capital, I ran all this way to greet you."
7148,"Ike: How go things in Gallia? You're not engaged in open hostilities with Daein, are you?"
7149,Ranulf: Not yet.
7150,Ike: What's that supposed to mean?
7151,"Ranulf: In light of your army's success, the elders have finally agreed on something. Gallia will lend its full support to Princess Crimea's efforts to liberate her homeland. It's a done deal!"
7152,Elincia: Really?
7153,"Ike: So, is the Gallian army going to--"
7154,"Ranulf: We're going to establish communications with them and create a united front. That being said, Gallia is here to support you. The Crimean army will always be at the center of the effort. Don't forget that."
7155,Ike: King Gallia is being most gracious. That posture will allow Crimea to lay claim to any victories we achieve.
7156,"Ranulf: Don't say things like that! I'm shocked that you would understand such subtleties. Who are you, and what have you done with Ike?"
7157,"Ike: I don't believe you have the right to speak to me like that. Kidding. Actually, Soren just lectured me on the same situation when we received reinforcements from Begnion."
7158,Ranulf: Of course. You were tutored by your nervous little staff officer. Now I get it... Has he snapped yet? He seems high-strung.
7159,"Elincia: King Caineghis is always thinking of Crimea, isn't he? How can I ever repay him?"
7160,"Ranulf: Princess... Let's win your country back. When that's done, please rebuild the bonds of friendship between our nations. That would be the ultimate way to say thank you, wouldn't it?"
7161,"Elincia: Yes! Yes, of course!"
7162,"Petrine: So they're finally here, are they? Has the work on the bridge been finished? And your answer had better be yes!"
7163,"Daein Soldier: Y-yes, General! Do you think it will work?"
7164,"Petrine: Sometimes the simplest of traps offer up the best results. Lure the enemy in, and then finish them off one by one. Got it?"
7165,"Petrine: Listen up, dogs! There will be no retreating today! We stop Crimea's advance here! We will not allow them to gain the comfort of their homeland! Any who do not fight to the death will face my lance!"
7166,"Ike: There's the bridge... Wow, it's huge... I doubt if Daein's going to let us cross over without objection."
7167,"Ranulf: Yeah, I think that's highly unlikely."
7168,Ike: Titania! It's time to march! Make sure the troops stay alert and move with caution!
7169,"Titania: Understood, Commander!"
7170,"Ranulf: Say, Ike. There's one thing I've been meaning to ask you."
7171,Ike: What is it?
7172,Ranulf: I haven't seen Nasir around. What's happened to him?
7173,Ike: He was declared an enemy combatant and locked up.
7174,"Ranulf: What? Hey, I understand you being irked that he didn't mention testing you and all, but treating him like a criminal is too--"
7175,Ike: Testing me? What are you talking about?
7176,"Ranulf: Huh? Oh, um... Nice weather, eh?"
7177,Ike: We're going to talk. Now.
7178,Ranulf: Nasir is a Daein spy? No way! That's not possible! He was our spy!
7179,Ike: You're telling me he was a Gallian spy? None of this makes sense to me...
7180,"Ranulf: He worked for us on behalf of the king. But...Daein? As a laguz, he would have absolutely no reason to work for them."
7181,Ike: But there was a Goldoan named Ena who was working as a general for Daein.
7182,Ranulf: ...Are you serious?
7183,"Ike: Yes, we were forced to fight her in the Daein capital. When we attempted to capture her, Nasir intervened and allowed her to escape. He betrayed us."
7184,Ranulf: What? Hold on a minute...
7185,"Ranulf: Maybe that was... If that's the case, then I can see why...No, even so, teaming up with Daein is just too much...hmm......"
7186,"Ike: I hate to interrupt whatever it is you're doing, but we've arrived at the bridge."
7187,Ranulf: Let me speak to Nasir. Please!
7188,"Ike: Once we've finished this battle, we can go together. All right?"
7189,Ranulf: Of course.
7190,"Petrine: All right, Haar! Time for you to go to work."
7191,"Haar: Zzzzz... No, Mom, five more minutes... Zzzzzzzzzz..."
7192,"Petrine: Dozing off on the battlefield... You've got a lot of nerve, don't you? Hey! Wake up or I'll burn you to a crisp!"
7193,Haar: Zzzzz... Snort! Huh? Wha--? Uh... Right! Has the enemy arrived?
7194,"Petrine: Yes, they just got here. Now get out there and do your job."
7195,"Haar: Oh, I'm all over it. Yaaaawwwnnn..."
7196,Petrine: What an absolute fool.
7197,"Ranulf: Well, here we are! And there's the Daein army on the other side as expected! They're already in battle formation and waiting to give us a warm welcome. Aw, that's charming!"
7198,Ike: That's just what I want.
7199,"Ranulf: Oh ho! Well said. And by the way, I thought I'd join you today."
7200,"Ike: Not as a Gallian, but as part of our army, right?"
7201,"Ranulf: If it's a problem, I can always sit this one out."
7202,"Ike: Of course not! Thanks for your continued support, Ranulf!"
7203,Ranulf: Ha! The pleasure's all mine! Let's go carve us some Daeins!
7204,Haar: Attention... Let's...yaaawwnn...go. Hmm...maybe I can catch a nap while we fly...
7205,Haar: ...Now then...Let's see how things look.
7206,Jill: Captain Haar?
7207,"Haar: Greetings, Jill. So you're still alive, eh? Good to see."
